filename,transcript,stt_confidence
HOUSE_VA05_CLF_SHARES_THEIR_BELIEFS,"Is this extra spending on police? He believes what they believe. Criminal Justice System, radical left wants to dismantle America. Stop the rapper.",0.8656768202781677
HOUSE_VA05_DCCC_DOING_YOUR_RESEARCH,"I hope you're all doing your research. You will see that. Bob good has radical bad ideas for Virginia trillion, dollars to the debt, even wants to raise the retirement age for Social Security. But make us pay more. We can't afford but I'm good. He's just too dangerous for Virginia.",0.9120267033576965
HOUSE_VA05_GOOD_ITS_A_CLEAR_CHOICE,"It's a clear choice, Cameron Webb way to radical republican, Bob, good stands for the flag. And with President Trump pre-existing conditions, and he always supports law enforcement, good and I approve this message.",0.9476873874664307
HOUSE_VA05_GOOD&NRCC_GOVERNMENT_RUN_HEALTHCARE,"Radical liberals. Want, government-run Health Care, pay for with huge tax increases government program. Healthcare. Donald Trump will protect Medicare.",0.8858234882354736
HOUSE_VA05_GOOD&NRCC_KNEEL,"Washington, Democrats police. Camera with his liberal allies will never stand up for law enforcement for a strong America. Bob good and President Trump approve and record of supporting law enforcement and like Trump bomb. Good Will Never kneel and I approve this message.",0.9090122580528259
HOUSE_VA05_HOUSEMAJPAC_ALL_ABOUT,"Good, it's all about the weather. It's working for a predatory. Payday lender, or as Campbell County, Supervisor. Voting to give a drug, come half a million in taxpayer-funded ways. Even after they pushed dangerous opioids in our community. Then breaking the law by failing to disclose. He owned stock in that very same company. Scammer log. That's Bob. Good House. Majority Pac is responsible for the content of the Sanford.",0.9385474920272827
HOUSE_VA05_NRCC_DEFUND_THE_POLICE,Defund the police and longer 911. Wait times at RC Theaters Swanson for the content of his advertising.,0.9571874141693115
HOUSE_VA05_NRCC_WES_NANCE,"I've been a prosecutor in this area for 24 years on the police or law enforcement officers, on the streets, emergency calls for the prosecutor politician, but he sure talks like one.",0.9314298629760742
HOUSE_VA05_WEBB_BIG_STAKES,"Stop code doesn't want you to know that he owns Big Steaks and big opioid companies as a supervisor, contracts of Campbell County, corporate and outs with our tax dollars. It is scheme supposed. I'm Cameron Webb. Then I approve this message.",0.941582202911377
HOUSE_VA05_WEBB_REPUBLICAN,"I'm a Campbell County Republican. I'm a fiscal conservative, independent Republican, but I'm supporting doctor, Webb insurance company workers and webs not afraid to take on China. The party is the right man for the job. I'm too and I approve this message.",0.9011527895927429
HOUSE_VA07_CFGACTION_NAME_ON_THE_BALLOT,"When you see Abigail spanberger name on the ballot, look a little closer. It's not her. You're voting for or against its Pelosi and the tax increases. She's planning using spanberger the boat. That's the real Choice, higher taxes and a stall. Recovery spanberger votes 91% with 100% for spanberger and if we vote for her, they'll raise taxes on you.",0.9524821639060974
HOUSE_VA07_CLF_STAYED_AT_HOME,"In 2020, we stayed at home, but where will you go? When you get there, you would raise taxes. That percent of the time supported the higher income taxes. Now, pushing policies, that could raise payroll taxes $2,300 a year since spanberger home before, she texts you out of yours. Congressional leadership fund is responsible for the content.",0.9547610282897949
HOUSE_VA07_FREITAS_CROSSROADS,"America's at a Crossroads and we have some difficult decisions to make in the idea that you would raise taxes or regulations in the midst of this crisis is just wrong, bureaucracy in DC are going to be found in the creativity of a small business owner of the compassion of a nurse. The first responder that rushes into danger business is struggling to stay open and I approve this message.",0.9442393183708191
HOUSE_VA07_FREITAS&NRCC_LOVE_TO_SPEND_YOUR_MONEY,"I'm Nick Freitas. And I approve this message. Love to spend your money. They even voted to spend public funds on their political campaigns up to 5 million dollars. Each for travel expenses, staffers, even tv ads and Abigail spanberger sided with them. Not you now. She's bragging about it in. You guessed it, a TV ad, Washington, Democrats, and Abigail spanberger. They fled your TV with attack ads. You get stuck with the bill.",0.9484618902206421
HOUSE_VA07_HOUSEMAJPAC_NO_EXCUSE,"Sometimes there's no excuse for this was the only insurance coverage for children with autism, twice against background checks, for daycare employees, feel supported by both parties because it protects our kids, and there's no excuse. Tax responsible for the content of this advertising.",0.9377160668373108
HOUSE_VA07_SPANBERGER_RURAL_VIRGINIANS,"The pandemic has been tough on Rural Virginia. So I worked across the aisle to get emergency relief to Farmers, but for years politicians have ignored rural communities. That's why I push to be on the committee works with Republicans and Democrats to pass the president's trade deal and led legislation to expand, reliable internet to farms and small towns. Abigail spanberger. I approve this message because we shouldn't leave any part of Central Virginia behind",0.9568893909454346
HOUSE_VA07_SPANBERGER_SERVE_AND_PROTECT,"I'm Abigail spanberger to keep our country safe in Congress. I have the same Mission and I'll take on anyone, lobbyist special interest even my own party to do what's right false attack ads in the Billionaire's behind them. I approve this message because for me, it's always about service to Country.",0.8768467307090759
HOUSE_VA07_VOTEVETS_BOB_HATCHER,That Nick Freitas.,0.8169134259223938
HOUSE_WA03_CLF_DC_RADICALS,"And her DC radicals are supporting big tax or Carolyn Long, Long support, raising taxes on Washington families by $2,300 and 20% would be the largest tax hike in history. Carolyn Long.",0.9331264495849609
HOUSE_WA03_HERRERA-BEUTLER_SEVEN_YEAR_OLD,"I have a 7 year old with a kidney transplant, existing conditions, as a mother, just a protections for pre-existing condition. Public option plan that has funding for hospitals and Friends access to doctors. I'm Jaime. Herrera beutler. And I approve this message because I stayed up to both party to protect our Healthcare.",0.9480915665626526
HOUSE_WA03_LONG&DCCC_SUPPORTERS,I was the supporter in 2016. Miss managing covid-19 drug industry skis and she sold us out and Carolyn long and I approve this message.,0.9198976755142212
HOUSE_WA03_NRCC_POCKETS,"Someone didn't spare change and Carolyn Long. How did she get in there? Long would raise your taxes for a small business taxes and make it easier to raise? Told Longwood, use public funds to pay her personal expenses. She's already paid her self $10,000 money would make its way from your pockets to a Carolyn Long taken from your pocket lining. Her own nrcc is responsible for the content of his advertising.",0.9619174003601074
HOUSE_WA05_WILSON_220000_DEAD_15,Wilson.,0.8892599940299988
HOUSE_WA05_WILSON_PLEDGES_ALLEGIENCE_TO_DONALD,"Do pledge of allegiance to Donald Trump. The most divisive president in history. Not stand. One Nation, torn. Apart by a reckless president would like to think he's Above. The Law is clear. people of Eastern Washington and the",0.911324679851532
HOUSE_WA08_JENSEN&WARP_ARMY_RANGER,"He was an Army Ranger stars, Jesse Jensen on four combat tours, they served together and now, Jesse's running to serve again. He'll focus on keeping taxes low, so we can rebuild our economy because as a husband and father, he knows we can do better, Jesse Jensen.",0.9316994547843933
HOUSE_WA09_BASLER_CIVIL_WAR,"Who are the real racism? The Republican party was founded to abolish slavery and over 300,000 white. Republican man, died to ended the Democrats for a majority Republicans. You can help fight racism again, vote, Republican and I approve this message.",0.9483923316001892
HOUSE_WA09_BASLER_DEMOCRATS_BLEEPED_UP_EVERYTHING,"What happened to Washington State? Democrats. Everything over 30 years of democrat. They pass a graphic kindergarten sex at law. There's traffic homelessness in the streets, Washington.",0.9585652351379395
HOUSE_WA10_STRICKLAND_ODETTE,"Running a small business. Can be challenging Maryland? Strickland was instrumental in helping us Thrive. She was very responsive and understood. Our needs is this is the engine of the South Sound economy in Congress, will work with both parties to help small businesses reopen, stay open, and hire people that and take care of workers, bypassing paid family, leave and making health care more affordable. I'm Marilyn Strickland and I approve this message.",0.9621936678886414
HOUSE_WI03_KIND_REGULAR_GUY,"Just like me to my voice. I'm rhonchi whether it's hunting fishing or just getting Outdoors. Outdoor recreation is an important way of life here in Wisconsin, and I'm working to make sure it stays that way, the Great Outdoors. Ron kind is Wisconsin, Wisconsin strong. I'm Ron kind and I approve this message.",0.9563186764717102
HOUSE_WI03_KIND_SPORTSMAN_DAD_PACKERS_FAN,"He's a sportsman, a dad. And a Packers fan runs in families farmers and small businesses. The support. They need to get through the pandemic and leading by example in the fight against covid-19. This is an issue. Ron kind is Wisconsin, Wisconsin strong. I'm Ron kind and I approve this message.",0.9279987812042236
HOUSE_WI03_VANORDEN&WIRP_UNFAIR_TRADE_DEALS,"Decades of thousands of Family Farms in Wisconsin. President Trump worked out a fix for Farmers great. Trade deal usmca. Ron kind of Nancy Pelosi, they played politics, they held up the tray, fix for eight months while Wisconsin Farms close. Derrick Van Orden in the seals. I learned that leaders take action to put their people first and that's why I approve this message.",0.9680010676383972
HOUSE_WI05_PALZEWICZ_CHANGE_OUR_MINDS,"We've all changed at the height of the Cold War. I know what servant leadership means I came back to Wisconsin went to school. Start a family and finance help, bring Integrity back to Congress and I approve this message.",0.923501193523407
HOUSE_WI05_PALZEWICZ_FATHER_15,"It's going to be even bothered to know, a man who the veteran has a different background, and I think he really cares about people, and I approve this message.",0.8298364281654358
HOUSE_WI05_PALZEWICZ_GROWING_A_BUSINESS_15,"Growing a business is an easy. It's hard work. I'm going to bring that same work, ethic to Congress. I work with Wall Street at work with Main Street. Not helped create over 2,000 jobs in southeast Wisconsin. It's time to build an economy that works for all of us.",0.9176571369171143
PRES_AMERICAFIRST_BACK_TO_WHAT,"Biden says he wants to bring back America. Put back to what for five decades. Biden supported trade deals. That ship jobs overseas. Biden would get into a run again. Make us pay to give illegal immigrants, Healthcare and Biden promise to raise our tattoos on day one. They want Joe Biden. He won't bring back America. He'll take down America, America first.",0.9584140181541443
PRES_AMERICAFIRST_BLESSING,"Everyday. I get to work. Is a blessing. Fractions hard work. Pays off. Wrapping a baby in November just a week before the election, for, when Joe Biden says, he'd eliminate fracking about my job to talk about our future, Joe Biden devastating for America. First action is responsible for the content of this advertising.",0.9400626420974731
PRES_AMERICAFIRST_HARD_WORK,"America was built with hard work and Big Dreams, but for decades, Joe Biden, sold us out to China softrade deals week, appeasement by accident or Worse. Biden ship, tens of thousands of our jobs overseas as president. What makes you think he'd be any different America First action is responsible for the content of this advertising.",0.9466544985771179
PRES_AMERICAFIRST_NERVOUS,"It makes me nervous that Joe Biden is going to raise taxes in this economy. Never run a small business don't bite. Has no idea how to run our country, how to fix anything. He can Hotel knows what is best for us because he hasn't done, it's done by that means more taxes. America First action is responsible for the content of this advertising.",0.9270136952400208
PRES_AMERICAFIRST_PAOLO_SP,Copa America.,0.5400129556655884
PRES_AMERICAFIRST_PLAY_BY_THE_RULES,"You work hard play by the rules of this whole town, all these jobs and all these families that makes me sick this place. He just doesn't get it. America First action is responsible for the content of this advertising.",0.9490480422973633
PRES_AMERICAFIRST_TONY_BOBULINSKI,There was no other reason for me to be in that bar meeting to discuss what I was doing with his family's name in the Chinese the knowledge whatsoever of his son's business dealings and was not involved in them at all Enterprise. America First action is responsible for the content.,0.9459984302520752
PRES_AMERICAFIRST_TRANSFORM,"Deliver my lesson plan to fundamentally transform the country and it could happen. Total control. Loc speaker Schumer leader and in the White House, The Liberals will pass their agenda and he'll sign it, and if they win our recovery, these over to stop them yet to stop. America First action is responsible for the content of this advertising.",0.9541352391242981
PRES_AMERICAFIRST_WE_ARE_AMERICA,Joe Biden saying he will raise taxes on the middle class and his liberal agenda will cost millions of jobs because I'm too weak to rebuild but we won't let it. We will build a better future with courage and strength because we are America and Donald Trump is our president America first.,0.9336949586868286
PRES_AMERICAFIRST_WE_ARE_AMERICA_SP,"OK, Google Ito. Donald Trump is Metro Presidente American production.",0.7570048570632935
PRES_BIDEN_A_PLACE_FOR_EVERYONE_60,"I love you. I just wanted to say hi. I can't priests like you guys. America is a place for everyone. Those who chose this country, those who fought for it. Some Republicans some Democrats than most just somewhere in between all looking for the same thing. Someone who understands their hopes their dreams their pain to listen to bring people together to get up every day and work to make life better for families like yours to look you in the eye. Treat you with respect and tell you the truth to work just as hard for the people who voted for him, as those who didn't to be a president for all Americans, Joe Biden. And I approve this message.",0.9704488515853882
PRES_BIDEN_AMERICAN_PRESIDENT_60,"But I will govern as an American president. I work with Democrats and Republicans. I work as hard for those who don't support me as for those who do We will act on the first day of my presents. Did you get covid-19? Passed my health care plan for healthcare. Faith in democracy and our faith in one another or become one nation under God. Indivisible, and I'm Joe Biden, and I approve this message.",0.9361905455589294
PRES_BIDEN_BECAUSE_SP,What's the temperature in Mexico? Criminal rapist. But that's where I am originally from. For telling me. I'm Joe Biden and I approve this message.,0.9676740169525146
PRES_BIDEN_BESSIE_SP,Net worth of Joe Biden.,0.5635438561439514
PRES_BIDEN_BLACK_LIVES_MATTER,"This is Joe Biden. Black lives matter. I'm not afraid to say it in equities, have to be met. Head-on African Americans need a fair shake when it comes to Economic Opportunity, Healthcare criminal, justice education, and housing. That's why if I'm elected will raise the minimum wage to a living wage of $15 an hour without systemic racism justice system. So I'm asking for your vote on Joe Biden tonight.",0.9553678035736084
PRES_BIDEN_BLACK_LIVES_MATTER_60,"This is Joe Biden. Black lives matter. I'm not afraid to say it in equities. Have to be met head-on. African Americans need a fair shake when it comes to Economic Opportunity. Healthcare criminal, justice education, and housing. That's why if I'm elected will get covered under control by listening to the raise the minimum wage for a living wage of $15 an hour. For check the Affordable Care Act provide 100 billion dollars in capital. For minority small business offer a real plan to tackle, the student debt crisis without systemic racism in our criminal justice system and cash bail to criminalize marijuana. In automatically, expunge prior convictions. Let's build back better, but I can't do it without you. So I'm asking for your vote. I'm Joe Biden and I approve this message.",0.9679651260375977
PRES_BIDEN_BRING_PEOPLE_TOGETHER_60,"One thing I love about you is that he has the same credible ability to bring people together in the Senate while so many people would cut each other down. Joe would bring them to the table. Sometimes. Literally, he and his colleagues would gather around the picnic table in our backyard, talking and debating, because Joe always understood if you're just trying to score points for your party. There's no need to actually talk to the other guys. But if you're trying to get things done to really make things better for working people, you have to find Common Ground, our country feels more divided now than at any other point in my lifetime. We need someone to remind us how to look for the best in each other, how to find solutions that can work for us all. I can't think of a better person for the job than Joe.",0.9684716463088989
PRES_BIDEN_BRING_THIS_COUNTRY_BACK_15,"Together, we can bring this country back. We'll start by raising the minimum wage to $15 an hour. I'm Joe Biden. I'm asking for your vote because I always fight for the middle class. That's why I approve this message.",0.9159830808639526
PRES_BIDEN_BUILD_ON_VAWA_60,"I'm Joe Biden and I approve this message. Finger someone like me. Violence has been physically and mentally broken down and then Wednesday you'll be in the newspaper. That is Senator that you don't even know if fighting for a bill to be passed to help women like myself to keep us safe and to provide transitional housing because I was homeless due to domestic violence. Joe Biden became my hero that day cuz he didn't even know me and he was fighting for me. And my son might even though he didn't know it, he means so much to me because of that. We believe in Joe Biden. I hope he makes it the white house because I know he's going to make it the White House. He's an amazing person.",0.9779204726219177
PRES_BIDEN_CARING_FOR_ALL_SP,"Set reminder. Not only a human being but could be one said, it means caring for all and leading with empathy matter the challenges. It means showing compassion for your neighbor. You see said, mono can mean different things, but for president said, whom I know to be one to never be optional and I approve this message.",0.9512628316879272
PRES_BIDEN_CHANGE_60_SP,"Beyond Oak, asDwight Schrute this message.",0.8307156562805176
PRES_BIDEN_DAVE_BAUTISTA_60,"We talked about the difference of being tossed into someone who portrays himself as a tough guy. It's easy to lie to people. It's easy to bully people. It does not make you a tough guy. They want to hear, it's not easy, to tell someone what they need to hear. We're not in good shape. But this is how we're going to get out of it. That is being tough this country more than anything right now needs someone who's going to have a plan so we can get back on track and leader is someone who can unite people, who takes responsibility that toughness. That is Joe Biden.The guy who was respected who can talk to people who can work out disputes, the guy who can be a leader. He's stepping back into this fight for American. It's that simple. That is the guy really running this country.",0.968877911567688
PRES_BIDEN_DINA_60,"We were busy all the time. And now we're at 30%, but we were last year. We have to make it work. Only option, really? Looking at the numbers Rising every day, knowing somebody who really hard. This is serious. It starts at the top and we were United as a country. It is not like that though. He has divided all of us. She's actually made it worse than it ever needed to be for kids to the school to get this under control. I mean,Harbor Freight. I think he'll do a much better job at uniting us as a country. I trust Joe Biden to do that.",0.9665752649307251
PRES_BIDEN_ELECTION_DAY_AZ,"This is an important election announcement. You can vote in person on Election Day. Tuesday, November 3rd. Remember to bring your ID, please bring a government-issued photo ID or non photo IDs with your name and address. If you were in line, when the polls closed, you can still vote. Go to iwillvote.com or vote for AZ, for more information on Joe Biden, and I approve this message.",0.9558421969413757
PRES_BIDEN_ELECTION_DAY_AZ_15,Election day is Tuesday. November 3rd is when the pools closed you can still vote for more. Iwillvote.com. I'm Joe Biden and I approve this message.,0.9802849292755127
PRES_BIDEN_ELECTION_DAY_FL,"This is an important election announcement. You can vote in person on Election Tuesday, November 3rd. Remember to bring a photo ID with proof of signature. Go to iwillvote.com for a complete list of acceptable, forms of photo IDs. If you're in line, when you can still vote, call 1833 La for more information. Make a plan to vote today. I'm Joe Biden and I approve this message.",0.96755450963974
PRES_BIDEN_ELECTION_DAY_FL_15,"Election day is Tuesday, November 3rd. Remember to bring your ID if you were in line. When the pools closed you can still vote for more. I will vote.com. I'm Joe Biden and I approve this message.",0.9851273894309998
PRES_BIDEN_ELECTION_DAY_GA,"This is an important announcement. You can vote in person on Election Day. Tuesday, November 3rd. Remember to bring your photo ID, polls closed. You can still vote. Remember to stay calm. 05816 for more information. I'm Joe Biden.",0.9837992787361145
PRES_BIDEN_ELECTION_DAY_GA_15,"Election day is Tuesday, November 3rd. Remember to bring your photo ID. If you were in line, when the pools closed you can still vote cam or call for more information on Joe Biden. And I have truth.",0.9003701210021973
PRES_BIDEN_ELECTION_DAY_MI,"This is an important election announcement. You can vote in person on Election Day. Tuesday, November 3rd. You can also register to vote on Election Day at your Clerks Office. If you want, you can still vote. Call 1833 votes, for more information, and make a plan to vote for Joe Biden. And I approve this message.",0.9817947149276733
PRES_BIDEN_ELECTION_DAY_MI_15,"You can vote in person on Election Day. Tuesday, November 3rd. Go to iwillvote.com to make a plan to vote. Joe Biden and I approve this message.",0.9874765276908875
PRES_BIDEN_ELECTION_DAY_NC,"This is an important announcement. You can vote in person on Election Day. Tuesday, November 3rd. Go to vote.com and make a plan to vote. If you're in line, when the polls closed, you can still vote for more information, and make a plan to vote. Joe Biden.",0.9876290559768677
PRES_BIDEN_ELECTION_DAY_NC_15,"You can vote in person on Election Day, Tuesday, November 3rd. If you're in line, when the polls closed, you can still vote. Go to iwillvote.com to make a plan to vote on Joe Biden. And I approve this message.",0.9707782864570618
PRES_BIDEN_ELECTION_DAY_NV,"This is an important election announcement. You can vote in person on Election Day. Tuesday, November 3rd. You can register at your polling place on Election Day. Picture in line. When the polls closed, you can still vote. Call 1525 vote for more information. Iwillvote.com and make a plan to vote. Joe Biden and I approve this message.",0.9857324957847595
PRES_BIDEN_ELECTION_DAY_NV_15,"Election day is November 3rd if you can still vote, and make a plan to vote. Thank you. Joe Biden and I approve this message.",0.9785130620002747
PRES_BIDEN_ELECTION_DAY_PA_15,"Is November 3rd. If you're in line, when the polls closed, you can still vote vote.com and make a plan to vote. Thank you. I'm Joe Biden and I",0.9417880773544312
PRES_BIDEN_ELECTION_DAY_WI,"Election day is November 3rd. If you're in line, when the polls closed, you can still vote to remember a photo ID is required. Thank you. I'm Joe Biden and I approve this message.",0.9347879886627197
PRES_BIDEN_FIRE_SEASON_90,"Decoration. Probably the rest of the year. It's taking a toll to the mental health of the people who have to fight these fires. Can we work today at 5 in the morning? For seven years. Now, we're all together. We all can either free three words or have the consequence. We need to make this progression.",0.980366051197052
PRES_BIDEN_FIX_THE_ECONOMY,To fix the economy. We have to get control over the buyers. We need increased Federal support for the number of drive-thru testing sites in public. Real guidelines would uniform Nationwide in simple proposition. I'm Joe Biden and I approve this message.,0.9666930437088013
PRES_BIDEN_GENERALS_60,"General John Kelly, Donald Trump's former white house chief of staff calls. Trump unhinged said, his dishonesty is astounding. Secretary of Defense says, Trump is dangerous and calls him unfit to be Commander in Chief Donald Trump. Call those who served losers and Joe Biden believes their Heroes. The former commander of US, Special Operations forces. Admiral Bill mcraven supports, Joe Biden, so does retired General Stanley McChrystal who let our forces in Afghanistan. He says, I can trust Joe Biden, 22, 4-star. Generals, and Admirals. Say Biden, would make a better Commander in Chief. It's no wonder. Military time, says more active duty, service members are supporting Joe Biden, Joe Biden. And I approve this message.",0.9609222412109375
PRES_BIDEN_GONNA_BE_THE_CHANGE_60,I'm Joe Biden and I approve this message.,0.9392750263214111
