filename,transcript,stt_confidence
USSEN_AZ_MCSALLY&NRSC_JJ,I approve this message to keep a family of four on a budget. So $15 to build his business.,0.9350628852844238
USSEN_AZ_SMP_DOING_IT_AGAIN,"She did it two years ago. Now she's doing it. Again. Martha McSally will say, or do anything running as exposed as a line to let insurance companies.",0.9531136155128479
USSEN_AZ_SMP_EARLY_VOTING_SP,Kelly.,0.7290987968444824
USSEN_AZ_SMP_LINDA_C,"After the last election, I knew Martha McSally would do anything to get ahead. So a hundred billion dollars is not something that was given to me. I heard it. You do this to your own mother I guess so.",0.913811981678009
USSEN_CO_HICKENLOOPER_JARED_POLIS_SP,"Dangle the carrot cake. Washington, d.c. Progressive super letter.",0.5996190309524536
USSEN_CO_HICKENLOOPER_JESSIKA_SP,Counter dos veces. Dentist in Gardner. I ever see them as the only distances.,0.8615209460258484
USSEN_CO_HICKENLOOPER_NEWSPAPER_ENDORSEMENTS,"Across Colorado newspaper is John Hickenlooper, the big problems, but Cory Gardner of fraud, a charlatan of trump. We need leaders who can work with each other and Trust on John Hickenlooper. And I approve this message.",0.9232335686683655
USSEN_CO_HICKENLOOPER_ONE_HUNDRED_PERCENT,"I'm John Hickenlooper this message. 6 years ago for my party is wrong. I'll say it when something is broken. I'll fix them 25% of the time 50. There was no waiver. How's that working out for you? There was no waiver with Cori. Thank you, Cory.",0.9216254949569702
USSEN_CO_HICKENLOOPER_OPTIMIST,"I've always been an optimist no matter how broke we can find a Better Way Forward. That's why I want to go to the Senate to fundamentally change. Washington, biggest problems getting people. I approve this message. It all starts with your vote.",0.9558306932449341
USSEN_CO_SLF_CONTEMPT,We thought we knew John Hickenlooper DC to pass government-run healthcare for the Socialists energy schemes. Can't trust John Hickenlooper to stand up for us. After all. I don't think I'm cut out for that.,0.9076215624809265
USSEN_GA_COLLINS_MAO_TSE-TUNG,"I'm Doug Collins and I approve this message, They're Buckhead, estate her. Love of their money explained, the Chinese flag Leffler hung up her New York, Stock Exchange, and lefler's refusal to cut ties with China, controlled companies that make her Millions is a conservative who looks out for herself.",0.9396488666534424
USSEN_GA_LOEFFLER_KEMP_ENDORSEMENT_2,"Mutant in what Washington hate is a strong conservative, Outsider Outsider in the most Pro Trump conservative, Senator and all of America. Don't fall for the faucet acts Kelly fights for America and What Makes Us great everyday? I'm proudly voting for Kelly. I hope you will too. I'm Kelly Loeffler. I approve this message.",0.936363160610199
USSEN_GA_LOEFFLER_THE_PERFECT_PICTURE,"Kelly Loeffler, I approve this message, Doug, Collins picture of a devoted with Nancy Pelosi over 800 times, the State Common Core, the perfect picture, Washington career politician.",0.9349139928817749
USSEN_GA_LOEFFLER_TRUMP_ENDORSEMENT_2,"Kelly Loeffler. Kelly has been fantastic. She was with me a hundred percent on the impeachment hoax. She's been with us all the way and she's a great woman and we definitely need Kelley. Country. I'm Kelly, Loeffler. I approve this message.",0.902627170085907
USSEN_GA_OSSOFF_CLASSIFIED_BRIEFING,"I'm Jon ossoff and I approve this message weeks before the stock market crashed. The Senate received a classified briefing on covid-19. That shamed a penny board vaccine shares. Don't casinos. Stock trades while the rest of us were in the dark at the same time. David Perdue told us the risk was low, and have little impact on our economy. David Perdue lied to us while you line is",0.9303007125854492
USSEN_GA_OSSOFF_PAY_FOR_IT,"I'm Jon ossoff, I'll fight to end price gouging by insurance and drug companies to make Healthcare fordable. Health Care hard for your money. And you deserve a senator who understands that.",0.9080224633216858
USSEN_GA_OSSOFF&DSCC_QUARANTINED,"Hey, it's Jon ossoff from home. Has a doctor at the hospital. She tested positive for covid. So we're quarantine. I'm so so grateful. She's getting better. But too many Americans are still getting sick. Listen to Medical experts. Coordinating National testing strategy. They're doing their jobs. It's way past time. Politicians did theirs.",0.9454094171524048
USSEN_GA_OSSOFF&DSCC_UNPREPARED,"And I approve this message. Those numbers are nowhere near what was projected. Feeling very well. It's going very well, David Perdue. Ignored the medical experts, downplayed the crisis and left us unprepared.",0.948828935623169
USSEN_GA_PERDUE_WORKS_FOR_CHINA,"I'm David Perdue. And I approve this message by the communist Chinese government through a media company to a giant accused of spying off of, didn't disclose to Federal authorities that. He's personally profiting from the same Chinese government that gave us covid-19 accountable.",0.9157850742340088
USSEN_GA_SLF_EXONERATED,"Did Purdue was exonerated. Ethics official said he followed the rules? No wonder. Fact-checker said, John also says asphalt, you should cash from Chinese Communist, a terrorist sympathizer.",0.9336925148963928
USSEN_GA_SMP_FOOL_YOU,"Greedy, he's never been for you. He is responsible for the content of his dad.",0.8881435990333557
USSEN_GA_SMP_POLITIFACT,"Produced insurance for false, actions for people with pre-existing conditions. For X, $75,000 from the insurance industry is cleared. Just doesn't care about you.",0.9229264855384827
USSEN_IA_AFSCME_NANCY,"March today. I'm waiting on surgery for pre-existing condition in the middle of all this existing conditions. Well, I have pre-existing conditions. But so nearest is siding with the insurance industry, protect their profits instead of protecting people like me, it's clear. Joni Ernst has lost her way. We need a change.",0.9542291164398193
USSEN_IA_AMERICANCROSSROADS_SIGNATURE,"Theresa Greenfield signature in her wake and Greenfield. She jumped ship to another big-shot executive to the curb to allow of foreign-owned Corporation to move in. Its Theresa Greenfield, American Crossroads is responsible.",0.9277549982070923
USSEN_IA_AMERICANCROSSROADS_THE_CHOICE,"This campaign comes down to fundamental differences. Theresa. Greenfield has a record of hurting small business and close, Iowa rural hospitals. I trust Joni Ernst to keep fighting for lower taxes and to support law enforcement and it's that important.",0.9495612978935242
USSEN_IA_DSCC_SOCIAL_SECURITY_2,"We've dated a social security our entire lies burned it with every paycheck. But Joni Ernst would take it all the way. Just let the same Wall Street Banks, billions first. Admitted. She was talking about privatizing social security, and then was caught saying the deal should be done, quote behind closed doors, Social Security, and we can't afford to vote for Joni Ernst. The SEC is responsible for the content.",0.9242022037506104
USSEN_IA_GREENFIELD_COME_TOGETHER_60,"You can see it in our town. Ant farms. Help for a neighbor or a stranger, who needs a hand. We come together to solve problem on the farm. My dad always said there's no boy or girl. Just need to get done and Washington's too broken to do it and do nearest. She's become part of the problem. Courtney said, in a middle of a Washington politicians would rather fight than past relief and get our economy back on track. I'll work with anyone democrat, or republican, because we need less bickering, and more listening. So we can get things done, and I'll send up to my own party leaders and the special interests who try to block change to do. What's right for Iowa. I'm Theresa Greenfield and I approve this message because I'll be a senator for Iowa.",0.9806817770004272
USSEN_IA_GREENFIELD_JUST_JOBS_2,"On the farm. My dad always said there's no need to get done a lot that needs fixing and Washington's too broken to do it and do nearest, she's become part of the problem. I'll work with anyone democrat or republican to get things done and I'll stand up to the special interest to try to block change on Theresa Greenfield. And I approve this message because I'll be a senator for Iowa.",0.9409759640693665
USSEN_IA_GREENFIELD_PAUL_FITZGERALD,"I spent over 40 years of law enforcement, and I can tell you that Theresa Greenfield will protect Iowa family, untrue. You should go to prison and to protect our borders.",0.9349369406700134
USSEN_IA_GREENFIELD_TOUGH_TIMES_60,"You can see it in our town. Ant farms. Get help for a neighbor or a stranger. Who needs a hand in Iowa. We know how to overcome tough time. I grew up during the farm crisis, and when my husband died, I was on my own, we had a 13 month old. And another one on the way Independence, that hard work. First things. I learned early on, on the farm. My dad, just jobs that need to get done. And I'll work with anyone democrat or republican to get things done. Because we need less bickering and more listening, and I'll send up my own party leader to do. What's right for Iowa. I'm Theresa Greenfield and I approve this message because I'll be a senator for Iowa.",0.9767900109291077
USSEN_IA_GREENFIELD&DSCC_COUNT_ON,"Joni Ernst promised, she be different but she's gone Washington. She's not for us. Anymore, to research, someone we can count on. She puts people first ahead of partisan politics. She will work for both Democrats and Republicans. Good for families like mine. Teresa will stand up for Iowa. I'm Theresa, Greenfield.",0.9231588840484619
USSEN_IA_IAVALUES_LOUDSPEAKER,What is responsible for the content of this advertising?,0.7881739139556885
USSEN_IA_LCVVF_NANCY,"I'm in March today. I'm waiting on surgery for pre-existing heart condition in the middle of all this with pre-existing conditions. Well, I have pre-existing conditions. But Sony has two siding with the insurance industry. Voting to protect their profits. Instead of protecting people like me, it's clear. Joni Ernst has lost her way. We need a change.",0.9615901708602905
USSEN_IA_NRSC_NIGHTMARE,"I think that they have all the power, don't change the Senate rule takeover of Health Care. That provided coverage, open borders, and amnesty for illegal immigrant.",0.9233828186988831
USSEN_IA_PLAINSPAC_SIGNATURE,"Theresa Greenfield Signature. Health of Destruction for Iowa jobs, leaving a company. She helped leave 29 million in debt and unemployed Island in her wake and Greenfield to allow of foreign-owned Corporation to move in its Theresa. Greenfield planes. Pack is responsible for the content of this advertising.",0.9318221211433411
USSEN_IA_SLF_THE_CHOICE,"This campaign comes down to fundamental differences. Theresa. Greenfield has a record of hurting small business and close, Iowa rural hospitals. I trust Joni Ernst to keep fighting for lower taxes and to support law enforcement and it's that important.",0.9449844360351562
USSEN_IA_SMP_BOB,I take this personal.,0.8870239853858948
USSEN_IA_SMP_HELP_HERSELF,"You won't find it here. Any help for Iowa from Joni Ernst. She's gone, Washington. Now, after promising, not to move to DC for his bottle luxury condo, and Jody first voted to raise our own pay different times, and we've already paid her a million dollars Washington to help herself and nothing will change for Iowa until we change Joni Ernst. Smt is responsible for the content of",0.935201108455658
USSEN_IA_SMP_STANDING,"Sometimes when your car hasn't been standing for me, she doesn't stand up to special interests. And she rolls over just follow the money with Johnny. Carson Washington. Nothing will change is not the special interest.",0.9273825883865356
USSEN_ID_JORDAN_LULLABY,I'm Paulette Jordan and I approve this message.,0.915179967880249
USSEN_ID_RISCH_TOUGH,Families and small businesses. That's why I fought for economic assistance for businesses America again on Jim risch. I approve this message.,0.8486979007720947
USSEN_ID_RISCH_WRONG,"Liberals in Washington, d.c. The American dream to hang out and preserve the Second Amendment, and more freedom, lower taxes and more jobs. And I approve this message because America is still the greatest country in the world.",0.920843243598938
USSEN_IL_DURBIN_BARACK_OBAMA,"Hey, everybody. I just want to let you know how proud I am to cast my ballot for my friend, Dick Durbin, for USF. He's been a leader on Criminal Justice Reform, Economic Opportunity and making Healthcare a right, not a privilege, but mostly I want you to know that big turbine is a man of decency integrity and compassion. So, I hope you'll join me and voting to keep Dick Durbin standing up for us. I'm determined and I'm proud to approve this message.",0.9525623321533203
USSEN_KS_AFP_MORE_IMPORTANT_THAN_EVER,"Your family's health is more important than ever, but millions of families are healthful and fewer options left access. Skyrocketing costs Rodger Marshall wants you to control your Healthcare, his plan better quality more access lower-cost, protect your health care Rodger, Marshall Americans for Prosperity, action is responsible for the content of this advertisement.",0.9315459728240967
USSEN_KS_AMERICANCROSSROADS_TOO_EXTREME,"Probably seems really nice. She says she's her policy positions are just not mine. She wasn't on the issues. American Crossroads is responsible for the content of the Sanford, icing.",0.9384902119636536
USSEN_KS_BOLLIER_ALWAYS_OPEN,"Is always open to Democrats to Republicans and to Independence. It's open to those who agree with her and those who don't because Barbara bullying knows the best ideas. Come when we listen with respect to everyone. I'm Barbara Bowl. Yay, and I approve this message, because in the US Senate, my door will always be open.",0.9626181125640869
USSEN_KS_BOLLIER_HELP_HIMSELF,"And I approve this message at the peak of the pandemic. Expected, our officials in Washington to be there for us instead. Congressman Rodger. Marshall used the moment to help himself. He co-sponsored a bill that would allow him to personally profit on his investments in health care companies and then a conflict of interest Rodger Marshall used covid. It doesn't get much worse than that.",0.9446134567260742
USSEN_KS_BOLLIER_LARRY_HIBBARD_2,"I'm a republican who served in the State House, Representatives. I'm supporting Donald Trump, a US Senate. I'm voting for Barbara Boys. She's my she's sensible. She has, and since she's not going to be led by extreme groups. She's not going to be able to see liberal. No way.",0.9330292344093323
USSEN_KS_BOLLIER_OUT_OF_CONTEXT,"You may have seen these attacks that Rodger Marshall is making about me on guns where, once again, they take my words completely out of context beside the point and Democrats, and that's what I do in the US. Senate. I'm Barbara Bowl. Yay, and I approve this message.",0.944770872592926
USSEN_KS_BOLLIER_RESPONSIBLE_SPENDING_CUT_TAXES,"Responsible spending, not exactly what is known for, but it's always been the Hallmark of doctor. Boye, both parties cut taxes for the middle class and to establish of rainy day fund as sensible as a leading moderate voice. That's who Barber has always been. And that's the kind of US senators and Barbara bully and I have",0.9410344958305359
USSEN_KS_BOLLIER_TOGETHER,"I'm a Democrat or Republican. Here. We are together. It's something. We need a lot more of in Washington to do things like balance the budget and reduce healthcare costs. Gather to get things done. I'm Barbara Bowl. Yay, cuz I approve this message.",0.9629843831062317
USSEN_KS_BOLLIER_VOICE_OF_REASON_60,Like the enemy so 180 Republican officials in Kansas crossed the aisle to support. The Democrats is the medical doctor to balance budgets in today's politics independent with the courage to stand up to her own party political agenda. I'm Barbara balliet and I approve this message.,0.9459448456764221
USSEN_KS_DUTYCOUNTRY_MADE_A_FORTUNE,"We've all learned that Rodger Marshall and his wife made a fortune when they're for-profit Hospital, sold after forcing a nonprofit hospital to shut down, but new rules were placed on dr. Owned hospitals, to prevent conflicts of interest, that threaten patient care. Still in Congress while his family, profited from more doctor on Hospital. Looking out for his own interests, Rodger Marshall. He's all about the money. Not your health care.",0.954203188419342
USSEN_KS_MARSHALL_BOB_DOLE_15,"I know, Rodger Marshall, and I trust Rodger. Marshall, Rodger will put the country before self-interest. Thank him for me. Rodger Marshall has the best interests of Kansas at heart. I'm dr. Rodger Marshall. And I approve this message.",0.9380332827568054
USSEN_KS_MARSHALL_LAINA_15,"It doesn't matter to Rodger, what party you are. It's like treating patients. What they could afford to pay or not. He's there to serve everybody to help people so that I'm dr. Rodger Marshall and I approve this message.",0.9107910990715027
USSEN_KS_MARSHALL_PARTY_BOSSES,Dr. Rodger Marshall.,0.9849867820739746
USSEN_KS_NRSC_TELEPROMPTER,"I see things in the Trump tax plan that I likes like C. When they will work together to get help to the people, that's enough. Thank you.",0.9565708041191101
USSEN_KS_SLF_NO_WAY,"I take a more independent approach, independent National Democrats that over 14 million to elect you. And sometimes that means disagreeing with my own party. But you voted 90% with the Democrat. That's almost always. I'm just on the road. Actually. You're a boy. A boy who she says she is.",0.9036418795585632
USSEN_KY_DITCHFUND_BESHEAR_ENDORSEMENT,"Governor. Andy beshear has an important message for Kentucky. We need Amy McGrath of the US Senate. Governor beshear says Amy McGrath and bodies are Kentucky values of family service and caring for our neighbors will fight for our teachers. Protect Kentucky inventions at work for Kentucky families, but Kentucky, I had a party. Join Andy beshear and vote for Amy McGrath for usn.",0.9585829973220825
USSEN_KY_KEEPKYGREAT_BORDER_WALL,"Liberal, Amy McGrath opposes President. Trump's border wall did check it illegal immigrants and more money to Puerto Rico than Kentucky. Amy McGrath is too liberal for Kentucky. Kentucky. Great is responsible for the content of this.",0.913404643535614
USSEN_KY_MCCONNELL_ADVERSITY,"When I was a child America, she purchased my first pair of shoes. So that one day I could walk the steps of the sun to fight for you. Today. We're Cochran covid together. We will defeat this virus and get America back on its feet, Kentucky will lead the way. I Mitch McConnell and I approve this message.",0.9494810104370117
USSEN_KY_MCCONNELL_ADVERSITY_60,"Earliest memory was adversity. My father was at War and so was I when I was a child polio haunted America and my ability to walk, but my beloved mother Against All Odds and with persistence and tenacity. She defeated my first step forward was her greatest Victory as she purchased my first pair of shoes. So that one day, I could walk, the steps of the Senate to fight for you with the same for. See, she taught me today. We're Cochran covid together with Kentucky toughness and compassion. We will defeat this virus and get America back on its feet, and Kentucky will lead the way. I'm Mitch McConnell, and I approve the",0.9579792022705078
USSEN_KY_MCCONNELL_MOCK,"Extreme. Amy McGrath National supporters openly mock, Kentucky, just a little slice of Kentucky right here. In New York City, McGrath taken 90 million dollars from donors for Kentucky. When I approve this message.",0.9343116283416748
USSEN_KY_MCCONNELL_PRESIDENT_TRUMP,"Extreme liberal compared my election. She compared it to 911 grass. Compared President. Trump's election 10 911 the worst terrorist attack in American history, Mitch McConnell.",0.8807989358901978
USSEN_KY_MCCONNELL_STEADY_HAND,"He serves with a steady hand through some of our greatest challenges. Protecting our coal miners tax relief for Kentucky families. Delivering for our Farmers. Our veterans leading the passage of the biggest economic rescue package in history and fighting this virus experience. When it's serious Matters, Most I'm Mitch McConnell, and I approve this message.",0.944884717464447
USSEN_KY_MCGRATH_COUNTRY_BEFORE_PARTY,"I'm an immigrant. No taxes as much as you do, so I'll work to cut them and I approve this message because I'll be faithful to God and only answer to you.",0.9260249733924866
USSEN_KY_MCGRATH_SURE_THING_VA,"I think she's a marine protected. VA cut taxes for the middle class pass covid relief. Lower drug prices. Invest in infrastructure to create jobs and put God and family had a party exact. It's time to change Washington, this message.",0.9343593120574951
USSEN_KY_MCGRATH_VOTE_HIM_OUT_2,"Amy McGrath and I approve this message 2017, Mitch McConnell's Cuts funding for pandemic. Prevention, January 2020. He has access to a secret coronavirus after month away or portable Healthcare October covid cases, search for more eight. I got to decide what we vote. Guide to vote him out.",0.9251547455787659
USSEN_KY_TRUEKYP_FALSE_ATTACKS,"Why on Earth is Mitch McConnell making false attacks against Brett. Baron after 36 years in Washington McConnell scared to be running a career politician. We can trust him to slash government. Waste and balance the budget and Veteran is 100%. Pro-second Amendment 100% pro-life. And yes, 100% limit the true conservative Red Baron for US. Senate Patriots is responsible for the content of December.",0.9687033295631409
USSEN_KY_TRUEKYP_TRUE_CONSERVATIVE,"Bradbury Kentucky's, true conservative for US Senate. Red Baron is a farmer and businessman who will protect our liberties from Washington politicians. Baron will fight to win, waste and balance the budget and bear. What is 100% pro-second Amendment, 100% pro-life, and 100% Pro term limits. Sorry, Mitch. 36 years is too long. Your values and for free, goats for conservative-libertarian, Brad Barrett.",0.9635651111602783
USSEN_LA_CASSIDY_AMY_CONEY_BARRETT,"Growing up in Metairie, Amy, Coney, Barrett attended st. Mary's, Dominican high school was first in her class at Notre Dame law school and then joined the faculty. Now, she's a federal judge President Trump has nominated her to the Supreme Court to Bill Cassidy. Amy, Coney. Barrett is extremely qualified. He will vote to confirm her Bill, Cassidy believe judges should interpret the Constitution to legislate. She will serve America. Well, I approve this message.",0.9674485921859741
USSEN_LA_CASSIDY_NO_OIL_NO_JOBS,"A transition from their own Ministry. Yes. No oil. That means no job. Yes. That means Us. Fake depression. Yes. Bill Cassidy and President, Joe Biden. You will kill those jobs. You won't kill those paycheck to protect our job. Defeat Joe Biden stand with President Trump and re-elect Bill Cassidy to the US Senate. I'm Bill Cassidy. I approve this message.",0.9630049467086792
USSEN_LA_PERKINS_NO_SURPRISE,"I'm Adrian Perkins has taken more than 1.5 million dollars from the insurance industry. That would have kicked 500,000 Louisiana off their Healthcare while making it more expensive for everyone else would even let those with pre-existing conditions Bill, Cassidy sold us out. He's fighting for us.",0.9325072765350342
USSEN_MA_OCONNOR&MARP_ALARMING,"Add Market with some alarm, radical stuff, police called cops murderers. Irresponsible and Reckless in words, matter is calling for nothing short of Chaos in our communities. Police Association. Ask him to resign should Mark, is out of touch with the American people should be ashamed of himself. The police are heroes and Kevin O'Connor, and I approve this message.",0.9364262223243713
USSEN_ME_AMERICANCROSSROADS_SEX_PREDATOR,"The choice comes down to this, the Siri Gideon, playing politics, trying to raise gas taxes, even the illegal campaign contributions. It's all bad. But the sex predator, the teacher sex predator in the legislature after the school. Put him on, leave after the Press investigated. sorry, but that's just we can't trust Sara Gideon. She's just too risky. A choice.",0.9718738198280334
USSEN_ME_COLLINS_BILL_GREEN_3,"What to replace? Susan Collins. How do you replace the 750 Million Dollar Rooms Bridges and airports? And how do you replace the 250,000? So let's keep her. I'm Susan Collins and I approve this message.",0.9239636063575745
USSEN_ME_COLLINS_BILL_GREEN_4,"A hundred million dollars. That's how much Sara Gideon and her dark. Many allies are spending my messages, such as why was a fortune dumped in the main supporting a virtual unknown. Full be at the bottom of the senate in seniority. It's a power. Grab. This isn't even about me voting for Susan Collins on November 3rd. Approve this message.",0.946000337600708
USSEN_ME_COLLINS_BILL_GREEN_5,Access from the alliance from hunting and fishing me. I'm Susan Collins and I approve this message.,0.8913992047309875
USSEN_ME_COLLINS_NANCY,Commercial cleaning and disinfecting business analyst TV out of state money. It's not working for me and I approve this message.,0.9179597496986389
USSEN_ME_COLLINS_OUR_SENATOR_2,"She's courageous. She's a problem, solver. It's not about politics. It's about main, she fights for our jobs, the county social security Medicare. She is our Senator Susan Collins, and I approve this message.",0.9327224493026733
USSEN_ME_COLLINS_OUR_SENATOR_3,"She's courageous. She fights for our jobs. She supporting pioneering scientific, research Social Security Medicare. She never gives up.",0.9166302680969238
USSEN_ME_COLLINS_VALERIE_&_THURLOW_HARPER,And I will talk to it and plant to hear. I happen to run into town to the transfer station for me and my benefits were protected. I'm Susan Collins.,0.8567720651626587
