filename,transcript,stt_confidence
HOUSE_MA05_COLARUSSO_REPUBLICAN_FOR_CONGRESS_SP,"Caroline Kole. Oroshi middle lasa-ma partido Politico. En la Escuela para. Los, pobres de los. Ninos. Super massive stroke unificado. Para. El congreso.I'm Caroline colarusso and I approve this message. Please visit my webpage colarusso for converse.com. For more information. This was paid for by Carolyn colarusso for Congress.",0.918599009513855
HOUSE_MD07_KLACIK_NOT_THERE_FOR_YOU,13. I approve this message.,0.9495449066162109
HOUSE_MD07_KLACIK_WHEN_I_STARTED,,NA
HOUSE_ME02_GOLDEN_KEEPING_AMERICA_SAFE,"Jared golden help keep America safe serving as a Marine in Afghanistan and Iraq. Now in Congress. He's still focused on serving us are golden and in Congress, I'm fighting for you by standing up to the big drug companies to lower prescription cost for seniors, protecting patients, with pre-existing conditions, and delivering the, first inpatient, substance abuse, and mental, health facility for veterans here in Maine. I approve this message because I'm honored to serve you.",0.9430408477783203
HOUSE_MI02_HUIZENGA_MOVING_FORWARD_FOOTBALL,"West Michigan is moving forward. We are built on generations of people who have been confronted with problems. Instead of artists and politicians keep pushing their personal opinions and tell us to stop. We can't bill, huizenga has worked to help. Protect West Michigan and help us find a way forward and Bill huizenga, and I approve this message.",0.9511480927467346
HOUSE_MI03_CLF_WHAT_DO_WE_KNOW,"Releasing criminals back on West Michigan Street, posing. A serious threat to our communities open borders. Dangerously liberal.",0.9633468985557556
HOUSE_MI03_HOUSEMAJPAC_BILLIONAIRE,"When your dad's a billionaire, you think you can buy anything? Just ask Peter Mayer. He's trying to buy on her seat in Congress. And if he gets there Meyer pledged to fully repeal Healthcare law. Ending protections for people with pre-existing conditions Mayer, even supported a plan to let insurance companies charge older, Americans and Ajax. Don't let Peter Mayer. House. Majority Pac is responsible for the content of this appetizer.",0.9611589312553406
HOUSE_MI03_MEIJER_GEORGE_THOMAS,"His cancer came from Vietnam. And my life is right now. In health conditions keeps me alive and protect, you put his life on the line. For these honest. He's carrying a stone is lying. You didn't trust Peter Mayer. I'm Peter Meyer, and I approve this message.",0.9356138110160828
HOUSE_MI03_NRCC_ICE,"As local law enforcement work with ice to detain criminal, aliens convicted of assaulting women children and cops Hillary scholten. Demanded release as our left wing organization, works at legal system, to criminal aliens under pressure from scholten. Kent County declared Sanctuary In Harm's Way, no hint of remorse from Hillary's Colton has causes, before people liberal to change now.",0.9335179924964905
HOUSE_MI03_SCHOLTEN_MY_STREET,"On my street. message coverage, because",0.7833402752876282
HOUSE_MI06_DMS_A_LOTS_CHANGED,"A lot changed. It seems like we're alone. What's a good is defined as altogether is still strong and Fred Upton stands for what unites us. Caring for the sick, funding new doors and guaranteeing protection for pre-existing conditions, and helping struggling, securing life-saving small, business, loans, and job really standing for the good that unites us. Our Congressman Fred Upton defending Main Street is responsible for the content of this advertising.",0.9543639421463013
HOUSE_MI06_HOADLEY&DCCC_LIES,"I'm John hoadley, and I approve this message with insurance cancer survivors.",0.9730284214019775
HOUSE_MI06_UPTON_WANTS_TO_HELP_PEOPLE,"Fred Upton. Wants to help people, and he does. Trying to find solutions for tax families and jobs in West Michigan without a doubt. Fred of them is 100% the right choice for Public Safety. This is a Clear Choice. It's Fred Austin, hybrid Upton. And I approve this message.",0.9794573187828064
HOUSE_MI11_DCCC_NO_MATTER_HOW_MUCH_WE'VE_LOST,"No matter how many lives and jobs, how much normalcy lost politician, Erica sake, refuses to take covid-19. Seriously in March, the pandemic.",0.9648159742355347
HOUSE_MI11_ESSHAKI&MIRP_EMBARRASSMENT,"Haley Stevens is an embarrassment. She's exactly what's wrong with Washington. I'm Erica sake and I have a plan. We need to protect the vulnerable. The partisan, and stop the spread of the virus. Then we can focus on keeping our kids in school and rebuilding our economy or you can stick with this mess. I'm Erica sake, I approve this message because the games have to stop.",0.9581640958786011
HOUSE_MI11_INDEPENDENCEUSA_COVID_CASES,"One hundred thousand people across Michigan have survived covid, but now they face Erica sakhi. O. Sakhi wants to repeal the Affordable Care Act insurance company has heart disease or cancer. If he has his own health care in a pandemic.",0.8278370499610901
HOUSE_MI11_STEVENS_ROUND_THE_CLOCK,"I'm Haley Stevens. When I was Chief of Staff to President Obama's Auto Rescue, we work around the clock to save Michigan's Auto industry. So, when the pandemic hit, I knew what needed to happen fast to protect, and to keep businesses open to get help for covid patients, small business owners, and worried parents. And I refuse to let Washington dysfunction stand in the way. I approve this message because I will always fight for Michigan.",0.9399445652961731
HOUSE_MI11_STEVENS&DCCC_PAUL_RYZNAR,"We have thirty-two employees, but where the little guys with a pandemic? It. I didn't think anyone in Washington with us, but Haley Stevens did people to secure this nation at this time. I don't know how we would have. I'm Haley Stevens and I approve this message.",0.919281005859375
HOUSE_MN01_CLF_TALK_IS_CHEAP,"Talk is cheap and Dan Feehan talks a lot, which means less safe schools and community. And even longer 911 response times. When we need help the most. He's wrong for southern Minnesota. Congressional leadership fund is responsible for",0.9002678990364075
HOUSE_MN01_FEEHAN_CAN'T_QUIT,"One of the things I learned in Ranger school was that when things are tough and you feel like you can't go on, you can't quit. You have to keep fighting today. People across Minnesota, are still fighting the sad. Truth is Jim, Hagedorn quit on us when things got tough in our health worse. I'm Dan Feehan, and I've seen tough days been shot. I've lost friends in combat. I approve this message because I'll never quit fighting for, Minnesota.",0.9637545347213745
HOUSE_MN01_FEEHAN_SHRAPNEL,"I'm saying for you to defend this country that I just missed, getting hit by this piece of shrapnel. So, of course, I'll fight to secure our borders and our police to protect our family. And I won't stand for Jim Hagedorn challenging my patriotism. He knows nothing about keeping us safe in Congress. He sold out to the drug and insurance companies. Instead of working for us. I approve this message because I will always put Minnesota first.",0.9296820163726807
HOUSE_MN01_FEEHAN&DCCC_CAN'T_QUIT,"Ranger school was that when things are tough you feel like you can't go on. You can't quit. You have to keep fighting today. People across Minnesota, are struggling, still fighting. The sad. Truth is Jim, Hagedorn quit on us when things got tough and made our economy and our health worse. I'm Dan Feehan and I seen tough days. Been shot. I've lost friends in combat. I approve this message because I'll never quit fighting for, Minnesota.",0.9423969984054565
HOUSE_MN01_HOUSEMAJPAC_CRIME_DOESN'T_PAY,Crime doesn't pay for Congress. Does taxpayers expenses a government-issued in Minnesota House? Majority Pac is responsible for the content of this advertising.,0.907127320766449
HOUSE_MN02_HOUSEMAJPAC_NOW_MORE_THAN_EVER,"Now, more than ever scare us. He supports repealing the Affordable Care Act, which would cost 265,000 minnesotans their healthcare insurance. Tyler. Kisner doesn't care about us House. Majority PAC.",0.9147842526435852
HOUSE_MN07_CLF_GONE_TOO_FAR,"The radical liberals have gone too far, and they brought Collin Peterson with them Peterson phones, with a little hand on my run, Nancy Pelosi four out of five times. He defends Omar and her radical ideas, Peterson photive speaker. Put her in power. They want to fundamentally transform America and with Collin Peterson in Congress. They will just stop the Liberals. You have to defeat Collin, Peterson Congressional leadership fund is responsible for the content of this.",0.9570426940917969
HOUSE_MN07_CLF_WASHINGTON_CHANGED_NEWSPAPER,"Washington change Collin Peterson used to have her back but now Peterson has personally charge taxpayers for travel expenses $39,000. Other members didn't even come close to see calling charges you to fly on a private plane and tried to hide. It said it was out of mileage. It's time to fly in home responsible for the content of this.",0.9602625370025635
HOUSE_MN07_DCCC_SOMETHING_FISHY,"It's not just when it comes to Minnesota. Try to deny funding for Western. Minnesota's public schools and fischbach supports a dangerous plan that could. Close many vital Western Minnesota, hospital is Michelle. Fischbach text lobbyists, doing harm to small-town, Minnesota.",0.9339918494224548
HOUSE_MN07_HOUSEMAJPAC_ULTIMATE_TWIN_CITIES_POLITICIAN,"Michelle, Kish box the ultimate Twin Cities politician. She's running a ruthless campaign. Even Republicans called criminal fishwife took over 160,000 from special interest in trying to cut funding for schools and hospitals. Even pushed against Minnesota Farmers. Fischbach. Became the ultimate Insider make big bucks as a lobbyist shocks for them. Not house House. Majority Pac is responsible.",0.9346337914466858
HOUSE_MN07_PETERSON_KURT_WICKSTROM,"We employ about 450 people with a lot of these jobs might not be here. If it wasn't for Collin Peterson after last year's disastrous Harvest, calling help save this plant. If he wasn't a chairman, we would have lost this Co-op and these jobs call in those eggs and he knows this area has one of us and he delivers for us. Minnesota, has waited decades for a chairman for someone with his Cloud. Now that we have one. Why would we ever give him up? I'm coming for you.",0.9463191628456116
HOUSE_MN07_PETERSON_MARY_ELLEN_WELLS,"I've run rural hospitals here. So I know no one's done more for real hospitals, in Collin Peterson, providing critical funding for hospitals and he protects those with pre-existing conditions. But Michelle fischbach are hospitals. So might even have to close and she'll allow insurance companies to increase premiums and and eye coverage for pre-existing conditions. Michelle. Fischbach won't protect our Healthcare Collin Peterson already does.",0.9603502154350281
HOUSE_MN08_NYSTROM_TWO_VIALS_OF_INSULIN,Nystrom and I pay $600 a month for two vials of insulin and that's with insurance. Meanwhile their money for my campaign because I know we literally can't afford Pete stauber in Congress.,0.9320180416107178
HOUSE_MO02_CLF_THREE_THINGS,There are three things to remember about Jill shoe one. She's been a career politician for 20 years to she backed up Bernie Sanders medicare-for-all style plan. And then your face three has raised your taxes a lot and she'll do it. Again. Jill schupp is a career politician who lies about her record and raises your taxes. It's easy to easy. Decorating. Can still shoot Congressional leadership fund is responsible for the content of this advertising.,0.9541998505592346
HOUSE_MO02_HEARTLAND_HOW_DO_WE_KNOW,33 * to increase our gas prices for higher income taxes. Think she's not for us. Heartland Resurgence is responsible for the content of this communication.,0.9244244694709778
HOUSE_MO02_HOUSEMAJPAC_TAKE_A_BREATH,"So many political ads. So take a breath while we let you know, and Wagner takes a lot of money from Big special interest Wagner. Also voted 5 times to cut protections for pre-existing health conditions. That's bad for Missouri. While all that money is only good for Ann Wagner. You could vote her out. Let Wagner keep voting against your health care and that's it.",0.9609063267707825
HOUSE_MO02_HOUSEMAJPAC_THEY'RE_SO_LITTLE,But the pharmaceutical industry is big and giving big money and an Wagner's career in Congress.,0.9022065997123718
HOUSE_MO02_NRCC_WHAT'S_IN_YOUR_WALLET,"Like what's in your wallet? Has higher taxes on family's property tax increase. Torrid twice, taxes on the cars we drive and the gas. We put into jail for raping that to 20 years in politics. There's not a lot. Jill schupp has is she gets to Washington. We all pay the price and she is responsible for the",0.9484040141105652
HOUSE_MO02_SCHUPP_NEVER_INTENDED_TO_RUN,"I never intended to run for office. I just wanted to fix the problem at my kids school that desire to solve problems. Let me to serve in the community and now to run for Congress and Wagner. I don't take corporate tax money. I will host frequent Town, Hall meetings. And I work across the aisle to make health care, more affordable to reduce gun violence and to help our economy recover from covid. And I approve this message.",0.9491249918937683
HOUSE_MO02_SCHUPP_TIRED,"I'm tired. I'm tired of the device of America. Jill, schupp is the best person to turn the page to restore civility in turning to page on the chaos and divisiveness of the past four years so that we can get back to more of this.",0.9285586476325989
HOUSE_MO02_WAGNER_DAVID_TROUSDALE,"Daughter Sydney has Crohn's disease and it is a pre-existing condition. And if she didn't have coverage for that, it would be. It would be devastating. We can absolutely count on and Wagner check people with pre-existing condition. She's voted to help people with pre-existing conditions. No less than four to look out for Sydney and, and people like her. And I know that because and Wagner is my sister.",0.9526406526565552
HOUSE_MO02_WAGNER_HARD_TO_FIND_60,"In the busyness of Life, the glare of the television, the anger of the year that sometimes the good is hard to find. But each day in our neighborhood places of worship and places of work. There are a million acts of kindness for many. Our aim is to act justly and to love mercy and to walk humbly. And we expect our leaders to do the same and Wagner has heard our call Guided by faith and driven to service and Wagner is serving families in need providing help and hope during covid-19 victims of human trafficking. Caring for the sick and hurting voting for times to protect pre-existing conditions and Wagner serves as our for the phone. Because doing good isn't about left or right, but right or wrong our congresswoman and Wagner.",0.9679650068283081
HOUSE_MO04_SIMMONS_WHAT_HAS_SHE_DONE_IN_CONGRESS,"What has Vicky Hartzler done in Congress, help, donors and herself. She said, half a million and covid relief, and over a million in farm subsidies. They say in Army, Wives and a mom can't defeat a career politician, Missouri and from a hard-working Farm family. And I put myself through Harvard Law School. It's time to stand up to the corruption and to fight like hell for our family. I'm Lindsey Simmons and I approve this message because it's time to take our home back.",0.9454694390296936
HOUSE_NC08_TIMMONS-GOODSON_PROUD,It's a shame. Richard. What's a powerful? I approve this message?,0.8128480315208435
HOUSE_NC08_TIMMONS-GOODSON&DCCC_VIOLENCE_AGAINST_WOMEN_ACT,"Congressman, Richard Hudson, Washington Republicans for sexual assault victims, to pay for their own, the North Carolina, and so is Richard Hudson?",0.8368147015571594
HOUSE_NC08_TIMMONS-GOODSON&DCCC_WHEN_COVID_STRUCK,"Richard Hudson only had one job to keep us safe and he failed. He fell 600,000 people in, North Carolina. Protections for pre-existing conditions to do with hundreds of thousands dead. It's clear. Never had a plan to tackle. The only way we can fix it later shift.",0.9696930646896362
HOUSE_NC11_CAWTHORN_TWO_VERY_DIFFERENT_CHOICES_NARRATOR,"This election for congress offers, two very different choices. Who's first one in Congress will be to make Nancy, Pelosi the speaker of the house and outside.",0.8667004108428955
HOUSE_NC11_CAWTHORN&NRCC_EXTREME_LIBERAL,Cheapest country over party mode Davis country over party. I'm Madison cawthorn. I approve this message.,0.9303148984909058
HOUSE_NC11_CAWTHORN&NRCC_RADICAL_PLAN,"These Washington liberals have a radical plan and M radical liberal in North Carolina. Did the Washington, liberals will increase them by trillions?",0.9489226937294006
HOUSE_NC11_DAVIS_LIES_KEEP_COMING,"Madison. Cawthorn, his lies. Just keep coming. He claimed he got into the Naval Academy, but later admitted. He was actually rejected. He also said he got into Harvard and Princeton you never applied contouring. Even lied about the friend who saved his life. Now more false attacks on 25-year decorated veteran Moe Davis. We deserve better in the military Integrity. So I'm owed this message because you can count on me to tell it to you. Like it is",0.955605149269104
HOUSE_NE02_BACON_BRAD_ASHFORD,I'm Brad Ashford getting things done in Congress as hard as it takes listening and bipartisanship John deck and I ran against each other. Then we work together to deliver the new VA hospital in off of Runway division. He can bring people together to protect our Healthcare and get results for Nebraska. And I'm asking you to join me. I am done bacon and I approve this message.,0.9424260258674622
HOUSE_NE02_CHANGECAMPAIGN_RESTAURANT_WORKERS,"The food worker here in Omaha, and I have coronavirus can afford it. Coronavirus relief everyone to have access to Medicare. They can would take away people's Health Care in the middle of a pandemic.",0.9184874296188354
HOUSE_NE02_CLF_POURING_IN_MILLIONS,"After pouring Millions into Nebraska back in socialist, Cara, Eastman Eastman in her pocket, what could that mean for your pocket? They pass higher taxes on families and small just checking the market and your savings into a tailspin, a shrinking economy still? There's nothing but not stopping her now. Cara Eastman Congressional leadership fund.",0.9482116103172302
HOUSE_NE02_EASTMAN&DCCC_WHO'S_PAYING_FOR_IT,"I'm Cara Eastman and I approve this message. Avast, supporting, John bacon, and Donald Trump was paying for it. And why Don bacon and Donald Trump's agenda. Help them in Washington. So you see those ads, supporting Don bacon. And Donald Trump's agenda. Remember, we're paying the price.",0.9420568943023682
HOUSE_NE02_ESAFUND_COUNTRY_FIRST,"Some leaders, what country first, black General, Don Bacon among the most bipartisan members of Congress bacon delivered tax cuts for families and help Stave off it but Cara Eastman, she's the last thing, the Braska needs Eastman and our allies Nancy Pelosi, and Bernie Sanders will raise taxes and support government-run health care. That's why he's backing easements campaign. This choice is clear, both bacon. Esa fund is responsible for the content of this message.",0.9593021869659424
HOUSE_NE02_HOUSEMAJPAC_SOCIAL_SECURITY,"We were old enough for Social Security and we're proud of it. After all we've earned it. The congressman Don Bacon wants to raise the retirement age and cut her hard-earned social security benefits that could reduce benefits for Nebraska by over $3,000 a year out of office House. Majority Pac is responsible for the content of this advertising.",0.9279705882072449
HOUSE_NE02_JUSTICEDEMS_DRINKING_WATER,"Water polluted by chemicals, like Arsenic and Mercury. Toxic chemicals that cause cancer Congressman Don Bacon took money for the industries that make chemicals that polluted water and bacon voted against funding to clean up the water. We drink, Don Bacon has priorities, but they aren't Justice Democrats are responsible for the content.",0.9781590104103088
HOUSE_NE02_JUSTICEDEMS_ITS_HARD,"It's hard to be pregnant and bacon would make it harder. The insurance industry is given bacon a quarter million dollars and bacon voted to let big insurance companies charge women more, just because they're pregnant, they can even voted to take away. Healthcare from thousands of pregnant women in Nebraska Families. First, they can put the cash first. Baseman will put our Justice Democrats are responsible for the content of this.",0.9649481177330017
HOUSE_NE02_NRCC_LOTTA_LIBERAL_ALLIES,"He's got a lot of liberal allies in DC. But in Nebraska, Cara, Eastman's all alone. Even our former Congressman a fellow Democrat. Radical Cara, Eastman is dangerous to our community and are responsible for the content of this.",0.9386336207389832
HOUSE_NH01_PAPPAS_SHADOW_LOBBYIST,"We can trust Shadow lobbyists, Matt Lauer's to work for us for the big drug companies. That's right, on the payroll, but to protect their bottom line, and it's not the people of New Hampshire. I'm Chris Pappas, and I approve this message.",0.9419882297515869
HOUSE_NJ02_HOUSEMAJPAC_VAN_DREWED,"The top and everyone getting some small businesses in New Jersey homeowners, but helped himself to House. Majority Pac is responsible for the content of this advertising.",0.9103788733482361
HOUSE_NJ02_KENNEDY_SPENT_MY_LIFE,"I spent my life in South Jersey and nothing is more important to me than making sure everybody here has a secure future, and we can't have an economic recovery that works for everyone. You need to trust that. Your next representative in Washington is fighting for South Jersey and Congress. All only work for you. Not a party or president, you, I'll maybe Kennedy and I approve this message.",0.9520313739776611
HOUSE_NJ02_NRCC_WHOSE_SIDE_IS_SHE_ON,"Millionaire Amy Kennedy. Kennedy said there's a lot of defunding police. Amy Kennedy bails out, criminals for the family to pay more expensive, government-run Healthcare. They couldn't raise taxes, but also slash funding for Hospital Jersey would never recover with liberal. Amy Kennedy. The nrcc is responsible for the content of this advertising.",0.9129557609558105
HOUSE_NJ02_VANDREW&NRCC_RADICAL_AMY,Call Amy Kennedy call the police while living in a lavish Waterfront Mansion. We can't trust them or I'm just Andrew and I approve this message.,0.8597643971443176
HOUSE_NJ07_KEAN_TOO_DIVIDED,"This is a difficult time for a country divided. Too angry and extreme Parsons. Like Tom will. Now ski are making it worse to get pacifiers, and get our economy going to reach across party lines. I've done it and Trenton. I'll do it. If you wash this message and I'm asking for your vote because we deserve our Congressman, for all of us.",0.9245648980140686
HOUSE_NM02_CLF_PLAN,"Nancy Pelosi and radical liberals. Have a plan to raise taxes, kill oil and gas gun control to get it done with Pelosi. 95% of the time entering the D from the NRA. That's why Pelosi is spending Millions to bring it back because she's one of them. Pelosi the Liberals stop. Social Taurus, small Congressional leadership fund is responsible for the content of this.",0.9591613411903381
HOUSE_NM02_DCCC_CORRUPTION_AND_DISGRACE,"Corruption, disgrace, a betrayal of the public trust. It's not a Washington story. It's Yvette Harold's while in office Harold, secured over a million of our taxpayer dollars for her own company and an organization run by her own mother. It's why Harold's actions have been called a Regis. Now, she's taking tens of thousands from corporate fax corrupt would make Washington, d.c. Cc is responsible for the content.",0.9539509415626526
HOUSE_NM02_EDFACTION_LOBBY,"If you want a Lobby in bed hair on, you better have a nice Lobby. Carol is a regular at lavish conferences in Washington, d.c. Posted by a corporate-backed lobbying organization. Lobbyist wine and dine Harold in lobby like these since she pushes what they'll all be back in. New Mexico, like Paving the way to spell off New Mexico's. Public lands. Don't let it that Harold trade this for this ETF action. Votes is responsible for the",0.9428504705429077
HOUSE_NM02_HOUSEMAJPAC_CORRUPT,"Carol is corrupt. She used her position in Santa Fe to direct over $500,000 for an organization run by her family is. That's what the Albuquerque Journal. Called vet Harold secret sweetheart. She has it got her company for $140,000 in government contract. Yvette. Herrell is The New Mexico House Majority Pac is responsible for the content of this advert.",0.9234888553619385
HOUSE_NM02_LCVVF_LOBBY,"If you want a Lobby Yvette herrell, you better have a nice Lobby. Harrell is a regular at lavish conferences in Washington, d.c. Supposed to buy a corporate-backed lobbying organization, lobbyist wine and dine Herald in lobby like these. And she pushes what they Lobby back in New Mexico. Like Paving the way to Stella New Mexico's, public lands at Harold trade this, for this lcv Victory fund is responsible for the",0.9604636430740356
HOUSE_NM02_LCVVF_THE_LAND_OF_ENCHANTMENT,"Special interest they could profit off the development of our national public land, which legislation to remove protections from millions of Acres lcv. Victory fund is responsible for the content of this.",0.9399427771568298
HOUSE_NM02_LVF_HEALTHCARE,"Healthcare, we all know, it's too expensive to get away specialist. He had a pre-existing condition because she puts insurance company's first, but our Champions to protect that the healthcare because we come first",0.8933036923408508
HOUSE_NM02_LVF_HEALTHCARE_SP,"Cal Coastal, so he filled up the nest Coronavirus.",0.7337368726730347
HOUSE_NM02_NRCC_SAID_SHE'S_DIFFERENT,"Xochitl Torres. Small search different Washington V. The party line voting with the remix to kill New. Mexico jobs, burning a D from the NRA, who is small even stand with liberals? Pushing the largest tax hike in history. She took their money. They got it. So she'll Torres, small soda sound.",0.8977417349815369
HOUSE_NM02_NRCC_SPENDING_MILLIONS_SP,"Nancy Pelosi. Lovely small, 4K yesterday, Salado such a small, a poem plant in Las Vegas.",0.8059427738189697
HOUSE_NM02_TORRES-SMALL_MY_GRANDMOTHER_SP,Play searching for a small.,0.966813862323761
