alt,transcript,link,alpha,wmp_ratio
HOUSE_MO02_SCHUPP_WHAT_HAPPENED,"What's happened to Joanne Wagner, right out of the gate, Wagner is attacking Jill schupp, why to cover up her own record missions during covid-19.",http://mycmag.kantarmediana.com/KMIcmagvidbin2/HOUSE_MO02_SCHUPP_WHAT_HAPPENED.wmv,0.7732577,0.212829736211031
HOUSE_MO02_SCHUPP_WHY_AREN'T_YOU_SUPPORTING_ANN,"Why are you not supporting in Wagner and Wagner is in the pocket of big Pharma and the insurance industry. I read somewhere that and Wagner voted against protecting. Our Healthcare Wagner vote for her party, 97% of the time. Nobody's right that much. So, why do you support you'll shoot? I trust, you'll shoot to get their Healthcare bottom line. We trust, you'll shoot to look out for people like us. And whether I'm just soup and I approve this message.",http://mycmag.kantarmediana.com/KMIcmagvidbin2/HOUSE_MO02_SCHUPP_WHY_AREN'T_YOU_SUPPORTING_ANN.wmv,0.7732577,0.212829736211031
HOUSE_MO02_WAGNER_DAVID_TROUSDALE,"Daughter Sydney has Crohn's disease and it is a pre-existing condition. And if she didn't have coverage for that, it would be. It would be devastating. We can absolutely count on and Wagner check people with pre-existing condition. She's voted to help people with pre-existing conditions. No less than four to look out for Sydney and, and people like her. And I know that because and Wagner is my sister.",http://mycmag.kantarmediana.com/KMIcmagvidbin2/HOUSE_MO02_WAGNER_DAVID_TROUSDALE.wmv,0.7732577,0.212829736211031
HOUSE_MO02_WAGNER_HARD_TO_FIND_60,"In the busyness of Life, the glare of the television, the anger of the year that sometimes the good is hard to find. But each day in our neighborhood places of worship and places of work. There are a million acts of kindness for many. Our aim is to act justly and to love mercy and to walk humbly. And we expect our leaders to do the same and Wagner has heard our call Guided by faith and driven to service and Wagner is serving families in need providing help and hope during covid-19 victims of human trafficking. Caring for the sick and hurting voting for times to protect pre-existing conditions and Wagner serves as our for the phone. Because doing good isn't about left or right, but right or wrong our congresswoman and Wagner.",http://mycmag.kantarmediana.com/KMIcmagvidbin2/HOUSE_MO02_WAGNER_HARD_TO_FIND_60.wmv,0.7732577,0.212829736211031
HOUSE_MO02_WAGNER_LIBERAL_RADICALS,"I'm on Wagner. And I approve this message. We trust doctors with our Healthcare. Put Jill schupp would hand it over to Liberal radicals with a complete, their private insurance, including our veterans and coughing, 34 million dollars. Even Joe Biden. Said this about you plan it against protecting patients with pre-existing conditions. The middle.",http://mycmag.kantarmediana.com/KMIcmagvidbin2/HOUSE_MO02_WAGNER_LIBERAL_RADICALS.wmv,0.7732577,0.212829736211031
HOUSE_MT01_CFGACTION_CALIFORNIA_KATHLEEN,"California Kathleen Williams brought radical ideas here from San Francisco Williams signals for short, for a government-run Health Care system that could kill the health insurance. You get from your job or a Union contract, the bureaucratic approach Williams back cuz Wipeout rural hospitals. Like the 49 here in Montana, California, Kathleen Williams, orisky rubber stamp for Nancy Pelosi Club, for Growth Action of responsible, for the content of this advertising.",http://mycmag.kantarmediana.com/KMIcmagvidbin2/HOUSE_MT01_CFGACTION_CALIFORNIA_KATHLEEN.wmv,0.7732577,0.212829736211031
HOUSE_MT01_DCCC_MARYLAND_MATT,"Marilyn, Matt Rosendale, typical politician cares more about his donors than Montana's insurance, commissioner, Maryland. Matt took thousands from the health insurance industry and their top Executives were letting them raise insurance premiums in Montana by 23% Even Maryland. Matt doesn't share our values dcccd is responsible for the content of this advertising.",http://mycmag.kantarmediana.com/KMIcmagvidbin2/HOUSE_MT01_DCCC_MARYLAND_MATT.wmv,0.7732577,0.212829736211031
HOUSE_MT01_ROSENDALE_LOTTA_FOLKS,"Lot of folks and government go along to get along. Then you got fighters like Matt Rosendale. He's not afraid to shake up the system at state auditor to cut operating expenses 23% and refuse to pay raises every time. Rosendale lowered Healthcare premiums and passed the bill to lower drug costs. That's why. Matt Rosendale was the only candidate for congress endorsed by President Trump and a rated by the NRA shaving of the conservative results. That's Matt, Rosendale. I'm at Verizon that and I approve this message.",http://mycmag.kantarmediana.com/KMIcmagvidbin2/HOUSE_MT01_ROSENDALE_LOTTA_FOLKS.wmv,0.7732577,0.212829736211031
HOUSE_MT01_WILLIAMS_JUST_DON'T_FIT,"Some things just don't fit like my millionaire opponent and Montana, he's fortunate ended to help land developers like himself and he took the pre-existing conditions. I've worked with both parties to actually improve health care, and protect public lands, and I don't a corporate hack money. I'll always put Montana first. Now, that's a good fit. I'm Kathleen Williams, and I approve this message.",http://mycmag.kantarmediana.com/KMIcmagvidbin2/HOUSE_MT01_WILLIAMS_JUST_DON'T_FIT.wmv,0.7732577,0.212829736211031
HOUSE_MT01_WILLIAMS_THE_MONTANA_WAY,"It's pretty easy to say, Montana's do things the Montana millionaire. Matt Rosendale, does things his way? What can the legislature Rosendale land developers like himself and his auditor. He took thousands from the insurance industry and let them raise are premiums for pre-existing conditions, Wednesday, Matt Rosendale just doesn't step Montana. Hi Kathleen Williams, and I approve this message.",http://mycmag.kantarmediana.com/KMIcmagvidbin2/HOUSE_MT01_WILLIAMS_THE_MONTANA_WAY.wmv,0.7732577,0.212829736211031
HOUSE_NC02_ROSS_LEADING_LAW_MAKER,"She stood out as a leading lawmaker delivering result, that's wrong phrase for Independence. Recognized for her work, protecting voters are committed to North Carolina, safeguarding singers, Economic Security and dedicated to making Healthcare and education affordable and accessible for everyone. That",http://mycmag.kantarmediana.com/KMIcmagvidbin2/HOUSE_NC02_ROSS_LEADING_LAW_MAKER.wmv,0.7732577,0.212829736211031
HOUSE_NC03_OUTLAW_KEPT_HIS_CITY_SAFE,"That's a hurricane Florence hit New Bern his City safe by working with his community. Outlaw has been a leader for resiliency. Now, he's running for congress to fight for Women's Health Care in eastern, North Carolina families, as a mayor and businessman Outlaw has proven his ability to work with all people to get the job done on April 30th.",http://mycmag.kantarmediana.com/KMIcmagvidbin2/HOUSE_NC03_OUTLAW_KEPT_HIS_CITY_SAFE.wmv,0.7732577,0.212829736211031
HOUSE_NC03_ROUSE_FLIPPED_A_SWITCH,"If I ran my business like they run Washington, I'll be broker in jail. When Trump took office. He flipped the switch. Now, our economy is booming with more jobs to keep it going. Trump needs allies to help you down these socialists. Radical agenda threatening to take our guns. Government-run Healthcare. And their radical Green New Deal. American routes, and I approve this message because in the house I'll have frostbite.",http://mycmag.kantarmediana.com/KMIcmagvidbin2/HOUSE_NC03_ROUSE_FLIPPED_A_SWITCH.wmv,0.7732577,0.212829736211031
HOUSE_NC03_THOMAS_ACCESS_TO_HEALTHCARE,"A big challenge for the population, especially in rural communities, like, ours, across the 17 County area is just good. Access to healthcare. We see more hospitals closing in rural communities. We have given responsibility to make sure that every human being has equal access to healthcare to their children can grow up strong as to be there has to be true leadership candidate for congress approve. This message.",http://mycmag.kantarmediana.com/KMIcmagvidbin2/HOUSE_NC03_THOMAS_ACCESS_TO_HEALTHCARE.wmv,0.7732577,0.212829736211031
HOUSE_NC03_THOMAS_ACCESS_TO_HEALTHCARE_NO_LOGO,"A big challenge for the population, especially in rural communities, like, ours, across the 17 County area is just good access to healthcare given responsibility to make sure that every human being has equal access to healthcare. So their children can grow up strong as to be there has to be true leadership for congress approve. This message.",http://mycmag.kantarmediana.com/KMIcmagvidbin2/HOUSE_NC03_THOMAS_ACCESS_TO_HEALTHCARE_NO_LOGO.wmv,0.7732577,0.212829736211031
HOUSE_NC03_THOMAS_AS_MAYOR,"As mayor 4.2 million dollars. In tax cuts, lowest property tax rate in 50 years, over 900 million in New Growth transform. The global transpark 1500 Aerospace jobs 72 million in investments. In one year in Congress. Allen. Thomas will fight to cut health. Care costs to provide Broadband across the East and fight for our military and Veterans who gets the job. Done Allen Thomas for Congress.",http://mycmag.kantarmediana.com/KMIcmagvidbin2/HOUSE_NC03_THOMAS_AS_MAYOR.wmv,0.7732577,0.212829736211031
HOUSE_NC03_THOMAS_AS_MAYOR_NEW_GROWTH,"As mayor over 900 million in New Growth 4.2 million dollars in spending cuts lowest property tax rate in 50 years, transformed Aerospace jobs 72 million in investments. In one year in Congress. Allen. Thomas will fight to cut health. Care costs to provide Broadband across the East and fight for our military and Veterans. A proven leader who gets the job. John Allen Thomas for Congress.",http://mycmag.kantarmediana.com/KMIcmagvidbin2/HOUSE_NC03_THOMAS_AS_MAYOR_NEW_GROWTH.wmv,0.7732577,0.212829736211031
HOUSE_NC03_WOMENSPEAKOUT_OBAMACARE,"Who helped, President Trump, repeal Obamacare? Not Greg Murphy Murphy. Praised obamacare's, prices billions in Medicare Cuts, but worse than Murphy's words are his actions. In Raleigh Murphy sponsored obamacare's. Medicaid expansion, billions in spending and another tax hike. Greg Murphy can't be trusted with your health care. Women. Speak out pack is responsible for the content of this advertising.",http://mycmag.kantarmediana.com/KMIcmagvidbin2/HOUSE_NC03_WOMENSPEAKOUT_OBAMACARE.wmv,0.7732577,0.212829736211031
HOUSE_NC06_MANNING_ELEPHANT_IN_THE_ROOM,even if we don't fight no matter how big,http://mycmag.kantarmediana.com/KMIcmagvidbin2/HOUSE_NC06_MANNING_ELEPHANT_IN_THE_ROOM.wmv,0.7732577,0.212829736211031
HOUSE_NC08_TIMMONS-GOODSON_DCCC_WHEN_COVID_STRUCK,"Richard Hudson only had one job to keep us safe and he failed. He fell 600,000 people in, North Carolina. Protections for pre-existing conditions to do with hundreds of thousands dead. It's clear. Never had a plan to tackle. The only way we can fix it later shift.",http://mycmag.kantarmediana.com/KMIcmagvidbin2/HOUSE_NC08_TIMMONS-GOODSON&DCCC_WHEN_COVID_STRUCK.wmv,0.7732577,0.212829736211031
HOUSE_NC08_TIMMONS-GOODSON_SHARP_AS_A_TACK,"Just came by looking face, with his taking a toll on all of us, even if you don't get sick. Affordable Health Care.",http://mycmag.kantarmediana.com/KMIcmagvidbin2/HOUSE_NC08_TIMMONS-GOODSON_SHARP_AS_A_TACK.wmv,0.7732577,0.212829736211031
HOUSE_NC09_BISHOP_LIBERAL_CLOWNS_OPEN_BORDERS,"Crazy liberal clown, the things they say the way they act, they're not funny. They're downright scary. I'll go to Congress and fight these clowns for you. Liberals are pushing open borders and Sanctuary cities. Even taxpayer-funded healthcare for illegals. They hate President Trump of America Bishop. I approve this message because it's time to let the air out of these clouds.",http://mycmag.kantarmediana.com/KMIcmagvidbin2/HOUSE_NC09_BISHOP_LIBERAL_CLOWNS_OPEN_BORDERS.wmv,0.7732577,0.212829736211031
HOUSE_NC09_DCCC_SO_EXPENSIVE,"Health Care is so expensive. But when Dan Bishop had the chance to help us, he stood in the way Bishop was the only Republican or Democrat to vote against helping us. Get cheaper prescription drug devoted to let insurance companies charge higher prices for cancer treatment drug company, lobbyists support in his campaign. DCCC is responsible for the content of his advertising.",http://mycmag.kantarmediana.com/KMIcmagvidbin2/HOUSE_NC09_DCCC_SO_EXPENSIVE.wmv,0.7732577,0.212829736211031
HOUSE_NC09_HOUSEMAJFWD_CHARLOTTE_OBSERVER,The Charlotte Observer has spoken and I started a small business. That's brought 700 jobs to North Carolina on Tuesday.,http://mycmag.kantarmediana.com/KMIcmagvidbin2/HOUSE_NC09_HOUSEMAJFWD_CHARLOTTE_OBSERVER.wmv,0.7732577,0.212829736211031
HOUSE_NC09_HOUSEMAJFWD_SERVICE_BEFORE_SELF,"After 9/11 is Dan McCready, answer the call and listing in the Marine Corps serving in combat, fighting in Iraq, coming home. McCready, could have started a small business. Bring 700 good. Paying jobs to North Carolina. North Carolina. Waste, come first house. Majority forward is responsible for the content.",http://mycmag.kantarmediana.com/KMIcmagvidbin2/HOUSE_NC09_HOUSEMAJFWD_SERVICE_BEFORE_SELF.wmv,0.7732577,0.212829736211031
HOUSE_NC09_HOUSEMAJFWD_TAKE_A_STAND,"This Tuesday, take it down for a new generation of leadership with Dan McCready. After 9/11 McCready. Took a stand for us for the Marines serving in combat in North Carolina.",http://mycmag.kantarmediana.com/KMIcmagvidbin2/HOUSE_NC09_HOUSEMAJFWD_TAKE_A_STAND.wmv,0.7732577,0.212829736211031
HOUSE_NC09_MCCREADY_ATTACKS_ON_MY_BUSINESS,"These attacks on my business for lies more tricks from politician. Dan, Bishop. Here's the Fax Tax Relief created a whole new industry here in North Carolina. Clean energy, jobs milk last taxes in creating good jobs with affordable. Health care. I approve this message.",http://mycmag.kantarmediana.com/KMIcmagvidbin2/HOUSE_NC09_MCCREADY_ATTACKS_ON_MY_BUSINESS.wmv,0.7732577,0.212829736211031
HOUSE_NC09_MCCREADY_CANT_GET_ENOUGH,"Drug insurance companies. Can't get enough of Dan Bishop. We struggle with healthcare costs. But Bishop was the only politician Republican or Democrat drugs, and now drug lobbyists are funding his campaign. Bishop even cited with insurance companies to campaign, but our families just can't afford Dan Bishop.",http://mycmag.kantarmediana.com/KMIcmagvidbin2/HOUSE_NC09_MCCREADY_CANT_GET_ENOUGH.wmv,0.7732577,0.212829736211031
HOUSE_NC09_MCCREADY_COUNTRY_OVER_PARTY,"In the Marine Corp, we put country over party each other jobs. A specialist to many North Carolina families like Brian's struggle to afford healthcare insurance. Drug companies. I put families like Brian's first. I'm Dan McCready and I approve this message.",http://mycmag.kantarmediana.com/KMIcmagvidbin2/HOUSE_NC09_MCCREADY_COUNTRY_OVER_PARTY.wmv,0.7732577,0.212829736211031
HOUSE_NC09_MCCREADY_DON'T_BACK_DOWN,"Business and raising kids and Republicans are affordable implants. The lower prescription drug prices. I'm Dan McCready, not through this message over party.",http://mycmag.kantarmediana.com/KMIcmagvidbin2/HOUSE_NC09_MCCREADY_DON'T_BACK_DOWN.wmv,0.7732577,0.212829736211031
HOUSE_NC09_MCCREADY_DON'T_BACK_DOWN_VOTE,"Democrats and Republicans. I'm Dan McCready, not prove this message. It's always put country over party.",http://mycmag.kantarmediana.com/KMIcmagvidbin2/HOUSE_NC09_MCCREADY_DON'T_BACK_DOWN_VOTE.wmv,0.7732577,0.212829736211031
HOUSE_NC09_MCCREADY_HARD_TO_RECOGNIZE,"Hey, it's me. Dan McCready hard to recognize the special-interest spending Millions line about me to call me a clown in the Socialists, seriously. A father, a Christian and a businessman. And just like when I served in a community safe, I'll take to lower healthcare costs. I approve this ad. It's always put country over party.",http://mycmag.kantarmediana.com/KMIcmagvidbin2/HOUSE_NC09_MCCREADY_HARD_TO_RECOGNIZE.wmv,0.7732577,0.212829736211031
HOUSE_NC09_MCCREADY_WARNING_LABELS,"Prescriptions come with warning labels baby politicians. Should to healthcare costs are out of control for Dan. Bishop was the only drugs. I just can't afford politicians like Dan, Bishop. Not for this message.",http://mycmag.kantarmediana.com/KMIcmagvidbin2/HOUSE_NC09_MCCREADY_WARNING_LABELS.wmv,0.7732577,0.212829736211031
HOUSE_NC09_VOTEVETSAF_CYNTHIA_LAUER,Deliver Quality Healthcare solutions to special interests.,http://mycmag.kantarmediana.com/KMIcmagvidbin2/HOUSE_NC09_VOTEVETSAF_CYNTHIA_LAUER.wmv,0.7732577,0.212829736211031
HOUSE_NC11_CAWTHORN_TWO_VERY_DIFFERENT_CHOICES,This election for congress offers two very different choices of career DC Insider or an outsider higher taxes or lower taxes gun. Confiscation our Second Amendment rights socialist cookie with rationing or choice and competition to lower Pond defunding the police or supporting law enforcement government control or Freedom. I'm not asking him is still worth fighting for I'm Madison cawthorn. I approve this message.,http://mycmag.kantarmediana.com/KMIcmagvidbin2/HOUSE_NC11_CAWTHORN_TWO_VERY_DIFFERENT_CHOICES.wmv,0.7732577,0.212829736211031
HOUSE_NC11_DAVIS_AIR_FORCE,"I served our country in the Air Force for 25 years, retired Colonel Davis. Our veterans deserve support not insult and it's our duty to take care of our veterans during and after their service. I'll fight to make sure the Veterans Administration is fully funded and stand against diverting funds to the private sector that are needed to strengthen veteran's health care. I'm O Davis and I approve this message that goes over 25 years. I served with Heroes who deserve nothing less.",http://mycmag.kantarmediana.com/KMIcmagvidbin2/HOUSE_NC11_DAVIS_AIR_FORCE.wmv,0.7732577,0.212829736211031
HOUSE_NC11_DAVIS_BORN_AND_RAISED_60,"Timer Davis. I was born raised and educated in North Carolina, then serve my country in the Air Force for 25 years. I was best known for her role as Chief prosecutor, Guantanamo Bay in order to use evidence obtained. By torture. I retired as a colonel work as a national security specialist to Congress Allah professors in a judge with the US Department of Labor. Now, I'm running for congress in corrupt in America's history, and I want to bring integrity and a commitment to Public Service back to Capitol Hill.There are so many important issues like climate change healthcare jobs and education that need to be addressed. But repairing, the cracks in the foundation of our democracy, has to be job. Once I'm going to stand up and fight. Hi, Moe, Davis. I approve this message.",http://mycmag.kantarmediana.com/KMIcmagvidbin2/HOUSE_NC11_DAVIS_BORN_AND_RAISED_60.wmv,0.7732577,0.212829736211031
HOUSE_NC11_DAVIS_COUNTRY_OVER_PARTY,"She put country over party mode, Davis, born and raised here with John McCain. He resigning as Chief prosecutor at Guantanamo in protest and took the Obama Administration to court on Free Speech. Grounds. We need leadership. If it's country over party. I'm O Davis and I approve this message to get things done for you. Improve your health care jobs, International Security.",http://mycmag.kantarmediana.com/KMIcmagvidbin2/HOUSE_NC11_DAVIS_COUNTRY_OVER_PARTY.wmv,0.7732577,0.212829736211031
HOUSE_NC11_DAVIS_GETTING_IT_WRONG,"This pandemic, Madison cawthorn continues to get it wrong first. He said it was no worse than the flu. Now, Kosarin wants to eliminate protections for seniors and people with pre-existing conditions and Medicaid coverage to people who lost their jobs through, no fault of their own. He hasn't learned a thing. We need leadership. We can trust Moe. Davis served in the Air Force for 25 years to improve healthcare jobs and National Security. And I approve this message.",http://mycmag.kantarmediana.com/KMIcmagvidbin2/HOUSE_NC11_DAVIS_GETTING_IT_WRONG.wmv,0.7732577,0.212829736211031
HOUSE_NC11_DAVIS_SERVED_MY_COUNTRY,"Hi, Moe, Davis. I moved away from North Carolina to serve my country. I spent 25 years, in the Air Force retired as a colonel. I was a chief prosecutor, Guantanamo Bay. I was a law professor at Howard University. I was a national security specialist for Congress and more recently. I was a judge for the Department of Labor, after being away, serving the country for 30 years. I'm back. And I'm back to fight for Western, North Carolina. I'm O Davis, I approve this message.",http://mycmag.kantarmediana.com/KMIcmagvidbin2/HOUSE_NC11_DAVIS_SERVED_MY_COUNTRY.wmv,0.7732577,0.212829736211031
HOUSE_NC11_PATTERSON_CONGRESSIONAL_SALARY,U.s. Congress thought about corporations. I will work to get the national debt under control. Home for me for US Congress. I'm Vance Patterson that I approve this message people.,http://mycmag.kantarmediana.com/KMIcmagvidbin2/HOUSE_NC11_PATTERSON_CONGRESSIONAL_SALARY.wmv,0.7732577,0.212829736211031
HOUSE_NC11_PRICE_BACK_TO_WORK,"It's time for us to put the people's money back to work for the people. I'm still a price and I'm running for congress because the people of Western North Carolina deserve better. We need better job with bigger paycheck through investments in health care for all tuition-free higher, education, Environmental Protection and investments in infrastructure, including broadband internet. These investments will create better jobs without raising taxes on working people. I'm so proud when I approve this message.",http://mycmag.kantarmediana.com/KMIcmagvidbin2/HOUSE_NC11_PRICE_BACK_TO_WORK.wmv,0.7732577,0.212829736211031
HOUSE_NE01_BOLZ_CHORES,"I'm tape gold. I learned growing up on the farm. The chores, don't take care of themselves. The same is true for wasteful spending. So in the unicameral, I gave it a clipping. I worked with Republicans and Democrats to balance the budget every year and deliver property tax relief, but Jeff Fortenberry wants to cut your health care to help the drug and insurance companies that gave $400,000 to his campaign. I approve this message because in Congress, I'll put Nebraska's first.",http://mycmag.kantarmediana.com/KMIcmagvidbin2/HOUSE_NE01_BOLZ_CHORES.wmv,0.7732577,0.212829736211031
HOUSE_NE01_BOLZ_CHRISTINE,"For too long break system condition and $34,000 in campaign contributions from insurance companies. Jeff Fortenberry puts campaign donors before us kid. What's Nebraska's first?",http://mycmag.kantarmediana.com/KMIcmagvidbin2/HOUSE_NE01_BOLZ_CHRISTINE.wmv,0.7732577,0.212829736211031
HOUSE_NE01_BOLZ_LISTENING,"For over 15 years, has been listening to the special-interest cables. The Journal. Star says, she's a listener and stands out as the best choice. And the Omaha. World-Herald says, one of the sound judgement Nebraska's first.",http://mycmag.kantarmediana.com/KMIcmagvidbin2/HOUSE_NE01_BOLZ_LISTENING.wmv,0.7732577,0.212829736211031
HOUSE_NE01_FORTENBERRY_SHOW_UP,"You show up, you get the job done. But official records show over the last two years. State, senator cable did not vote, 30% of the time in the legislature. Time to campaign for Congress, vote on Healthcare. Didn't vote to keep kids safe from sexual predators in school, didn't vote 30% of the time. If both won't work for you, in Nebraska. She won't work for you in Washington.",http://mycmag.kantarmediana.com/KMIcmagvidbin2/HOUSE_NE01_FORTENBERRY_SHOW_UP.wmv,0.7732577,0.212829736211031
HOUSE_NE02_ASHFORD_A_CAREER_IN_HEALTH_CARE,I'm an Ashford. I spent much of my career working in healthcare. I know that Health Care is a human right prescription coverage for every single American. I'm an Ashford and I approve this message.,http://mycmag.kantarmediana.com/KMIcmagvidbin2/HOUSE_NE02_ASHFORD_A_CAREER_IN_HEALTH_CARE.wmv,0.7732577,0.212829736211031
HOUSE_NE02_ASHFORD_KARA_CANT_BEAT,If Eastman can't be done bacon with millions of dollars in a democratic way to Ashford for congress Democrat who can beat Don Bacon.,http://mycmag.kantarmediana.com/KMIcmagvidbin2/HOUSE_NE02_ASHFORD_KARA_CANT_BEAT.wmv,0.7732577,0.212829736211031
HOUSE_NE02_ASHFORD_UNCERTAIN_TIMES,"Why have Nebraska Democrats like Bob carried, liver Progressive results for Nebraska career in healthcare, and we'll build on Obamacare by adding a public option, Health Care Champaign today. Together. We're going to make real progress again. I'm an Ashford and I approve this message.",http://mycmag.kantarmediana.com/KMIcmagvidbin2/HOUSE_NE02_ASHFORD_UNCERTAIN_TIMES.wmv,0.7732577,0.212829736211031
HOUSE_NE02_BACON_BRAD_ASHFORD,I'm Brad Ashford getting things done in Congress as hard as it takes listening and bipartisanship John deck and I ran against each other. Then we work together to deliver the new VA hospital in off of Runway division. He can bring people together to protect our Healthcare and get results for Nebraska. And I'm asking you to join me. I am done bacon and I approve this message.,http://mycmag.kantarmediana.com/KMIcmagvidbin2/HOUSE_NE02_BACON_BRAD_ASHFORD.wmv,0.7732577,0.212829736211031
HOUSE_NE02_BACON_CANCER,My sister in bus run from cancer at 39. East Racine. What's the proof of beer? Not destroyed and I approve this message.,http://mycmag.kantarmediana.com/KMIcmagvidbin2/HOUSE_NE02_BACON_CANCER.wmv,0.7732577,0.212829736211031
HOUSE_NE02_BACON_DON'T_PHASE_ME,"I want friends. I have one of them. That was my mom, my sister way too early. So, if you're wondering, if both parties, are those with pre-existing conditions, and always has been and bacon, and I approve this message.",http://mycmag.kantarmediana.com/KMIcmagvidbin2/HOUSE_NE02_BACON_DON'T_PHASE_ME.wmv,0.7732577,0.212829736211031
HOUSE_NE02_BACON_TOO_EXTREME,"I'm done bacon, and I approve this message. Healthcare plan is too extreme for Democrats dictating. You, you cannot keep the plan you have and how much taxes on middle-class people.",http://mycmag.kantarmediana.com/KMIcmagvidbin2/HOUSE_NE02_BACON_TOO_EXTREME.wmv,0.7732577,0.212829736211031
HOUSE_NE02_BACON_VICKI_AND_TOM,"After Tom's tragic fall, hundreds of stitches and bills were piling up. We were being told, we had no insurance are out of options and no one would listen. And God sent us Don Bacon. He managed to figure out where the glitch was my heart. He took away our fears and he saved Our Lives. I am done bacon, and I approve this message.",http://mycmag.kantarmediana.com/KMIcmagvidbin2/HOUSE_NE02_BACON_VICKI_AND_TOM.wmv,0.7732577,0.212829736211031
