alt,transcript,link,alpha,wmp_ratio
HOUSE_SC01_DCCC_COST_US,Covid-19 live jobs in their native plant. After them. All 23% covid-19 is costing the Lowcountry enough over to make.,http://mycmag.kantarmediana.com/KMIcmagvidbin2/HOUSE_SC01_DCCC_COST_US.wmv,0.8995223,0.212829736211031
HOUSE_SC01_DCCC_TRUST,"Can you put a price on something like trust, not with politician. Nancy make supporting a 23% by for Social Security money on Wall Street has even hit you with a trillion to the national debt. Can't trust her. That's politician. Nancy mace.",http://mycmag.kantarmediana.com/KMIcmagvidbin2/HOUSE_SC01_DCCC_TRUST.wmv,0.8995223,0.212829736211031
HOUSE_SC01_MACE_CHOPPING_BLOCK,"Liberal Joe Cunningham, on The Chopping Block about your job. He's too busy working for them.",http://mycmag.kantarmediana.com/KMIcmagvidbin2/HOUSE_SC01_MACE_CHOPPING_BLOCK.wmv,0.8995223,0.212829736211031
HOUSE_SC01_MACE_DEMOCRAT_JOE,Christian history. There's a better we'll stand with the president to protect our military. Cut our taxes and get Lowcountry families back to work. And I approve this message.,http://mycmag.kantarmediana.com/KMIcmagvidbin2/HOUSE_SC01_MACE_DEMOCRAT_JOE.wmv,0.8995223,0.212829736211031
HOUSE_SC01_MACE_THE_OTHER_NANCY,"My name is Nancy mace and I have a message for the liberal Nancy and Washington. The Lowcountry doesn't want socialism. We don't want to pay higher taxes and we don't want Thomas and Cunningham. Those is Nancy Pelosi. Almost 90% of the time. Do you think we wouldn't notice, if you want to put a check and balance on Pelosi? Put the country first and I approve this message.",http://mycmag.kantarmediana.com/KMIcmagvidbin2/HOUSE_SC01_MACE_THE_OTHER_NANCY.wmv,0.8995223,0.212829736211031
HOUSE_SC01_MACE_WAFFLE_HOUSE,"I waited tables at the Waffle House and as a single mom. I know every dollar counts Congressman Cunningham does out of touch with Lowcountry families. That's why he voted to give Congressman, like, himself $5000000 of your tax money to spend on their political campaigns welfare, for politicians, only in Washington as your voice in Congress. I'll fight to cut spending and taxes. It's your money, not there. I'm Nancy mace and I approve this message.",http://mycmag.kantarmediana.com/KMIcmagvidbin2/HOUSE_SC01_MACE_WAFFLE_HOUSE.wmv,0.8995223,0.212829736211031
HOUSE_SC02_BOROUGHS_KEYCHAIN,"The Joe Wilson keychain, he's handed them out for years. Here's what's been handed out to Joe Wilson over 450,000, from the drug and insurance companies. And he delivered Wilson voted to cut their taxes, to let them raise your premiums and got protections for pre-existing conditions, keychain for you tax breaks for them. Joe Wilson, sold you out. So vote him out of",http://mycmag.kantarmediana.com/KMIcmagvidbin2/HOUSE_SC02_BOROUGHS_KEYCHAIN.wmv,0.8995223,0.212829736211031
HOUSE_SC02_BOROUGHS_PHOTO_OPS,"I'm at their Burrows and I approve this message. If there is a parade or photo of Joe Wilson's there. He has given him over $450,000 Wilson voted to cut their taxes, to let them raise your premium. He won't take your questions. Joe Wilson, sold you out to vote him out of Congress.",http://mycmag.kantarmediana.com/KMIcmagvidbin2/HOUSE_SC02_BOROUGHS_PHOTO_OPS.wmv,0.8995223,0.212829736211031
HOUSE_SC02_WILSON_JOE_MEANS_JOBS,"South Carolina families. Know that Joey is jobs, Joe Wilson is standing with President. Trump should have been fair, trade deals. America, First for working families and small businesses, eliminated needless government, red tape, from Belton South Carolina, small businesses and jo-wilfried liberal politicians shut down our Tony on Joe Wilson, and I approve this message because it's time to get America working again.",http://mycmag.kantarmediana.com/KMIcmagvidbin2/HOUSE_SC02_WILSON_JOE_MEANS_JOBS.wmv,0.8995223,0.212829736211031
HOUSE_TN01_CFGACTION_SAYS_THE_RIGHT_THINGS,"Rusty Crow says, the right things, but his 30-year record says he wouldn't fight for Trump. He'd fadeaway Provo to expand Obamacare in Tennessee voted for a gas tax increase. That was the biggest tax hike and State history and business taxes, Rusty Crow. You can't trust him, the back Trump and Congress Club. For Growth Action is responsible for the content of this advertising.",http://mycmag.kantarmediana.com/KMIcmagvidbin2/HOUSE_TN01_CFGACTION_SAYS_THE_RIGHT_THINGS.wmv,0.8995223,0.212829736211031
HOUSE_TN01_CLARK_BETTY_JONES,"Lot of people break promises, but not John Clark when he was Kingsport mayor. We have one of the lowest tax rates in the area. Made it easy to do, business, any tax increase in Congress and federal income tax increased. I know, John Clark because you make it to the bank, he's doing and I approve this message.",http://mycmag.kantarmediana.com/KMIcmagvidbin2/HOUSE_TN01_CLARK_BETTY_JONES.wmv,0.8995223,0.212829736211031
HOUSE_TN01_CROWE_HI_FOLKS,"I'm Rusty Crow, and I'm running for congress because I believe DC needs a big, ol dose of Tennessee, St. Senator Rusty, Crow balance, their budget and our Second Amendment rights and supported Tennessee. Law enforcement have proven conservative leader. Who will work with President Trump to get our economy back on track, and stand up to the Lawless liberal mob. I'd be honored to have your vote. I'm Rusty Crow. And I approve this message.",http://mycmag.kantarmediana.com/KMIcmagvidbin2/HOUSE_TN01_CROWE_HI_FOLKS.wmv,0.8995223,0.212829736211031
HOUSE_TN01_CROWE_THERE_THEY_GO_AGAIN,"Play both Rusty Crow. Well, I know when you're taking fire. It means you're over the Target and the Washington. D.c. Swamp is firing on me. They're attacking my proven, conservative record because they know, I'll stand with President Trump and drain the swamp and fast attacks, and join my fight to get BC. A good ol dose of Tennessee. I approve this message and I'll be honored to have your vote.",http://mycmag.kantarmediana.com/KMIcmagvidbin2/HOUSE_TN01_CROWE_THERE_THEY_GO_AGAIN.wmv,0.8995223,0.212829736211031
HOUSE_TN01_HARSHBARGER_DISCREDIT,"I'm Diana, harshbarger and I approve this message. Just tried to do to President Trump about to find out. I've been in politics were 80 years combined. They voted to raise your taxes and give your money to illegal immigrants. President Trump me Diana harshbarger to get rid of the DC snakes.",http://mycmag.kantarmediana.com/KMIcmagvidbin2/HOUSE_TN01_HARSHBARGER_DISCREDIT.wmv,0.8995223,0.212829736211031
HOUSE_TN01_HARSHBARGER_FORMER_DEMOCRAT_15,I'm Diana harshbarger and I approve this message.,http://mycmag.kantarmediana.com/KMIcmagvidbin2/HOUSE_TN01_HARSHBARGER_FORMER_DEMOCRAT_15.wmv,0.8995223,0.212829736211031
HOUSE_TN01_HARSHBARGER_LESS_MONEY_15,"I'm Diana harshbarger and I approve this message. John Clark wants your money twice. You know what, you get with John Clark less money.",http://mycmag.kantarmediana.com/KMIcmagvidbin2/HOUSE_TN01_HARSHBARGER_LESS_MONEY_15.wmv,0.8995223,0.212829736211031
HOUSE_TN01_HARSHBARGER_REALLY_RUSTY_15,"I'm Diana harshbarger and I approve. This message is Rusty, is really rusty. That's not conservative.",http://mycmag.kantarmediana.com/KMIcmagvidbin2/HOUSE_TN01_HARSHBARGER_REALLY_RUSTY_15.wmv,0.8995223,0.212829736211031
HOUSE_TN01_HARSHBARGER_TAX_HIKING_15,"Diana, harshbarger, and I approve. This message, check, nursing, home, Tech, check a beer tax. Check 35 times. He voted to increase your taxes. Don't let Tim Hill anywhere near Washington DC.",http://mycmag.kantarmediana.com/KMIcmagvidbin2/HOUSE_TN01_HARSHBARGER_TAX_HIKING_15.wmv,0.8995223,0.212829736211031
HOUSE_TN01_HARSHBARGER_WANTS_YOUR_MONEY_15,"I'm Diana, harshbarger and I approve this message. John Clark, wants your money. He voted to increase property taxes twice. He voted to double your trash. Hauling fee on traffic ticket.",http://mycmag.kantarmediana.com/KMIcmagvidbin2/HOUSE_TN01_HARSHBARGER_WANTS_YOUR_MONEY_15.wmv,0.8995223,0.212829736211031
HOUSE_TN01_HILL_FACT_CHECK_15,"Diana's attacks against Timothy Gill. Fact-checkers, Aubrey Timothy voted against tax hikes. And Timothy Hill text gutter pro-life Pro Trump a Christian in church on Timothy Hill.",http://mycmag.kantarmediana.com/KMIcmagvidbin2/HOUSE_TN01_HILL_FACT_CHECK_15.wmv,0.8995223,0.212829736211031
HOUSE_TN02_BURCHETT_HARDWORKING_TAXPAYERS,"I'm Tim burchett, and I'm fighting to hold Washington accountable. Protect hardworking taxpayers from big government and foreign interest. That's why I introduced a bill to cut our pay when Congress doesn't pass a budget. When I'm not afraid to stand up to China, by to bring our jobs home. Congress is basically got us when it comes to China. We need to stand up to them. They're bullies. Sure the special for you in Washington, this message.",http://mycmag.kantarmediana.com/KMIcmagvidbin2/HOUSE_TN02_BURCHETT_HARDWORKING_TAXPAYERS.wmv,0.8995223,0.212829736211031
HOUSE_TN09_CEDEMS_OUR_MISSION_60,"Democrat to hold the city state, and federal Constitution that being the only legit. And bonded valid in the state of Tennessee. Our vision is going to hold the Constitution by Alexander Williams past 15 years. I've seen over 15,000 people homes and businesses with tax and property tax. a legend in a family tradition. Thanks, Sharon.",http://mycmag.kantarmediana.com/KMIcmagvidbin2/HOUSE_TN09_CEDEMS_OUR_MISSION_60.wmv,0.8995223,0.212829736211031
HOUSE_TX01_GOHMERT_WE_CAN_CHOOSE_60,"In this election, we can choose a future of freedom and prosperity are taxes in American streets against President Trump, and may come from those who condescendingly crave total control over it faster. The principles that led to our constitution, to the end of slavery, just civil rights. If we pull together, we can eliminate most of the meanness that has become so prevalent. Let's choose the return of goodness for blessings of a best-ever economy and freedom of worship, that allows us to thank God for his grace and goodness future. Generations. Will be so glad when I'm Louie gohmert, and that's why I approve this message.",http://mycmag.kantarmediana.com/KMIcmagvidbin2/HOUSE_TX01_GOHMERT_WE_CAN_CHOOSE_60.wmv,0.8995223,0.212829736211031
HOUSE_TX02_CRENSHAW_ENVIRONMENTALIST,"I'm an environmentalist. And I know climate change is real. I'm also rational your taxes plants. Make America. The world leader in clean energy, Innovation, reduce carbon emissions, and he's working. I'm Dan Crenshaw. I approve this message, because if we come together, we can put America on the path to a new energy Frontier.",http://mycmag.kantarmediana.com/KMIcmagvidbin2/HOUSE_TX02_CRENSHAW_ENVIRONMENTALIST.wmv,0.8995223,0.212829736211031
HOUSE_TX02_CRENSHAW_FIXED_INCOME,"How many seniors are on fixed incomes and prescription drug costs are a real problem. I'm thankful. Dan crenshaw's, fighting back against the big drug companies and dance taking on China. So, I'm medicines are made in America. Sima, would make things worse. She would put government in charge of our Healthcare. We get higher, taxes and worst-case are no. Thanks. We don't need semen, Washington.",http://mycmag.kantarmediana.com/KMIcmagvidbin2/HOUSE_TX02_CRENSHAW_FIXED_INCOME.wmv,0.8995223,0.212829736211031
HOUSE_TX03_TAYLOR_LIBERAL_LULU,"Has came from California and brought their liberal ideas with her higher taxes, criminals back on the streets is clear. The Dallas Morning, News, called band, Taylor, Mister bipartisan, Reaching Across the aisle, and working around, the clock for us. During the pandemic, protecting the vulnerable, and those with pre-existing condition van Taylor.",http://mycmag.kantarmediana.com/KMIcmagvidbin2/HOUSE_TX03_TAYLOR_LIBERAL_LULU.wmv,0.8995223,0.212829736211031
HOUSE_TX03_TAYLOR_LIBERAL_LULU_ETHICS,"Liberal Lulu. Seikaly just arrived from California. Dangerous criminals, Texas, California, the Dallas Morning News endorsements and Taylor called van Mr. Bipartisan working around the clock at across the aisle to protect jobs and the vulnerable during the pandemic.",http://mycmag.kantarmediana.com/KMIcmagvidbin2/HOUSE_TX03_TAYLOR_LIBERAL_LULU_ETHICS.wmv,0.8995223,0.212829736211031
HOUSE_TX07_CLF_ONE_BIG_PROMISE,"Lizzie Fletcher made one big promise to get your vote. But she did Lizzie Fletcher voted with Nancy Pelosi, 99% of the time, with her 99% on taxes, on Health Care on killing, Texas, energy jobs. And that's the problem with Lizzie Fletcher percent of the time, Congressional leadership fund is responsible for the content of this advertising.",http://mycmag.kantarmediana.com/KMIcmagvidbin2/HOUSE_TX07_CLF_ONE_BIG_PROMISE.wmv,0.8995223,0.212829736211031
HOUSE_TX07_HOUSEMAJPAC_PROUD_TO_BE_ENDORSED,"Wesley said he was proud to be endorsed by Donald Trump and he agrees with him on a lot of things. We have a problem hunt, said we need to fully repeal Obamacare with no place during the middle of eliminating protections for pre-existing condition and allowing insurance companies to charge tax on Healthcare and shrimp bad for your health House. Majority. Pac is responsible for the content of this advertising.",http://mycmag.kantarmediana.com/KMIcmagvidbin2/HOUSE_TX07_HOUSEMAJPAC_PROUD_TO_BE_ENDORSED.wmv,0.8995223,0.212829736211031
HOUSE_TX12_CLF_BIG_MONEY,"The same people behind the attack at Saint. Kate Ranger spending millions of America one. Now, they're doing big money behind. Chris Putnam, Putnam the best for raising property taxes, and is a leader of a company that outsourcing good paying jobs with a Granger whose side are you on Congressional leadership fund?",http://mycmag.kantarmediana.com/KMIcmagvidbin2/HOUSE_TX12_CLF_BIG_MONEY.wmv,0.8995223,0.212829736211031
HOUSE_TX12_CLF_FAN_OF_OURS,"We have a woman who helped deliver funding for the border wall story, text and she's the reason new fighter planes are build right here. Congressional leadership fund is responsible for the content of this advert.",http://mycmag.kantarmediana.com/KMIcmagvidbin2/HOUSE_TX12_CLF_FAN_OF_OURS.wmv,0.8995223,0.212829736211031
HOUSE_TX12_GRANGER_STANDS_STRONG,"Kay Granger Stands Strong, the conservative choice is clear.",http://mycmag.kantarmediana.com/KMIcmagvidbin2/HOUSE_TX12_GRANGER_STANDS_STRONG.wmv,0.8995223,0.212829736211031
HOUSE_TX17_SESSIONS_CHAMPION,"sessions is a champion for congress in the last 45 years, fight for lower taxes, affordable health care, and will invest in American innovation, research Pete Sessions fights for us and Pete Sessions, and I approved,",http://mycmag.kantarmediana.com/KMIcmagvidbin2/HOUSE_TX17_SESSIONS_CHAMPION.wmv,0.8995223,0.212829736211031
HOUSE_TX21_CFGACTION_NOT_A_PART_OF_CHINA,Does Wendy Davis know? Texas is not part of China? Who interests behind billion dollar us back alone? Even if you put American Trade Secrets and Technology arrest. Why? Because Wendy Davis stands with Nancy Pelosi Clipper. Cove action is responsible for the content of this advertising.,http://mycmag.kantarmediana.com/KMIcmagvidbin2/HOUSE_TX21_CFGACTION_NOT_A_PART_OF_CHINA.wmv,0.8995223,0.212829736211031
HOUSE_TX21_HOUSEMAJPAC_GOLDSTAR,"It's an honor. No one wants given to families of Fallen Soldiers. They deserve our best, but she probably was one of only three members of Congress to vote against tax relief for gold star. Families had no problem with tax breaks for Wall Street Banks, pharmaceutical companies and corporations. The difference, gold star families. And Chip. Roy is a disgrace to the content.",http://mycmag.kantarmediana.com/KMIcmagvidbin2/HOUSE_TX21_HOUSEMAJPAC_GOLDSTAR.wmv,0.8995223,0.212829736211031
HOUSE_TX21_ROY_THE_BIG_ISSUES,"Most of the big issues Wendy Davis and I disagree. She wants to defend the police. I think that's dangerous. When do you think the government should control your health care? I believe you should. She supports Sanctuary cities. I support safe cities. No, Sanctuary the lawbreakers and Wendy has promised to raise your taxes. I want you to keep more of what you earn. Those are our Texas values and I approve this message.",http://mycmag.kantarmediana.com/KMIcmagvidbin2/HOUSE_TX21_ROY_THE_BIG_ISSUES.wmv,0.8995223,0.212829736211031
HOUSE_TX22_CLF_RECKLESS_HEALTHCARE_PLAN,"Private, life is reckless even worse for your health care. Pay for a better choice, conservative leader. Troy. Nehls a war hero with two bronze Stars Mills will protect our freedoms and our wallets Troy. Now, a Lonestar L for congress, Congressional leadership fund is responsible for the content of this after enticing.",http://mycmag.kantarmediana.com/KMIcmagvidbin2/HOUSE_TX22_CLF_RECKLESS_HEALTHCARE_PLAN.wmv,0.8995223,0.212829736211031
HOUSE_TX22_CLF_RECKLESS_PRIVATE_LIFE,Liberals.,http://mycmag.kantarmediana.com/KMIcmagvidbin2/HOUSE_TX22_CLF_RECKLESS_PRIVATE_LIFE.wmv,0.8995223,0.212829736211031
HOUSE_TX23_GONZALES_CHOICE,How much is a choice between values calories? Texas military bases. That's where I'm raising my family on Texas values. Faith and family. I'm Tony Gonzalez and I approve this message because I'll never forget where I'm from.,http://mycmag.kantarmediana.com/KMIcmagvidbin2/HOUSE_TX23_GONZALES_CHOICE.wmv,0.8995223,0.212829736211031
HOUSE_TX23_NRCC_WE_WORK_HARD_FOR_OUR_MONEY,"Texans work hard for our money, but Gina Jones would use our tax dollars to radicalize America, Jones supports taxpayer-funded sex change operations. We don't need picking our pockets, for left-wing special causes. It's not the time. Texas isn't the place Gina Jones is just too liberal. Nrcc is responsible for the",http://mycmag.kantarmediana.com/KMIcmagvidbin2/HOUSE_TX23_NRCC_WE_WORK_HARD_FOR_OUR_MONEY.wmv,0.8995223,0.212829736211031
HOUSE_TX24_CLF_RADICAL_SUPPORTERS,"Candace Valenzuela is radical supporters. Have dangerous plan to defund are police, putting our community. And what would they have Congress? Fun of radical environmental plan that would destroy Texas jobs and could cost, every Texas Family, tens of thousands a year, defunding our police, and it costing us jobs. Always raising. Our taxes. Candace Valenzuela is a wisc test stand up for herself on this responsible for the content of this advertising.",http://mycmag.kantarmediana.com/KMIcmagvidbin2/HOUSE_TX24_CLF_RADICAL_SUPPORTERS.wmv,0.8995223,0.212829736211031
HOUSE_TX24_CLF_WE_KNOW,"Candace Valenzuela is radical supporters, have dangerous plan to defund are police, putting our communities at risk when criminals attack and what would they have Congress? Fun of radical environmental plan that would destroy Texas jobs and have cost, every Texas Family, tens of thousands a year defunding or police. And it costing us jobs all of raising our taxes. Candace, Valenzuela risk, Texas handful of fun. This responsible for the content of this advertising.",http://mycmag.kantarmediana.com/KMIcmagvidbin2/HOUSE_TX24_CLF_WE_KNOW.wmv,0.8995223,0.212829736211031
HOUSE_TX24_DCCC_WARNING_FOR_TEXAS,"Attention. She push to open up even more. Now. She supports the gutting protections for pre-existing conditions bccc is responsible for the care. Plan would allow you to discriminate against the sick, raise insurance premiums and health coverage. And I will not let this crisis go to waste.",http://mycmag.kantarmediana.com/KMIcmagvidbin2/HOUSE_TX24_DCCC_WARNING_FOR_TEXAS.wmv,0.8995223,0.212829736211031
HOUSE_TX24_HOUSEMAJPAC_THE_COWBOYS,"When Beth Van duyne with me or being wealthy Cowboy. If they don't get the Congress, we could lose a lot more. Then don't support the plan that would cut protection for pre-existing conditions, like asthma cancer in coronavirus, but for wealthy donors, van dines, a winner, she supported flashing taxes. On the rich is 1% by drinking middle-class taxes and heading to from $10 to the death with that then die. You lose.",http://mycmag.kantarmediana.com/KMIcmagvidbin2/HOUSE_TX24_HOUSEMAJPAC_THE_COWBOYS.wmv,0.8995223,0.212829736211031
HOUSE_TX25_WILLIAMS_HEALTHCARE_HYPOCRITE,"Julie, Oliver is a healthcare Hypocrites. Oliver was an executive for the country's largest for-profit, hospital and will sitting on the Central Health Board voted to give the CEO of Central Health, bringing his total Compensation Plan. Learn more at Julie, Oliver fax.com.",http://mycmag.kantarmediana.com/KMIcmagvidbin2/HOUSE_TX25_WILLIAMS_HEALTHCARE_HYPOCRITE.wmv,0.8995223,0.212829736211031
HOUSE_TX28_CUELLAR_THE_AMERICAN_DREAM,"This is the American dream at the largest, middle-class tax cut in Texas history experience and seniority working for us.",http://mycmag.kantarmediana.com/KMIcmagvidbin2/HOUSE_TX28_CUELLAR_THE_AMERICAN_DREAM.wmv,0.8995223,0.212829736211031
HOUSE_TX32_COLLINS_BROKE_THAT_PROMISE,"I'll be an independent voice for North, Texas. That was calling already in 2018. Unfortunately, he broke that promise as soon as he got to Congress voting, with Nancy Pelosi, 100% of the time even for higher, taxes and refusing to sing motion, I'm not a politician. I'm a business woman, who knows, how to innovate solve problems and get people back to work. That's exactly what I'll do. I'm trying to be found and I approve this message.",http://mycmag.kantarmediana.com/KMIcmagvidbin2/HOUSE_TX32_COLLINS_BROKE_THAT_PROMISE.wmv,0.8995223,0.212829736211031
HOUSE_TX32_COLLINS_KK_ATKINSON,"I started in 89, as a single mother. I bought it in 09 and it's what he supported raising taxes on small businesses during a shutdown. Why would you do that? He just doesn't know what it takes to run a business. Or create job is a job creators that will get us through the pandemic and that's what we need to be Collins. And I approve this message.",http://mycmag.kantarmediana.com/KMIcmagvidbin2/HOUSE_TX32_COLLINS_KK_ATKINSON.wmv,0.8995223,0.212829736211031
HOUSE_TX34_GONZALEZ_KEEP_MORE_OF_YOUR_MONEY,"Do you want to keep more of your money? I'm talked to Ray Gonzales and I'm a conservative and every way, especially when it comes to economics. The tax relief, law is working. We now enjoy record. Low unemployment rate yet for middle-class families, struggling to live, paycheck-to-paycheck. I support keeping more money in your pocket. Send me to Washington and people will know. That's 34th. Gresham district is open for business.",http://mycmag.kantarmediana.com/KMIcmagvidbin2/HOUSE_TX34_GONZALEZ_KEEP_MORE_OF_YOUR_MONEY.wmv,0.8995223,0.212829736211031
HOUSE_TX34_GONZALEZ_VALUES_SP,People security. So Secret.,http://mycmag.kantarmediana.com/KMIcmagvidbin2/HOUSE_TX34_GONZALEZ_VALUES_SP.wmv,0.8995223,0.212829736211031
HOUSE_UT01_GIBSON_PRO_LIFE_PRO_GUN_PRO_TRUMP_15,Conservative carry Gibson and pro Trump in Congress. I am carry Gibson and I approve this message.,http://mycmag.kantarmediana.com/KMIcmagvidbin2/HOUSE_UT01_GIBSON_PRO_LIFE_PRO_GUN_PRO_TRUMP_15.wmv,0.8995223,0.212829736211031
HOUSE_UT01_STEVENSON_TOO_MANY_POLITICIANS,"Congress already has too many politicians and not enough L Stevenson values. Bob Stevenson. Stop spending increases as Davis County Commissioner and twice lower taxes. As mayor of Laden Bob Stevenson focused on bringing our economy back for small businesses energy, producers in Hill Air Force Base, the right values to put Utah. First, I am Bob Stephenson.",http://mycmag.kantarmediana.com/KMIcmagvidbin2/HOUSE_UT01_STEVENSON_TOO_MANY_POLITICIANS.wmv,0.8995223,0.212829736211031
HOUSE_UT04_CFC_TRAIL_OF_DEBT,"In 2012, Burgess Owens moved to Utah with a trail of debt debts in multiple States and Faith to pay his taxes and 1.7 million dollars to businesses and creditors in several states. That doesn't go to Washington.",http://mycmag.kantarmediana.com/KMIcmagvidbin2/HOUSE_UT04_CFC_TRAIL_OF_DEBT.wmv,0.8995223,0.212829736211031
HOUSE_UT04_CLF_FOLLOW_THE_LEADER,Congress in his place and fax out of line for your job.,http://mycmag.kantarmediana.com/KMIcmagvidbin2/HOUSE_UT04_CLF_FOLLOW_THE_LEADER.wmv,0.8995223,0.212829736211031
HOUSE_UT04_CLF_THINGS_HAVE_CHANGED,"Things have changed meetings, hairstyles office wear and Ben McAdams. Been really changed. One thing hasn't changed McAdams, like your property taxes? Go up as mayor and now supports Joe B. Who's planning a 4 trillion dollar tax hike change? Not how we hope Congressional leadership fund is responsible for the content of this advertising.",http://mycmag.kantarmediana.com/KMIcmagvidbin2/HOUSE_UT04_CLF_THINGS_HAVE_CHANGED.wmv,0.8995223,0.212829736211031
HOUSE_UT04_CLF_WHAT_HAVE_WE_LEARNED,What have we learned about Ben McAdams when he had the chance to help victims of religious persecution in China. He skipped his lawyer has increased by 9.4 million dollars by who wants to raise taxes by 4 trillion dollars. Democratic Congressional leadership fund is responsible for the content of this advertising.,http://mycmag.kantarmediana.com/KMIcmagvidbin2/HOUSE_UT04_CLF_WHAT_HAVE_WE_LEARNED.wmv,0.8995223,0.212829736211031
HOUSE_UT04_HOUSEMAJPAC_SAYS_A_LOT,"Great journey says a lot about people. Utah was founded on Rizal d61. But Burgess Owens made his journey to Utah. Bankruptcy 6 times a million in unpaid taxes and always owed over 1.7 million dollars to businesses. And creditors, Burgess Owens Journey shows. You should be House. Majority Pac is responsible for the content of this advertising.",http://mycmag.kantarmediana.com/KMIcmagvidbin2/HOUSE_UT04_HOUSEMAJPAC_SAYS_A_LOT.wmv,0.8995223,0.212829736211031
HOUSE_UT04_HOUSEMAJPAC_THE_RECORD,You can tell a lot about a person from their record said who is Burgess Owens bankruptcy 6. * hundreds of thousands in unpaid taxes in Owens over 1.7 million dollars to businesses and creditors.,http://mycmag.kantarmediana.com/KMIcmagvidbin2/HOUSE_UT04_HOUSEMAJPAC_THE_RECORD.wmv,0.8995223,0.212829736211031
HOUSE_UT04_MCADAMS_AS_MAYOR,"In Washington, independent, Utah. Member of Congress. Adam for congress approve? This message.",http://mycmag.kantarmediana.com/KMIcmagvidbin2/HOUSE_UT04_MCADAMS_AS_MAYOR.wmv,0.8995223,0.212829736211031
HOUSE_UT04_MCADAMS_BILL_APPLEGARTH_15,Is there he lured the tax rate and balance the county budget in Washington exposed waste. I approve this message.,http://mycmag.kantarmediana.com/KMIcmagvidbin2/HOUSE_UT04_MCADAMS_BILL_APPLEGARTH_15.wmv,0.8995223,0.212829736211031
