alt,transcript,link,alpha,wmp_ratio
USSEN_AZ_ONENATION_CHALLENGING,"This is the most challenging year that people have had in their lifetime. Cuz then Senator Martha McSally delivered funding for our hospitals, paid for small businesses saving job, and we found precious health insurance for families. Now is, Senator McSally is working to help businesses again, to save more jobs, to save health insurance for more families. Tell Senator McSally. Keep fighting to save jobs for hard-working, Arizona families.",http://mycmag.kantarmediana.com/KMIcmagvidbin2/USSEN_AZ_ONENATION_CHALLENGING.wmv,0.7732577,0.212829736211031
USSEN_AZ_ONENATION_LEADERSHIP,"In this crisis leadership matters, quick action from Senator Martha, McSally. Our hospitals, Millions to save lives and save Arizona jobs to helping family survive. Everything I can and it's unprecedented time to help arizonans in order to get the release that they need to get through this saving more jobs. Tell Senator McSally keep fighting for Arizona, small businesses and our jobs.",http://mycmag.kantarmediana.com/KMIcmagvidbin2/USSEN_AZ_ONENATION_LEADERSHIP.wmv,0.7732577,0.212829736211031
USSEN_AZ_ONENATION_NATIONAL_CRISIS,"They risked their lives on the battlefield is heartbreaking and National crisis. That needs to be addressed, Senator Martha. McSally wrote legislation to get better in some mental health care. They need Senator mcsally's Bill, expands Mental Health Options for veterans and help tackle PTSD to get this help before. It's too late. Tell Senator McSally to keep fighting to get our veterans and mental health care. They deserve",http://mycmag.kantarmediana.com/KMIcmagvidbin2/USSEN_AZ_ONENATION_NATIONAL_CRISIS.wmv,0.7732577,0.212829736211031
USSEN_AZ_PPAF_TITLE_X_MCSALLY,Call Martha McSally and tell her.,http://mycmag.kantarmediana.com/KMIcmagvidbin2/USSEN_AZ_PPAF_TITLE_X_MCSALLY.wmv,0.7732577,0.212829736211031
USSEN_AZ_SLF_AARON,"After I served in Iraq, I became a combat instructor. I trained sixty thousand Marines. I had to give ten years of financial records to get a security clearance after his deals with China returns today, Shady deal those matter and Healthcare. I've seen surprise billing qualifying, Mark, Kelly sold us out.",http://mycmag.kantarmediana.com/KMIcmagvidbin2/USSEN_AZ_SLF_AARON.wmv,0.7732577,0.212829736211031
USSEN_AZ_SLF_AARON_PIC,"After I served in Iraq, I became a combat instructor. I trained 60 thousand Marines, returns today, Shady deal those matter. I've seen surprise billing Marcal, Marcal. He sold us out.",http://mycmag.kantarmediana.com/KMIcmagvidbin2/USSEN_AZ_SLF_AARON_PIC.wmv,0.7732577,0.212829736211031
USSEN_AZ_SLF_COUNTDOWN,"Every 40 seconds. Someone has a stroke starting a countdown to Save a Life with Mark. Kelly's liberal Health Care scheme could close hospitals across Arizona. Nowhere to go. Kelly's Hospital closures would have life-or-death implications, kill healthcare jobs and raise taxes over $2,300 a year. More taxes, less Healthcare. We can't afford Mark. Kelly Senate leadership funds is responsible for the car.",http://mycmag.kantarmediana.com/KMIcmagvidbin2/USSEN_AZ_SLF_COUNTDOWN.wmv,0.7732577,0.212829736211031
USSEN_AZ_SLF_LIBERAL_SCHEME,"Arizona's 127 Hospital in Arizona and support over 200,000 jobs, but martelli's liberal. Health Care scheme could close hospitals across Arizona Healthcare at risk and killing Jobs Plus Kelly's liberal scheme could raise taxes over $2,300 a year, higher taxes and recessions Hospital closures in a pandemic. We can't afford Mark. Kelly Senate leadership is responsible for the content of this advertising.",http://mycmag.kantarmediana.com/KMIcmagvidbin2/USSEN_AZ_SLF_LIBERAL_SCHEME.wmv,0.7732577,0.212829736211031
USSEN_AZ_SLF_RAISE_TAXES,"Kelly. He will raise our taxes by $2,300 a year and Kelly would cut billions in funding for our hospitals. Set flash money for hospitals to close a bunch of Arizona hospitals wants to mess with my medicare.",http://mycmag.kantarmediana.com/KMIcmagvidbin2/USSEN_AZ_SLF_RAISE_TAXES.wmv,0.7732577,0.212829736211031
USSEN_AZ_SMP_DEBORAH,"Years ago, I was diagnosed with breast cancer radiation and chemo. Companies to conditions including cancer. I mean, how could she do that? Why would anybody do that? She's lying to cover her tracks.",http://mycmag.kantarmediana.com/KMIcmagvidbin2/USSEN_AZ_SMP_DEBORAH.wmv,0.7732577,0.212829736211031
USSEN_AZ_SMP_DOING_IT_AGAIN,"She did it two years ago. Now she's doing it. Again. Martha McSally will say, or do anything running as exposed as a line to let insurance companies.",http://mycmag.kantarmediana.com/KMIcmagvidbin2/USSEN_AZ_SMP_DOING_IT_AGAIN.wmv,0.7732577,0.212829736211031
USSEN_AZ_SMP_DR_GREGORY_JARRIN,It's hard to watch to do it today as I speak to health insurance companies to help us.,http://mycmag.kantarmediana.com/KMIcmagvidbin2/USSEN_AZ_SMP_DR_GREGORY_JARRIN.wmv,0.7732577,0.212829736211031
USSEN_AZ_SMP_EARLY_VOTING_SP,Kelly.,http://mycmag.kantarmediana.com/KMIcmagvidbin2/USSEN_AZ_SMP_EARLY_VOTING_SP.wmv,0.7732577,0.212829736211031
USSEN_AZ_SMP_NEW_MISSION_SP,"But if I talk to you like that, but I was told by The Proclaimers.",http://mycmag.kantarmediana.com/KMIcmagvidbin2/USSEN_AZ_SMP_NEW_MISSION_SP.wmv,0.7732577,0.212829736211031
USSEN_AZ_SMP_REJECTED,"Two years ago, Arizona voted against Martha, McSally because we knew she protecting our health care to help yourself. Martha hasn't changed.",http://mycmag.kantarmediana.com/KMIcmagvidbin2/USSEN_AZ_SMP_REJECTED.wmv,0.7732577,0.212829736211031
USSEN_AZ_TPA_FIGHTS_FOR_US_MCSALLY_SP,I'm almost there I C K gracias in Alabama.,http://mycmag.kantarmediana.com/KMIcmagvidbin2/USSEN_AZ_TPA_FIGHTS_FOR_US_MCSALLY_SP.wmv,0.7732577,0.212829736211031
USSEN_AZ_VOTEVETS_VIRGEL_C,"I'm a veteran and a proud grandpa, my daughter and grandchildren live with us. And recently had covid-19, Martha McSally supposed to be looking out for us and she's not. She's voted to allow insurance companies to deny coverage for people with pre-existing conditions. And that includes covid-19. Also voted to take Healthcare away from almost 500,000 veterans. She's turned her back on Veterans. Like me her boats, threatened. My entire family. We deserve a little more respect than that.",http://mycmag.kantarmediana.com/KMIcmagvidbin2/USSEN_AZ_VOTEVETS_VIRGEL_C.wmv,0.7732577,0.212829736211031
USSEN_CO_ABETTERCO_DOESN'T_CARE,He doesn't care about the environment here and 11% rating from the league of conservation voters. Single Town Hall doesn't care about your health care. Once Corey cares about keeping his job doing political action.,http://mycmag.kantarmediana.com/KMIcmagvidbin2/USSEN_CO_ABETTERCO_DOESN'T_CARE.wmv,0.7732577,0.212829736211031
USSEN_CO_DUTYHONOR_EVERYDAY_SP,Didn't notice that I can do for you.,http://mycmag.kantarmediana.com/KMIcmagvidbin2/USSEN_CO_DUTYHONOR_EVERYDAY_SP.wmv,0.7732577,0.212829736211031
USSEN_CO_DUTYHONOR_PRE_EXISTING_CONDITIONS_SP,Coronavirus.,http://mycmag.kantarmediana.com/KMIcmagvidbin2/USSEN_CO_DUTYHONOR_PRE_EXISTING_CONDITIONS_SP.wmv,0.7732577,0.212829736211031
USSEN_CO_GARDNER_CINDY,"I will never forget the day the time the place where I was when I found out that my mom had cancer or how grateful I felt when she beat it. I'm Cory Gardner, battle chronic diseases are heroes. Corey wrote the Bill to guarantee coverage to people with pre-existing conditions forever, this message, because some things matter more.",http://mycmag.kantarmediana.com/KMIcmagvidbin2/USSEN_CO_GARDNER_CINDY.wmv,0.7732577,0.212829736211031
USSEN_CO_HICKENLOOPER_BETTY_LEHMAN,"My son, Eli has autism in complex care needs to expand Medicaid for kids and adults with disabilities were made that happen. It was extraordinary Cory Gardner, vote against protecting any pre-existing condition. That should be caring and effective. I approve this message.",http://mycmag.kantarmediana.com/KMIcmagvidbin2/USSEN_CO_HICKENLOOPER_BETTY_LEHMAN.wmv,0.7732577,0.212829736211031
USSEN_CO_HICKENLOOPER_BIG_CHANGES_SP,"Peoples, Trust Insurance in Aurora.",http://mycmag.kantarmediana.com/KMIcmagvidbin2/USSEN_CO_HICKENLOOPER_BIG_CHANGES_SP.wmv,0.7732577,0.212829736211031
USSEN_CO_HICKENLOOPER_DSCC_MY_DAD,My dad and I don't have a lot. I can still feel that hug dealing with covid-19 and often no health coverage. I can't understand how Cory Gardner to be trying to take Healthcare away from people in the middle of this crisis of John Hickenlooper. I approve this message. I will always fight to protect your health care.,http://mycmag.kantarmediana.com/KMIcmagvidbin2/USSEN_CO_HICKENLOOPER&DSCC_MY_DAD.wmv,0.7732577,0.212829736211031
USSEN_CO_HICKENLOOPER_FACES_SP,Cory Gardner.,http://mycmag.kantarmediana.com/KMIcmagvidbin2/USSEN_CO_HICKENLOOPER_FACES_SP.wmv,0.7732577,0.212829736211031
USSEN_CO_HICKENLOOPER_JARED_POLIS,"I have a simple message, don't believe these ridiculous attack ads about John Hickenlooper. They're just part of his personal cell number. I've seen him, refuse to give up on expanding health coverage when no one else thought it was possible to move. Her is one of the most effective leaders. I know you need that right now. I'm John Hickenlooper, and I approve this message.",http://mycmag.kantarmediana.com/KMIcmagvidbin2/USSEN_CO_HICKENLOOPER_JARED_POLIS.wmv,0.7732577,0.212829736211031
USSEN_CO_HICKENLOOPER_JARED_POLIS_SP,"Dangle the carrot cake. Washington, d.c. Progressive super letter.",http://mycmag.kantarmediana.com/KMIcmagvidbin2/USSEN_CO_HICKENLOOPER_JARED_POLIS_SP.wmv,0.7732577,0.212829736211031
USSEN_CO_HICKENLOOPER_JEANNE_SWAIM,"This message to repeal Obamacare and it was scary fighting cancer and Health Care away from me. Now. I see Corey, Gardner's ads and I'm disgusted pretending, he's going to protect me to get protections for people with pre-existing conditions. There are 2.4 million of us in Colorado, and we know that",http://mycmag.kantarmediana.com/KMIcmagvidbin2/USSEN_CO_HICKENLOOPER_JEANNE_SWAIM.wmv,0.7732577,0.212829736211031
USSEN_CO_HICKENLOOPER_JESSIKA_SP,Counter dos veces. Dentist in Gardner. I ever see them as the only distances.,http://mycmag.kantarmediana.com/KMIcmagvidbin2/USSEN_CO_HICKENLOOPER_JESSIKA_SP.wmv,0.7732577,0.212829736211031
USSEN_CO_HICKENLOOPER_JESUSIO_SILVA,My brother was a chance he'd by a drunk driver to stay in a company shelter for four more years is boss. Was John Hickenlooper? I don't know what I will done without him. I seen this ad so that I can come to see me and I approve this message.,http://mycmag.kantarmediana.com/KMIcmagvidbin2/USSEN_CO_HICKENLOOPER_JESUSIO_SILVA.wmv,0.7732577,0.212829736211031
USSEN_CO_HICKENLOOPER_JESUSIO_SILVA_SP,Delaware map.,http://mycmag.kantarmediana.com/KMIcmagvidbin2/USSEN_CO_HICKENLOOPER_JESUSIO_SILVA_SP.wmv,0.7732577,0.212829736211031
USSEN_CO_HICKENLOOPER_LUNACY,"In the middle of a Health crisis, why is the Trump Administration in court? Medical conditions to get covid-19. I approve this message cuz he's got to stop fighting about Healthcare and get to work.",http://mycmag.kantarmediana.com/KMIcmagvidbin2/USSEN_CO_HICKENLOOPER_LUNACY.wmv,0.7732577,0.212829736211031
USSEN_CO_HICKENLOOPER_MANY_PROMISES_SP,Colorado.,http://mycmag.kantarmediana.com/KMIcmagvidbin2/USSEN_CO_HICKENLOOPER_MANY_PROMISES_SP.wmv,0.7732577,0.212829736211031
USSEN_CO_HICKENLOOPER_NEWSPAPER_ENDORSEMENTS,"Across Colorado newspaper is John Hickenlooper, the big problems, but Cory Gardner of fraud, a charlatan of trump. We need leaders who can work with each other and Trust on John Hickenlooper. And I approve this message.",http://mycmag.kantarmediana.com/KMIcmagvidbin2/USSEN_CO_HICKENLOOPER_NEWSPAPER_ENDORSEMENTS.wmv,0.7732577,0.212829736211031
USSEN_CO_HICKENLOOPER_OPTIMIST,"I've always been an optimist no matter how broke we can find a Better Way Forward. That's why I want to go to the Senate to fundamentally change. Washington, biggest problems getting people. I approve this message. It all starts with your vote.",http://mycmag.kantarmediana.com/KMIcmagvidbin2/USSEN_CO_HICKENLOOPER_OPTIMIST.wmv,0.7732577,0.212829736211031
USSEN_CO_HICKENLOOPER_PROGRESS,"How do you make progress towards your heart out plant? Shut down New Hope coverage for 500,000, long-term contraception for women, body cameras, in transparency for police for big change. He'll be as senator, who delivers?",http://mycmag.kantarmediana.com/KMIcmagvidbin2/USSEN_CO_HICKENLOOPER_PROGRESS.wmv,0.7732577,0.212829736211031
USSEN_CO_HICKENLOOPER_RELIEF,"Do you know what it means to have health insurance for the first time? It's a gigantic release, especially in this pandemic House in Colorado. Have health insurance today. I'm John Hickenlooper and I approve this message.",http://mycmag.kantarmediana.com/KMIcmagvidbin2/USSEN_CO_HICKENLOOPER_RELIEF.wmv,0.7732577,0.212829736211031
USSEN_CO_HICKENLOOPER_SERVED,"4 years, John Hickenlooper has served as state through floods and wildfires heartbreak. And reception, expanded health coverage when John Hickenlooper decided to run against Cory Gardner, The Barrage of attacks began because Cory Gardner can't defend standing with Donald Trump. 100% of the time. John Hickenlooper got he's always been and always will be. This is the same John Hickenlooper and I approve this message.",http://mycmag.kantarmediana.com/KMIcmagvidbin2/USSEN_CO_HICKENLOOPER_SERVED.wmv,0.7732577,0.212829736211031
USSEN_CO_HICKENLOOPER_SLAMMED,"Jared Polis, just slammed Andrew Romanoff vs. John Hickenlooper, make a note, but I didn't know he'll fight with them to come back climate change and get healthcare for all four Regional Justice Center, revive the middle class. Do you know, John Hickenlooper will defeat Cory Gardner and help them bring the change being me.",http://mycmag.kantarmediana.com/KMIcmagvidbin2/USSEN_CO_HICKENLOOPER_SLAMMED.wmv,0.7732577,0.212829736211031
USSEN_CO_HICKENLOOPER_WHICH_CORY,"I'm looking forward to the debate of which Cory Gardner's going to show up this time exist in conditions. This guy suddenly for protection for air and water, but he's posing as an environmentalist, Donald Trump's 100%, I approve this message. Maybe we are just let Cory Gardner debate, Cory Gardner.",http://mycmag.kantarmediana.com/KMIcmagvidbin2/USSEN_CO_HICKENLOOPER_WHICH_CORY.wmv,0.7732577,0.212829736211031
USSEN_CO_MAJORITYFORWARD_ACA_LAWSUIT,"Recent interview. Cory Gardner was asked if he supports the lawsuit to throw out the Affordable Care Act, the Supreme Court's testing conditions. Yes, or no.",http://mycmag.kantarmediana.com/KMIcmagvidbin2/USSEN_CO_MAJORITYFORWARD_ACA_LAWSUIT.wmv,0.7732577,0.212829736211031
USSEN_CO_MAJORITYFORWARD_ACA_LAWSUIT_TRUMP,"Cory Gardner was asked if he supports Donald Trump's lawsuit about the Affordable Care Act in courts, testing conditions. Yes, or no.",http://mycmag.kantarmediana.com/KMIcmagvidbin2/USSEN_CO_MAJORITYFORWARD_ACA_LAWSUIT_TRUMP.wmv,0.7732577,0.212829736211031
USSEN_CO_MAJORITYFORWARD_PRE-EXISTING_CONDITION,"They're 2.4 million of us 2.4 million coloradans with a pre-existing condition like cancer diabetes or heart disease, but can we count on Cory Gardner to protect our health care in, Washington, Gardner, voted with Donald Trump protections for people with pre-existing conditions and tell Cory Gardner.",http://mycmag.kantarmediana.com/KMIcmagvidbin2/USSEN_CO_MAJORITYFORWARD_PRE-EXISTING_CONDITION.wmv,0.7732577,0.212829736211031
USSEN_CO_MAJORITYFORWARD_PRE-EXISTING_CONDITION_INS_COMPANIES,"They're 2.4 million of us 2.4 million coloradans with a pre-existing condition like cancer diabetes or heart disease, but can we count on Cory Gardner to protect our health care in Washington, Gardner voted to eliminate protections for people with pre-existing conditions and even during a pandemic Gardener refuses, to condemn the lawsuit that strips away. Our coverage tell Cory Gardner insurance companies.",http://mycmag.kantarmediana.com/KMIcmagvidbin2/USSEN_CO_MAJORITYFORWARD_PRE-EXISTING_CONDITION_INS_COMPANIES.wmv,0.7732577,0.212829736211031
USSEN_CO_MAJORITYFORWARD_PRE-EXISTING_CONDITION_SP,Washington vote on whether this is control.,http://mycmag.kantarmediana.com/KMIcmagvidbin2/USSEN_CO_MAJORITYFORWARD_PRE-EXISTING_CONDITION_SP.wmv,0.7732577,0.212829736211031
USSEN_CO_PPAF_TITLE_X_GARDNER,Explains why he brought the country to access their birth control. Affordable Health Care.,http://mycmag.kantarmediana.com/KMIcmagvidbin2/USSEN_CO_PPAF_TITLE_X_GARDNER.wmv,0.7732577,0.212829736211031
USSEN_CO_RMV_JOSEPH,"Joseph, your child struggling to breathe, look out for families like ours and listen to the health insurance and drug companies. Insurance companies.",http://mycmag.kantarmediana.com/KMIcmagvidbin2/USSEN_CO_RMV_JOSEPH.wmv,0.7732577,0.212829736211031
USSEN_CO_RMV_TEAMING_UP,"Cory Gardner, Mitch McConnell, teaming up again to take away your health care during the pandemic. They're rushing to put Trump's pick on the Supreme Court before an election. If they do, the court will approve Trump's lawsuit. That means costs go up and protections for people with pre-existing conditions are Stripped Away. Don't rush to confirm Amy, Coney Barrett Rocky Mountains.",http://mycmag.kantarmediana.com/KMIcmagvidbin2/USSEN_CO_RMV_TEAMING_UP.wmv,0.7732577,0.212829736211031
USSEN_CO_RMV_TEAMING_UP_60,"Cory Gardner and Mitch McConnell are teaming up again to take away your health care and this time during a pandemic right now was rushing to put Trump's pic into a Lifetime on the Supreme Court weeks before an election. If they do, it will approve, existing conditions and cut covered for 20 million people. During a pandemic, is too important to stand up to Mitch McConnell and Donald Trump vote to confirm. Amy, Coney, Barrett before inauguration Rocky Mountain values, his response.",http://mycmag.kantarmediana.com/KMIcmagvidbin2/USSEN_CO_RMV_TEAMING_UP_60.wmv,0.7732577,0.212829736211031
USSEN_CO_ROMANOFF_BROKEN,"I know what it's like someone you love. That's why I led the fight for mental health care, but it shouldn't take a crisis to teacher has our Healthcare System is broken. If you have enough, you can buy the best care in the world. If your insurance company, you can even buy Congress. I approve this message and I'm running for the Senate because you shouldn't have to worry about how to pay for it.",http://mycmag.kantarmediana.com/KMIcmagvidbin2/USSEN_CO_ROMANOFF_BROKEN.wmv,0.7732577,0.212829736211031
USSEN_CO_ROMANOFF_BROKEN_INEQUALITY,"Someone you loved, that's why I read the fight. You can buy the best care in the world. If your insurance company, you can even buy Congress. I mean, I approve this message and I'm running for the Senate. When you're fighting for your life. You shouldn't have to worry about how to pay for it.",http://mycmag.kantarmediana.com/KMIcmagvidbin2/USSEN_CO_ROMANOFF_BROKEN_INEQUALITY.wmv,0.7732577,0.212829736211031
USSEN_CO_ROMANOFF_HOPE_OVER_FEAR,"Moment. Choose hope over fear. Courage, over hate, a new generation of leadership. Everyone vote for fresh, Fearless progress.",http://mycmag.kantarmediana.com/KMIcmagvidbin2/USSEN_CO_ROMANOFF_HOPE_OVER_FEAR.wmv,0.7732577,0.212829736211031
USSEN_CO_SLF_CONTEMPT,We thought we knew John Hickenlooper DC to pass government-run healthcare for the Socialists energy schemes. Can't trust John Hickenlooper to stand up for us. After all. I don't think I'm cut out for that.,http://mycmag.kantarmediana.com/KMIcmagvidbin2/USSEN_CO_SLF_CONTEMPT.wmv,0.7732577,0.212829736211031
USSEN_CO_SLF_COST_YOU,"Private Resort, 97 alleged violations, healty of violating ethics laws and taxpayers charge more than 150. But if Hickenlooper goes to DC, it could cost you even more Hickenlooper supports a government-run health care scheme that can take away private, insurance, and raise taxes $2,800. John hickenlooper's corruption key in Colorado, taxpayers.",http://mycmag.kantarmediana.com/KMIcmagvidbin2/USSEN_CO_SLF_COST_YOU.wmv,0.7732577,0.212829736211031
USSEN_CO_SLF_OUT_OF_BOUNDS,"Three-strikes-and-you're-out, 10 yards for a first down some of those we all agree on. John Hickenlooper has opened in the world and DC John Hickenlooper is way out of bounds.",http://mycmag.kantarmediana.com/KMIcmagvidbin2/USSEN_CO_SLF_OUT_OF_BOUNDS.wmv,0.7732577,0.212829736211031
USSEN_CO_SLF_THE_HICKENLOOPER_RULES,"Has Governor John Hickenlooper played by his own set of rules breaking the law and spending taxpayer dollars on himself. Now had to move her to change the rules and their extreme agenda. Like these funding Mobile police department and government-run health-care. They could raise taxes $2,800 per year. John Hickenlooper, sold us out before. Chances are He'll Do It Again.",http://mycmag.kantarmediana.com/KMIcmagvidbin2/USSEN_CO_SLF_THE_HICKENLOOPER_RULES.wmv,0.7732577,0.212829736211031
USSEN_CO_SLF_THE_HICKENLOOPER_RULES_3,"John Hickenlooper plays by his own rules in town with his political backers. Want now hickenlooper's extreme back. So they can pass government-run Health Care $2,800 per year and the police and a socialist energy scheme that would drive up gas and electricity prices in for broke the rules and sold us out before we can't risk. Shady John Hickenlooper Senate leadership.",http://mycmag.kantarmediana.com/KMIcmagvidbin2/USSEN_CO_SLF_THE_HICKENLOOPER_RULES_3.wmv,0.7732577,0.212829736211031
USSEN_CO_SMP_BIG_DIFFERENCES,"Real differences in the race for Senate. Did nine times to eliminate Healthcare protections for people with the same conditions. And even in a pandemic, Cory Gardner and Donald Trump, still support overturning Obamacare. What is Governor? John Hickenlooper expanded medicaid to 400,000 Colorado and he'll always fight to protect coverage for people with pre-existing conditions. John Hickenlooper snps responsible for the content of his advertising.",http://mycmag.kantarmediana.com/KMIcmagvidbin2/USSEN_CO_SMP_BIG_DIFFERENCES.wmv,0.7732577,0.212829736211031
USSEN_CO_SMP_BIG_DIFFERENCES_SP,"Cory Gardner, vote on Obamacare and Hickenlooper. Cory Gardner?",http://mycmag.kantarmediana.com/KMIcmagvidbin2/USSEN_CO_SMP_BIG_DIFFERENCES_SP.wmv,0.7732577,0.212829736211031
USSEN_CO_SMP_DISTASTEFUL,"Horrifying misleading ads for Cory Gardner. So, distasteful, Republicans are it's Cory Gardner coded 98% of a time with Donald Trump including people with pre-existing conditions. Cory Gardner. He's for Trump not Colorado. SMP is responsible for the content of this at",http://mycmag.kantarmediana.com/KMIcmagvidbin2/USSEN_CO_SMP_DISTASTEFUL.wmv,0.7732577,0.212829736211031
USSEN_CO_SMP_DISTASTEFUL_INS_COMPANIES,"Define misleading ads for Cory Gardner. So distasteful, there have been calls for them to be taken off the air, The Denver Post, call John Hickenlooper and ethical public servant who's been extremely transparent. It's Cory Gardner who's taking 1.1 million dollars from the drug and insurance Industries in Gardner. Voted nine times to eliminate protections for people with pre-existing conditions. Cory, Gardner's for the insurance companies. Not Colorado is responsible for the content of this at.",http://mycmag.kantarmediana.com/KMIcmagvidbin2/USSEN_CO_SMP_DISTASTEFUL_INS_COMPANIES.wmv,0.7732577,0.212829736211031
USSEN_CO_SMP_FACT_CHECKERS,"Should you believe Corey Gardner's claims about Healthcare? Fact-checkers degree is not true. Gardener has Cory Gardner have not been protecting people with pre-existing conditions. The truth is Gardner's, taken 1.1 million dollars from the insurance industry. And he's voted nine times again. Protecting people with pre-existing conditions. We can trust Cory Gardner to be for Colorado. SMP is responsible for the car.",http://mycmag.kantarmediana.com/KMIcmagvidbin2/USSEN_CO_SMP_FACT_CHECKERS.wmv,0.7732577,0.212829736211031
USSEN_CO_SMP_LOUDER_THAN_WORDS,"They say actions speak louder than words. And when it comes to Cory Gardner there, right? Regarding our likes to say, do the insurance. In pharmaceutical industry actions do speak louder than Cory Gardner. Can't trust them to be for Colorado. SM. He's responsible for the content of this ad.",http://mycmag.kantarmediana.com/KMIcmagvidbin2/USSEN_CO_SMP_LOUDER_THAN_WORDS.wmv,0.7732577,0.212829736211031
USSEN_CO_SMP_WORKING_FOR_TRUMP,"Cory Gardner said a hundred percent of the time of Colorado. Football team. Corey do. Giving trillions in tax breaks to corporations and the wealthy and trying to eliminate protections for pre-existing conditions. Cory Gardner. Working for Trump. Colorado, smps responsible for the content of this.",http://mycmag.kantarmediana.com/KMIcmagvidbin2/USSEN_CO_SMP_WORKING_FOR_TRUMP.wmv,0.7732577,0.212829736211031
USSEN_DE_COONS_TOUGH_TIME,"It's a tough time to be a nurse. It's even harder for all the people we treat, who are sick and scared. We've fought to protect Obamacare and one but we have so much more to do. Let's lower premiums and prescription drug prices and fund Community Healthcare quality, affordable, health care is a right. Not a privilege. I'm Chris Coons and I approve this message.",http://mycmag.kantarmediana.com/KMIcmagvidbin2/USSEN_DE_COONS_TOUGH_TIME.wmv,0.7732577,0.212829736211031
USSEN_GA_CFG_SICK_OF_TAXES,"Taxes until Congress, hikes are toxic, That's not healthy Constitution. Can't afford more, Texas, reject hr1384, the text raging medicare-for-all Act.",http://mycmag.kantarmediana.com/KMIcmagvidbin2/USSEN_GA_CFG_SICK_OF_TAXES.wmv,0.7732577,0.212829736211031
USSEN_GA_DPU_THATS_A_GOOD_THING,"Medical billing but that fix cannot include government rate-setting. A slippery slope toward doctor, shortages and Hospital closures due to patients and Physicians, not big insurance.",http://mycmag.kantarmediana.com/KMIcmagvidbin2/USSEN_GA_DPU_THATS_A_GOOD_THING.wmv,0.7732577,0.212829736211031
USSEN_GA_DUTYHONOR_PRE_EXISTING_CONDITIONS,"I have Lupus kidney transplant. Treasure. he would the insurance companies who said,",http://mycmag.kantarmediana.com/KMIcmagvidbin2/USSEN_GA_DUTYHONOR_PRE_EXISTING_CONDITIONS.wmv,0.7732577,0.212829736211031
