alt,transcript,link,alpha,wmp_ratio
PRES_TRUMP_CHANGING_WASHINGTON,"President Trump is changing. Illegal immigration in half obliterating, Isis, their kalafe, destroyed their terrorist leader. And I approve this message.",http://mycmag.kantarmediana.com/KMIcmagvidbin2/PRES_TRUMP_CHANGING_WASHINGTON.wmv,0.8262365,0.212829736211031
PRES_TRUMP_HOLIDAYS,"The holidays are a time for America to come together, but Democrats are tearing our country apart attacking President Trump like never. Before we show the president on his side. Text, Trump to 88022 to show your support. President Trump is winning for America, celebrate the holidays texture support. You'll get access to an exclusive video message from President Trump and have a very merry Christmas. I'm Donald Trump and I approve this message.",http://mycmag.kantarmediana.com/KMIcmagvidbin2/PRES_TRUMP_HOLIDAYS.wmv,0.8262365,0.212829736211031
PRES_TRUMP_IMPEACHMENT_IS_A_SCAM,"Richmond is a scam. Impeachment is a bunch of the election. Ignore how we vote for president. Over six million new jobs. My paycheck is bigger. Trump is my president president President Donald Trump, and I approve this message.",http://mycmag.kantarmediana.com/KMIcmagvidbin2/PRES_TRUMP_IMPEACHMENT_IS_A_SCAM.wmv,0.8262365,0.212829736211031
PRES_TRUMP_UNDER_ATTACK,"President Trump is under attack. Nancy Pelosi in the far left. Stand with President. Trump. Text Trump 20/20, the 88022 now, fight back and receive a special message from the president. Text Trump 2022 88022. Now, don't let them steal the election at now. I'm Donald Trump and I approve this message.",http://mycmag.kantarmediana.com/KMIcmagvidbin2/PRES_TRUMP_UNDER_ATTACK.wmv,0.8262365,0.212829736211031
PRES_TRUMP_UNDER_ATTACK_15,"Current Trump is under attack. Nancy Pelosi to now. Donald J Trump, and I approve this message.",http://mycmag.kantarmediana.com/KMIcmagvidbin2/PRES_TRUMP_UNDER_ATTACK_15.wmv,0.8262365,0.212829736211031
PRES_TRUMP_UNDER_ATTACK_TRUMP45,"President Trump is under attack. Nancy Pelosi in the far-left, stand with President Trump. Text Trump 45 to 88022. Now fight back and receive a special message from the president text from 45 to 88022. Don't let them steal the election. Now, I'm Donald Trump and I approve this message.",http://mycmag.kantarmediana.com/KMIcmagvidbin2/PRES_TRUMP_UNDER_ATTACK_TRUMP45.wmv,0.8262365,0.212829736211031
PRES_WARREN_GREW_UP,"He grew up in a mansion in New York City. She grew up here in Oklahoma. He got millions from his dad's, real estate Empire profit school. She got debts, forgiven for students, who were scammed when someone shows you who they are, believe them. Trump's life taught him how to get rich on the backs of others. Elizabeth be a president who works for you.",http://mycmag.kantarmediana.com/KMIcmagvidbin2/PRES_WARREN_GREW_UP.wmv,0.8262365,0.212829736211031
PRES_WARREN_GREW_UP_NO_DATE,"He grew up in a mansion in New York City. She grew up here in Oklahoma. He got millions from his dad's, real estate Empire. He scammed students at school. She got debts, forgiven for students who were scammed. When someone shows you who they are, believe them. Trump's life taught him how to get rich on the backs of others. Elizabeth Warren, be a president who works for you.",http://mycmag.kantarmediana.com/KMIcmagvidbin2/PRES_WARREN_GREW_UP_NO_DATE.wmv,0.8262365,0.212829736211031
USSEN_AL_AFP_THE_REMEDY_IS_IMPEACHMENT,"The remedy is impeachment, impeachment Obsession. It's a shameful Witch Hunt and Doug Jones NADA values. Instead of confirming conservative judges, instead of securing our borders, by funding. The wall, Jones is siding with them. Call Doug Jones. Tell him to stop standing with the radical left and end impeachment.",http://mycmag.kantarmediana.com/KMIcmagvidbin2/USSEN_AL_AFP_THE_REMEDY_IS_IMPEACHMENT.wmv,0.8262365,0.212829736211031
USSEN_AL_BYRNE_FIRED,"Tommy tuberville said he wants illegals here. Jeff sessions. Still ain't in jail. What about you? 97% Pro, Trump. And I'll fight for Alabama.",http://mycmag.kantarmediana.com/KMIcmagvidbin2/USSEN_AL_BYRNE_FIRED.wmv,0.8262365,0.212829736211031
USSEN_AL_BYRNE_TRUMP_THANKS_15,Today is the day to celebrate these great warriors. For President Trump on 97%.,http://mycmag.kantarmediana.com/KMIcmagvidbin2/USSEN_AL_BYRNE_TRUMP_THANKS_15.wmv,0.8262365,0.212829736211031
USSEN_AL_TUBERVILLE_ENOUGH_IS_ENOUGH,"Bradley Byrne said, Donald Trump was not fit to be president. Jeff sessions enough is enough. I'm ready to fight for Alabama as your Senator. I'll have President Trump's back. I'm Tommy tuberville and I approve this message because week needs career politicians aren't tough enough to stand with President Trump, but I am",http://mycmag.kantarmediana.com/KMIcmagvidbin2/USSEN_AL_TUBERVILLE_ENOUGH_IS_ENOUGH.wmv,0.8262365,0.212829736211031
USSEN_AL_TUBERVILLE_ONE_OF_THE_WORST,"Socialists and liberals, who hate are Alabama conservative values. Doug Jones is one of the worst Jones voted to impeach President. Trump twice. He voted against Justice and now is going to vote against Amy. Coney Barrett enough's enough. I'm going to stand with President Trump to protect life, protect your guns and protect the values that make America great. I'm Tommy tuberville and I approve this message because I'm ready to fight for, Alabama.",http://mycmag.kantarmediana.com/KMIcmagvidbin2/USSEN_AL_TUBERVILLE_ONE_OF_THE_WORST.wmv,0.8262365,0.212829736211031
USSEN_AL_TUBERVILLE_VERY_CLEAR,"Tommy tuberville and the choice between Doug Jones. And me is very, very clear and gun grabbers is your taxes or money to pay for abortions. I'm going to help President Trump to save our great country. Together will secure the Border protect life and get folks back to work. I approve this message because Doug Jones is with Schumer and Pelosi and I'm with you.",http://mycmag.kantarmediana.com/KMIcmagvidbin2/USSEN_AL_TUBERVILLE_VERY_CLEAR.wmv,0.8262365,0.212829736211031
USSEN_AZ_MCSALLY_WASHINGTON_LIBERALS,"The Washington Liberals are obsessed with millions of dollars, trying to overturn the last election and steal. The next one supported. Kelly said, he would have voted to remove President Trump from office and the November ballot Mark Kelly has revealed his true colors. He's too liberal for, Arizona.",http://mycmag.kantarmediana.com/KMIcmagvidbin2/USSEN_AZ_MCSALLY_WASHINGTON_LIBERALS.wmv,0.8262365,0.212829736211031
USSEN_AZ_MOVEON_COMPLICIT_MCSALLY,"Martha McSally is complicit in Trump's crimes. She just to keep undermining. The Integrity of our election, Martha. McSally didn't do her job. But we are ready to do ours, vote her out moveon.org for the content of this advertising.",http://mycmag.kantarmediana.com/KMIcmagvidbin2/USSEN_AZ_MOVEON_COMPLICIT_MCSALLY.wmv,0.8262365,0.212829736211031
USSEN_CO_MOVEON_COMPLICIT,"Cory Gardner is complicit in Trump's crimes. He just voted to let Trump violate the constitution. He ignored his solemn oath to uphold the law and we'd like to keep undermining the Integrity of our elections. Cory Gardner didn't do his job, but we are ready to do ours, vote him out. Moveon.org political advertising.",http://mycmag.kantarmediana.com/KMIcmagvidbin2/USSEN_CO_MOVEON_COMPLICIT.wmv,0.8262365,0.212829736211031
USSEN_GA_COLLINS_MY_TURN,"Kelly well for spend 30 million dollars on slick ads. Telling lies now. It's my turn to tell the truth. It's not a billionaire state troopers kit husband or father, an Air Force chaplain in the Iraq war veteran. I have always a plus when the NRA and pro-life groups. I'm going to college.",http://mycmag.kantarmediana.com/KMIcmagvidbin2/USSEN_GA_COLLINS_MY_TURN.wmv,0.8262365,0.212829736211031
USSEN_GA_LOEFFLER_MY_FIRST_BILL,"Call and impeachment Kelly Loeffler. My second Bill supported killing the world's Deadliest. Terrorist Kelly Loeffler, a business woman. Not a career politician. China is attacking American jobs. I'm Kelly Loeffler. I approve this message because it's time to get to work.",http://mycmag.kantarmediana.com/KMIcmagvidbin2/USSEN_GA_LOEFFLER_MY_FIRST_BILL.wmv,0.8262365,0.212829736211031
USSEN_GA_LOEFFLER_TRUMP_ENDORSEMENT_2,"Kelly Loeffler. Kelly has been fantastic. She was with me a hundred percent on the impeachment hoax. She's been with us all the way and she's a great woman and we definitely need Kelley. Country. I'm Kelly, Loeffler. I approve this message.",http://mycmag.kantarmediana.com/KMIcmagvidbin2/USSEN_GA_LOEFFLER_TRUMP_ENDORSEMENT_2.wmv,0.8262365,0.212829736211031
USSEN_IA_NEEDTOIMPEACH_PUT_COUNTRY_OVER_PARTY_ERNST,"Should a president pressure, a foreign leader to intervene in our elections, but ask his lawyer teaches responsible.",http://mycmag.kantarmediana.com/KMIcmagvidbin2/USSEN_IA_NEEDTOIMPEACH_PUT_COUNTRY_OVER_PARTY_ERNST.wmv,0.8262365,0.212829736211031
USSEN_KY_MCCONNELL_FAR_LEFT,"Amy McGrath in the election of 2016 and Donald Trump. I am not accepting out this support impeachment and wanted. President Trump removed Mitch McConnell's to the impeachment. Circus Xtreme the wrong path for, Kentucky.",http://mycmag.kantarmediana.com/KMIcmagvidbin2/USSEN_KY_MCCONNELL_FAR_LEFT.wmv,0.8262365,0.212829736211031
USSEN_KY_MCCONNELL_FAR_LEFT_RECORD,"I approve this message you to find out about her far-left, record President, Trump, impeached and President, Trump's border wall. I think it's stupid. Even in the ninth month. Extreme. Amy McGrath.",http://mycmag.kantarmediana.com/KMIcmagvidbin2/USSEN_KY_MCCONNELL_FAR_LEFT_RECORD.wmv,0.8262365,0.212829736211031
USSEN_KY_MCCONNELL_HELL_NO,"Amy McGrath and Donald Trump, hell no. Impeachment and wanted President Trump removed Mitch McConnell impeachment. Circus for Kentucky,",http://mycmag.kantarmediana.com/KMIcmagvidbin2/USSEN_KY_MCCONNELL_HELL_NO.wmv,0.8262365,0.212829736211031
USSEN_ME_MEIDASTOUCH_FIRE_SUSAN,I believe that the president has learned from this case. Cynthia. I believe he will be much more cautious when you commit the peaceful transfer of power.,http://mycmag.kantarmediana.com/KMIcmagvidbin2/USSEN_ME_MEIDASTOUCH_FIRE_SUSAN.wmv,0.8262365,0.212829736211031
USSEN_ME_MOVEON_OATH,Collins took an oath to defend the Constitution. Documents.,http://mycmag.kantarmediana.com/KMIcmagvidbin2/USSEN_ME_MOVEON_OATH.wmv,0.8262365,0.212829736211031
USSEN_ME_NEEDTOIMPEACH_PUT_COUNTRY_OVER_PARTY_COLLINS,"Should a president pressure, a foreign leader to intervene in our elections. RC? Now is chief of staff.",http://mycmag.kantarmediana.com/KMIcmagvidbin2/USSEN_ME_NEEDTOIMPEACH_PUT_COUNTRY_OVER_PARTY_COLLINS.wmv,0.8262365,0.212829736211031
USSEN_MI_AFP_WASTING_AMERICA'S_TIME,"A rig Parts in line for posing for smiling photos. Even commemorative, TENS for the occasion, the speaker and the Democrats have call, Senator fingers, and senator stabenow in this travesty.",http://mycmag.kantarmediana.com/KMIcmagvidbin2/USSEN_MI_AFP_WASTING_AMERICA'S_TIME.wmv,0.8262365,0.212829736211031
USSEN_SC_SIS_THE_DNC,"The Democratic National Committee. The home of Nancy Pelosi and Chuck Schumer's impeachment. Sham. Crooked, Hillary Clinton socialist. Bernie Sanders and liberal Jamie, Harrison, Jamie Harrison Democrats. Payroll pay $271,000 getting rich in the DC swamp with his radical socialist liberal DC. DC swamp security Strikes, Back is responsible for the content of this advertising.",http://mycmag.kantarmediana.com/KMIcmagvidbin2/USSEN_SC_SIS_THE_DNC.wmv,0.8262365,0.212829736211031
