alt,transcript,link,alpha,wmp_ratio
HOUSE_FL21_ALF_SOCIAL_SECURITY,"In 1983, Joe Biden Democrat in the Senate voted to tax Social Security. And for the past 36 years, America's seniors have to pay taxes on a 85% of their benefits, Congressional candidate and Laura Loomer. What's the end? The Democrat tax on senior citizens. She wants security on November 3rd vote to end the Democrat tax for Congress of American Liberty Fund is responsible for the",http://mycmag.kantarmediana.com/KMIcmagvidbin2/HOUSE_FL21_ALF_SOCIAL_SECURITY.wmv,0.8995223,0.212829736211031
HOUSE_FL26_GIMENEZ_JIMMY_PIEDRAHITA,Kitchen. First decided to bring donuts down to Miami. Amazing. Carlos and get results. He's a straight shooter. He's sincere. Carlos is the type of leader that gets results.,http://mycmag.kantarmediana.com/KMIcmagvidbin2/HOUSE_FL26_GIMENEZ_JIMMY_PIEDRAHITA.wmv,0.8995223,0.212829736211031
HOUSE_FL26_GIMENEZ_JIMMY_PIEDRAHITA_SP,Washington.,http://mycmag.kantarmediana.com/KMIcmagvidbin2/HOUSE_FL26_GIMENEZ_JIMMY_PIEDRAHITA_SP.wmv,0.8995223,0.212829736211031
HOUSE_FL26_GIMENEZ_ONLY_LOOK_OUT_FOR_THEMSELVES,"In Washington, they only look out for themselves. So they done for us, we increase funding for police and firefighters and I approve this message.",http://mycmag.kantarmediana.com/KMIcmagvidbin2/HOUSE_FL26_GIMENEZ_ONLY_LOOK_OUT_FOR_THEMSELVES.wmv,0.8995223,0.212829736211031
HOUSE_FL26_NRCC_BACKED_FORGIVABLE_LOANS,"But the big wig Executives, at one of the biggest public companies to score 10 million plus Debbie's husband. Now Debbie didn't step on the little guy, took the money and ran that's Unforgivable.",http://mycmag.kantarmediana.com/KMIcmagvidbin2/HOUSE_FL26_NRCC_BACKED_FORGIVABLE_LOANS.wmv,0.8995223,0.212829736211031
HOUSE_FL26_NRCC_CLOUDS_OF_SUSPICION,"The suspicion moving over Debbie mucarsel-powell grab an umbrella because when it rains it pours for Debbie and her husband, she pushed taxpayer-funded loan for small business, the Wall Street traded company where her husband's an executive snag two loans worth 15 million showered and cash through the truth out. She's out for herself and rcc's responsible for the",http://mycmag.kantarmediana.com/KMIcmagvidbin2/HOUSE_FL26_NRCC_CLOUDS_OF_SUSPICION.wmv,0.8995223,0.212829736211031
HOUSE_GA06_DCCC_GUIDE,"The Karen Handel guide to Washington, d.c. Step 1, support the Donald Trump healthcare plan protections for people with pre-existing conditions, step to support letting insurance companies, charge of the five times more and step three vote for an extreme abortion. Ban, punishing women who seek Access to Health Services is a dead end for Georgia. 80cc is responsible for the",http://mycmag.kantarmediana.com/KMIcmagvidbin2/HOUSE_GA06_DCCC_GUIDE.wmv,0.8995223,0.212829736211031
HOUSE_GA07_CFGACTION_TRUMP_NEEDS_FIGHTERS,"President Trump needs spiders in Congress. He needs Rich McCormick. A marine veteran. McCormick is not a politician. So he supports Trump's push for term limits on Congress as an ER, Doctor Who's treated covid-19 patients. McCormick will lead the fight against the Socialists who demand government-run Healthcare and he'll be on Trump side. Pushing more tax relief for Georgia, families, Conservative, Republican, Rich McCormick, but Congress is responsible for the content of this advertising.",http://mycmag.kantarmediana.com/KMIcmagvidbin2/HOUSE_GA07_CFGACTION_TRUMP_NEEDS_FIGHTERS.wmv,0.8995223,0.212829736211031
HOUSE_GA07_CFGACTION_VERY_DIFFERENT_CHOICES,"Two very different choices for congress Rich McCormick. Decorated Marine, Carolyn bourdeaux career. Bureaucrat wrong for congress proposed action is responsible for the content.",http://mycmag.kantarmediana.com/KMIcmagvidbin2/HOUSE_GA07_CFGACTION_VERY_DIFFERENT_CHOICES.wmv,0.8995223,0.212829736211031
HOUSE_GA07_CLF_BRAGS,Carolyn bourdeaux Bragg's. Flashed not everything went down taxes. Got raised soon after bordeaux's taxpayer-funded sound wrong for Forsyth in Gwinnett. Congressional leadership fund.,http://mycmag.kantarmediana.com/KMIcmagvidbin2/HOUSE_GA07_CLF_BRAGS.wmv,0.8995223,0.212829736211031
HOUSE_GA07_CLF_CRISIS,"Springs out the best or exposes the worst and any politician who got hurt over 100,000. No pay you paid higher taxes or do was paid six figures funded by a bunch of to see how he's a millionaire.",http://mycmag.kantarmediana.com/KMIcmagvidbin2/HOUSE_GA07_CLF_CRISIS.wmv,0.8995223,0.212829736211031
HOUSE_GA07_HOUSEMAJPAC_INAHLER,"Remembering to bring her inhaler helping manage his pills all reality. When a loved one has a pre-existing health condition. And the reality of Rich McCormick is his risky and radical ideas on health care. Because McCormick support, eliminating protections for pre-existing conditions, including coronavirus McCormick goes even further, supporting an age tax on older Americans Healthcare. Just too many risk to Weber said, Rich McCormick and his radical ideas to Congress House. Majority. Pac is responsible for the content of this advertising.",http://mycmag.kantarmediana.com/KMIcmagvidbin2/HOUSE_GA07_HOUSEMAJPAC_INAHLER.wmv,0.8995223,0.212829736211031
HOUSE_GA07_UNTERMAN_REFUSED_TO_VOTE,"Rich McCormick refused to vote for President Trump against Hillary. No wonder. He's fine. As there's one truck. Conservative, Renee, unterman. Led the fight against abortion protected gun rights and deliver tax cuts. Renee's. The conservative fighter, who will help Trump drain the swamp and hold accountable.",http://mycmag.kantarmediana.com/KMIcmagvidbin2/HOUSE_GA07_UNTERMAN_REFUSED_TO_VOTE.wmv,0.8995223,0.212829736211031
HOUSE_GA07_UNTERMAN_SWAMP_FUNDERS,"Rich McCormick. And his swamp funders have gone too far. I rent them. Buzz, pro-life bill in the country. I passed the largest PEX cut and Georgia history, and I'm indoors by the end of never trumper's. Calling me lyrics. No, that's rich, but mocking those who struggle with mental health issues. That shameful. I'm Renee unterman. And I'm a conservative who will never back down from a campaign bully or a liberal and Congress. And I approve this message.",http://mycmag.kantarmediana.com/KMIcmagvidbin2/HOUSE_GA07_UNTERMAN_SWAMP_FUNDERS.wmv,0.8995223,0.212829736211031
HOUSE_GA09_CFGACTION_SOMETHING_DOESN'T_FIT,"Something doesn't fit about Andrew Clyde, but in 2016 Clyde gave thousands to Clyde donated to re-elect, a far-left Democrats, who is tax Trump. And Clyde fund is a liberal politician who voted against freezing property taxes and to allow higher sales taxes. Surprisingly. Liberal, Andrew Clyde wrong about Trump. Wrong for Congress, is responsible for the content of this advertising.",http://mycmag.kantarmediana.com/KMIcmagvidbin2/HOUSE_GA09_CFGACTION_SOMETHING_DOESN'T_FIT.wmv,0.8995223,0.212829736211031
HOUSE_IA01_CLF_127_HOSPITALS,"127 hospital jobs Healthcare scheme, could close. Killing thousands of jobs in a pandemic board. Abby, finkenauer Congressional leadership.",http://mycmag.kantarmediana.com/KMIcmagvidbin2/HOUSE_IA01_CLF_127_HOSPITALS.wmv,0.8995223,0.212829736211031
HOUSE_IA01_CLF_DIRECTION,"Abby finkenauer takes Nancy Pelosi's directions before she got elected. Abby finkenauer hit her support for Pelosi, but in Washington, she's loaded to make Pelosi speaker, thinking, even joyful for Iowa. Congressional leadership fund is responsible for the content of this advertising.",http://mycmag.kantarmediana.com/KMIcmagvidbin2/HOUSE_IA01_CLF_DIRECTION.wmv,0.8995223,0.212829736211031
HOUSE_IA01_CLF_SMALL_TOWNS,"Small towns depend on our hospitals for care, close to home and good jobs. Because it would flash their funding that could kill, small towns and lots of jobs and working people. We pay more taxes, but get worse Healthcare thinking our has let us down.",http://mycmag.kantarmediana.com/KMIcmagvidbin2/HOUSE_IA01_CLF_SMALL_TOWNS.wmv,0.8995223,0.212829736211031
HOUSE_IA01_HINSON_DEBATES,"Abby finkenauer has not agree to any upcoming debate. She says her Congressional schedule is too and got 600 million for police. But liberal, Abby finkenauer says, she's too busy for Islands. Ashley Hinson. Taken for granted.",http://mycmag.kantarmediana.com/KMIcmagvidbin2/HOUSE_IA01_HINSON_DEBATES.wmv,0.8995223,0.212829736211031
HOUSE_IA01_NRCC_AT_IT_AGAIN,"Abby is at it again. Government takeover of Health Care, in Northeast, Iowa. Not true that he's extremely damaged, Iowa.",http://mycmag.kantarmediana.com/KMIcmagvidbin2/HOUSE_IA01_NRCC_AT_IT_AGAIN.wmv,0.8995223,0.212829736211031
HOUSE_IA01_NRCC_FAIR,Tax increases.,http://mycmag.kantarmediana.com/KMIcmagvidbin2/HOUSE_IA01_NRCC_FAIR.wmv,0.8995223,0.212829736211031
HOUSE_IA01_NRCC_IT_IS_PERSONAL,"It's personal with Abby's health care plan, one plan with waste your money on her own political advertising.",http://mycmag.kantarmediana.com/KMIcmagvidbin2/HOUSE_IA01_NRCC_IT_IS_PERSONAL.wmv,0.8995223,0.212829736211031
HOUSE_IA01_RNC_BROKE_HER_PROMISE,"Abby finkenauer promise to tackle problems facing our country. Destinations of President, Trump wasting tax dollars. Instead of working to create more jobs. Thinking our wants more hearings. Tell. Abby finkenauer Petty politics and start getting things done. The Republican National Committee is responsible for the content of this.",http://mycmag.kantarmediana.com/KMIcmagvidbin2/HOUSE_IA01_RNC_BROKE_HER_PROMISE.wmv,0.8995223,0.212829736211031
HOUSE_IA02_CLF_LIBERAL_RITA_HART,"Liberal Rita Hart who's really behind her campaign, Nancy Pelosi and the radical left. Even after 5 months. Rita Hearts liberal agenda, Vita heart.",http://mycmag.kantarmediana.com/KMIcmagvidbin2/HOUSE_IA02_CLF_LIBERAL_RITA_HART.wmv,0.8995223,0.212829736211031
HOUSE_IA02_CLF_LOOKS_LIKE_THIS,"Looks like this higher taxes. Look like this higher taxes, Rita Hart. Higher taxes are taxes on cattle voted against middle-class tax cuts for Iowa families. She even $1,000 a year after taxes.",http://mycmag.kantarmediana.com/KMIcmagvidbin2/HOUSE_IA02_CLF_LOOKS_LIKE_THIS.wmv,0.8995223,0.212829736211031
HOUSE_IA02_CLF_STADIUM,"Square Reader hard, we know hard was a top pick for Nancy Pelosi families on thousand dollars higher.",http://mycmag.kantarmediana.com/KMIcmagvidbin2/HOUSE_IA02_CLF_STADIUM.wmv,0.8995223,0.212829736211031
HOUSE_IA02_CLF_TEXTING,Congressional leadership advertising.,http://mycmag.kantarmediana.com/KMIcmagvidbin2/HOUSE_IA02_CLF_TEXTING.wmv,0.8995223,0.212829736211031
HOUSE_IA02_HOUSEMAJPAC_THE_MEDICARE_GUARANTEE,She supports and marionette Miller make supported and supports a plant are it's called an age tax for ending. The Medicare guarantee for raising. The retirement age for an age tax Miller makes is not for Iowa House. Majority Pac is responsible for the content of this advertising.,http://mycmag.kantarmediana.com/KMIcmagvidbin2/HOUSE_IA02_HOUSEMAJPAC_THE_MEDICARE_GUARANTEE.wmv,0.8995223,0.212829736211031
HOUSE_IA02_NRCC_CHECKBOOK,"To raise taxes, Pelosi wants proven tax, razors elected to open her checkbook of your record, checks out our hearts did, hardback higher income taxes, on the middle class. Raise the gas tax supports a plan that could require a new payroll taxes. Even sponsored a bill, raising fees on marriage. Licenses liberal Rita Hart. Perfect match for higher taxes for Iowa, nrcc is responsible for the content of this.",http://mycmag.kantarmediana.com/KMIcmagvidbin2/HOUSE_IA02_NRCC_CHECKBOOK.wmv,0.8995223,0.212829736211031
HOUSE_IA02_NRCC_FOR_ALL_SHE'S_DONE,"Call Rita Hearthstone to hurt Iowa. Nothing Compares for parties, for reducing wages higher, taxes on Lower incomes. And Iowa. Livestock, producers. Say heart would put Family Farms and risk Rita Hart puts everything in Richmond. Now, there's no time to come in. RCC is responsible for the content.",http://mycmag.kantarmediana.com/KMIcmagvidbin2/HOUSE_IA02_NRCC_FOR_ALL_SHE'S_DONE.wmv,0.8995223,0.212829736211031
HOUSE_IA02_NRCC_JUST_BUSINESS,"It's just business for Rita Hart. Simple math, cold-hearted calculation. What it helps her heart, did it, when it hurt you. She didn't care coverage for pre-existing condition after the insurance. Bill, her coffers, raise your gas taxes and packed higher income taxes, but gave a million-dollar tax break. Do a billion dollar industry. Corporate dreammaker, middle-class Heartbreaker don't mess around. With Rita Hart, nrcc is responsible for the content of their advertising.",http://mycmag.kantarmediana.com/KMIcmagvidbin2/HOUSE_IA02_NRCC_JUST_BUSINESS.wmv,0.8995223,0.212829736211031
HOUSE_IA02_NRCC_RITA'S_RECORD,"record how she made life harder on the middle class, raising taxes on families and small businesses and farms, and chicken farms, Iowa jobs, just to please her heart fewer job and veggie burgers is responsible for the",http://mycmag.kantarmediana.com/KMIcmagvidbin2/HOUSE_IA02_NRCC_RITA'S_RECORD.wmv,0.8995223,0.212829736211031
HOUSE_IA02_NRCC_THERE_ARE_TWO_KINDS_OF_PEOPLE,"There are two kinds of people in Iowa, those who had their taxes raised by Rita heart and those who will, if you drive heart, raise your gas taxes cuz things on bridgemore, if your little class. She backed higher income taxes, but if you've somehow been spared, you won't be for long Hart's. New plan could raise payroll taxes on every worker, your money. Your choice. Nrcc is responsible for the content of this advertising.",http://mycmag.kantarmediana.com/KMIcmagvidbin2/HOUSE_IA02_NRCC_THERE_ARE_TWO_KINDS_OF_PEOPLE.wmv,0.8995223,0.212829736211031
HOUSE_IA02_NRCC_WORK_AROUND,"This message sweetheart goes to Congress. You'd better find a workaround. It won't be easy and I wish you support the tire income, taxes raise the gas tax heart, so big insurance money. Then cut your Healthcare. She admits. I didn't think it was a great idea because it allowed of work around us with the pre-existing conditions, know where you're wrong. Part won't work for Iowa. She never has the nrcc is responsible for the",http://mycmag.kantarmediana.com/KMIcmagvidbin2/HOUSE_IA02_NRCC_WORK_AROUND.wmv,0.8995223,0.212829736211031
HOUSE_IA02_RNC_BROKE_HIS_PROMISE,"Dave loebsack, Ste. Tackle problems. Facing our country's President Trump wasting tax dollars instead of working to create more jobs and start getting things done. Committee is responsible for the content of this advertising.",http://mycmag.kantarmediana.com/KMIcmagvidbin2/HOUSE_IA02_RNC_BROKE_HIS_PROMISE.wmv,0.8995223,0.212829736211031
HOUSE_IA03_AXNE_BURGER,"That's not how things work in Congress, Medicare and Social Security to pay for tax breaks to corporate donors.",http://mycmag.kantarmediana.com/KMIcmagvidbin2/HOUSE_IA03_AXNE_BURGER.wmv,0.8995223,0.212829736211031
HOUSE_IA03_AXNE_YOU_WOULDN'T_ASK_A_DOCTOR,"Try to fix your car to fix our economy. You need to have the right skills. As a small business, payroll payments to families and keep people in their homes. Keep fighting. I'm Cindy axne and I approve this message so we can rebuild our economy for everyone.",http://mycmag.kantarmediana.com/KMIcmagvidbin2/HOUSE_IA03_AXNE_YOU_WOULDN'T_ASK_A_DOCTOR.wmv,0.8995223,0.212829736211031
HOUSE_IA03_CLF_FORECAST,"Before you leave, check the forecast. Do the same before you vote. There's a 95% chance. Send the accident will raise taxes if she's really like it because actually, both with Pelosi 95% of the time sheets and pillows. He's got actually under the song. Pushing plans that would require massive, middle-class tax hikes. Cindy's, tax Nanny, tax tax. You Congressional leadership fund is responsible for the content of this after touching.",http://mycmag.kantarmediana.com/KMIcmagvidbin2/HOUSE_IA03_CLF_FORECAST.wmv,0.8995223,0.212829736211031
HOUSE_IA03_CLF_SWAMP_SLEAZE,"Long sleeves thicker quickly after claiming she wouldn't make big promises, but it's all good news with American money, kind of gets jobs, special interests when we pay for, Iowa.",http://mycmag.kantarmediana.com/KMIcmagvidbin2/HOUSE_IA03_CLF_SWAMP_SLEAZE.wmv,0.8995223,0.212829736211031
HOUSE_IA03_DCCC_MAGIC,"Former Congressman David magic. Unfortunately, he played tricks on Iowans young. Took over three and a half million from the special tax breaks. David Young's Washington tricks again. DCCC.",http://mycmag.kantarmediana.com/KMIcmagvidbin2/HOUSE_IA03_DCCC_MAGIC.wmv,0.8995223,0.212829736211031
HOUSE_IA03_NRCC_ANGRY_CINDY,"Angry Cindy, axne economy and access the doctors angry Cindy. Actually, he's going to ask next.",http://mycmag.kantarmediana.com/KMIcmagvidbin2/HOUSE_IA03_NRCC_ANGRY_CINDY.wmv,0.8995223,0.212829736211031
HOUSE_IA03_NRCC_IOWA_PRIORITIES,"Send me Acme claim to care about Iowa priorities, but she really just wants more, Iowa, tax dollars. 25 million in public. To get rid of the 2017 tax cuts, which could cost us billions, Iowa priority. Cindy asked me more Iowa tax dollars. Nrcc is responsible for the content of this advertising.",http://mycmag.kantarmediana.com/KMIcmagvidbin2/HOUSE_IA03_NRCC_IOWA_PRIORITIES.wmv,0.8995223,0.212829736211031
HOUSE_IA03_NRCC_SHE'S_A_LIBERAL,"Washington, 95% of the time. She's only to give herself up the 5 million in public funds over a trillion dollars. Iowa can't afford is responsible for the content.",http://mycmag.kantarmediana.com/KMIcmagvidbin2/HOUSE_IA03_NRCC_SHE'S_A_LIBERAL.wmv,0.8995223,0.212829736211031
HOUSE_IA03_RNC_BROKE_HER_PROMISE,"Cindy asked me promise to tackle problems facing. Our country asked me broke her promise instead of fixing Healthcare and lowering drug prices ask me books with the radicals for Endless investigations. The President Trump wasting tax dollars, instead of working to create more jobs, more hearings. Tell Cindy axne, put petty politics aside and start getting things done. The Republican National Committee is responsible for the content.",http://mycmag.kantarmediana.com/KMIcmagvidbin2/HOUSE_IA03_RNC_BROKE_HER_PROMISE.wmv,0.8995223,0.212829736211031
HOUSE_IA03_YOUNG_GIVEAWAY,"I'm David Young and I approve this message. Pelosi are pushing higher taxes on Iowa families, farmers and small businesses. Use a rubber stamp for Nancy Pelosi in her agenda.",http://mycmag.kantarmediana.com/KMIcmagvidbin2/HOUSE_IA03_YOUNG_GIVEAWAY.wmv,0.8995223,0.212829736211031
HOUSE_IA03_YOUNG_MARY_KRAMER,I'm David Young and I approve. This message is to raise taxes. That's one promise. She'll keep. Who is raising taxes on families and small businesses in $90 and cut Medicare benefits for seniors?,http://mycmag.kantarmediana.com/KMIcmagvidbin2/HOUSE_IA03_YOUNG_MARY_KRAMER.wmv,0.8995223,0.212829736211031
HOUSE_IA03_YOUNG_RECOGNIZE_THIS_GUY,"I'm David Young and I approve. This message, amethyst far left, East Coast Congressman in her place. We deserve a member of Congress who does their job and represent sauce.",http://mycmag.kantarmediana.com/KMIcmagvidbin2/HOUSE_IA03_YOUNG_RECOGNIZE_THIS_GUY.wmv,0.8995223,0.212829736211031
HOUSE_IA04_FEENSTRA_DELIVERS,"As a kid. Randy, feenstra delivered papers in today. Feenstra still delivering for us voted to ban Sanctuary cities in Congress. He'll help President Trump build the wall and stop the results.",http://mycmag.kantarmediana.com/KMIcmagvidbin2/HOUSE_IA04_FEENSTRA_DELIVERS.wmv,0.8995223,0.212829736211031
HOUSE_IA04_FEENSTRA_NO_FRIEND_OF_FARMERS_HEALTHCARE,"3D show, no friend of families, and supports a government takeover of Health Care. That could separate you from your doctor clothes, 40 rule hospitals in Iowa, and double income taxes on every business, as usual. Until care plans will make you sick. Randy, feenstra will protect pre-existing conditions in Surprise medical billing lower, and expand Karen rual areas, delivering on Health Care reform. Randy feenstra, and I approve this message.",http://mycmag.kantarmediana.com/KMIcmagvidbin2/HOUSE_IA04_FEENSTRA_NO_FRIEND_OF_FARMERS_HEALTHCARE.wmv,0.8995223,0.212829736211031
HOUSE_IL03_LIPINSKI_FOUGHT_THEM,"When the Trump Administration tried to take away Health Care from people with pre-existing conditions, Dan Lipinski fought them and won. The cost of prescription drugs are and our taxes would Skyrocket and support.",http://mycmag.kantarmediana.com/KMIcmagvidbin2/HOUSE_IL03_LIPINSKI_FOUGHT_THEM.wmv,0.8995223,0.212829736211031
HOUSE_IL03_LIPINSKI_WRONG_DIRECTION,"We need more affordable healthcare. But Marie Newman would take us in the wrong direction. Plan seniors, with loser. Medicare option to our doctors. Don't let her. The common sense Democrat, and I approve this ad.",http://mycmag.kantarmediana.com/KMIcmagvidbin2/HOUSE_IL03_LIPINSKI_WRONG_DIRECTION.wmv,0.8995223,0.212829736211031
HOUSE_IL13_CLF_THE_GOODNESS_OF_HIS_HEART,Congressional leadership fund.,http://mycmag.kantarmediana.com/KMIcmagvidbin2/HOUSE_IL13_CLF_THE_GOODNESS_OF_HIS_HEART.wmv,0.8995223,0.212829736211031
HOUSE_IL13_DCCC_PERFECT_MATCH,"Here's the thing with a special interest in Washington. They don't keep handing out money to a politician, unless he votes their way Rodney in new tax, giveaways, special interest. It's a perfect match. Dcccd is responsible for the content of this advertising.",http://mycmag.kantarmediana.com/KMIcmagvidbin2/HOUSE_IL13_DCCC_PERFECT_MATCH.wmv,0.8995223,0.212829736211031
HOUSE_IL13_HOUSEMAJPAC_ALL_SMILES,"Election year, we get more Smiles handshakes and Promises from Rodney Davis, but back in Washington, Davis is all smiles for big drug companies because they giving him over 200 Grand. While Davis, gave them a 40 billion dollar tax accountant, despite promises to Illinois Davis voted on. Protections for pre-existing conditions.",http://mycmag.kantarmediana.com/KMIcmagvidbin2/HOUSE_IL13_HOUSEMAJPAC_ALL_SMILES.wmv,0.8995223,0.212829736211031
HOUSE_IL13_HOUSEMAJPAC_IT'S_NOT_WHAT_YOU_KNOWN,"It's not what you know, but who you know, and it must be good to know. Rodney Davis, his special interest donors. Sure got lots of perks and while other businesses waited weeks for covid Relief, Fund Rodney Davis, his brother got a million bucks just 48 hours after he could. Apply then, Davis voted to hide the payments from taxpayers. Rodney. Davis helps his friends. Not you House. Majority Pac is responsible for the content of his.",http://mycmag.kantarmediana.com/KMIcmagvidbin2/HOUSE_IL13_HOUSEMAJPAC_IT'S_NOT_WHAT_YOU_KNOWN.wmv,0.8995223,0.212829736211031
HOUSE_IL13_LONDRIGAN_HANNAH,"I've had epilepsy since middle school without medication seizures could cause permanent brain damage or even be fatal, but I can't accept excuses for supporting the drug industry that has patientslikeme companies billion dollars in tax on our side. And I approve this message.",http://mycmag.kantarmediana.com/KMIcmagvidbin2/HOUSE_IL13_LONDRIGAN_HANNAH.wmv,0.8995223,0.212829736211031
HOUSE_IL13_NRCC_MADIGAN'S_MACHINE,"Mike Madigan's machine spent on Betsy jerks at monforton. Bad enough. Government-run Health Care is taxes ft / billion from hospital. Putting 39, Illinois, hospitals at risk of closing londrigan would radically change. Medicare threatening seniors access2care Dirty Money, a dirty regenda. That's Betsy Dirksen londrigan. The nrcc is responsible.",http://mycmag.kantarmediana.com/KMIcmagvidbin2/HOUSE_IL13_NRCC_MADIGAN'S_MACHINE.wmv,0.8995223,0.212829736211031
HOUSE_IL14_GRADEL_NOTRE_DAME_KICKER,"A former Notre, Dame kicker Ted gradel hits the mark. Everytime model wants to break up Madigan's and pritzker's political machine. Throttle supports freezing property taxes, and getting gas and bottles are successful businessman like our President Trump's tax cuts permitted and past term limits to kick out. And I approve this message because I kicked footballs in college and I'll kick in Congress.",http://mycmag.kantarmediana.com/KMIcmagvidbin2/HOUSE_IL14_GRADEL_NOTRE_DAME_KICKER.wmv,0.8995223,0.212829736211031
HOUSE_IL14_ILCONPAC_PRETENDS,Raise taxes on families by 12. President Trump is a fad. Personally attacking President Trump and comparing pro-lifers to terrorist. That's the real.,http://mycmag.kantarmediana.com/KMIcmagvidbin2/HOUSE_IL14_ILCONPAC_PRETENDS.wmv,0.8995223,0.212829736211031
HOUSE_IL17_KING_HEALTHCARE,"Pretend they built America with Healthcare takeovers, high taxes, and Bloated government Built America Esther. Joy King. We Built America through Innovation Pathways to work, hustle hard and drive with honest Healthcare prices and by keeping Washington in check, we Built America with a burst of freedom and its Howell build America. Esther joy King and I approve this message.",http://mycmag.kantarmediana.com/KMIcmagvidbin2/HOUSE_IL17_KING_HEALTHCARE.wmv,0.8995223,0.212829736211031
HOUSE_IL17_RNC_BROKE_HER_PROMISE,"Cheri Bustos promise to tackle problems facing our country. Bustos broke her promise instead of fixing Healthcare and lowering drug prices. And the investigation, the President Trump wasting tax dollars instead of working to create more jobs. Bustos wants more hearings. Tell Cheri Bustos and start getting things done.",http://mycmag.kantarmediana.com/KMIcmagvidbin2/HOUSE_IL17_RNC_BROKE_HER_PROMISE.wmv,0.8995223,0.212829736211031
HOUSE_IN05_CFGACTION_DOZEN,"A dozen eggs. A dozen donuts, a dozen bad V on taxes. Thanks to Christina Hale. Who's your family on taxes for congress, proposed action is responsible for the content of this advertising?",http://mycmag.kantarmediana.com/KMIcmagvidbin2/HOUSE_IN05_CFGACTION_DOZEN.wmv,0.8995223,0.212829736211031
HOUSE_IN05_CFGACTION_SOMETHING_DOESN'T_FIT,"Something doesn't fit about Christina, Hale state income taxes and like Nancy Pelosi government's role in healthcare. Christina Hale. Just another liberal politician for Congress.",http://mycmag.kantarmediana.com/KMIcmagvidbin2/HOUSE_IN05_CFGACTION_SOMETHING_DOESN'T_FIT.wmv,0.8995223,0.212829736211031
HOUSE_IN05_CLF_SPECIAL_INTERESTS,"Christina Hale, will she stand with us or special interests has bankrolled by DC. Insiders take to support a giveaway program. We don't need Christina, Hale, Congressional leadership fund is responsible for the content of this advertising.",http://mycmag.kantarmediana.com/KMIcmagvidbin2/HOUSE_IN05_CLF_SPECIAL_INTERESTS.wmv,0.8995223,0.212829736211031
