alt,transcript,link,alpha,wmp_ratio
HOUSE_UT04_MCADAMS_COVID_19,"Representative Ben McAdams has been diagnosed with covid-19, testing a vaccine and financial help for individuals and small businesses important in your family's health.",http://mycmag.kantarmediana.com/KMIcmagvidbin2/HOUSE_UT04_MCADAMS_COVID_19.wmv,0.7732577,0.212829736211031
HOUSE_UT04_MCADAMS_FAILED_US_15,"The virus are more affordable to cover more people and financial help for individuals and small businesses lose weight in the belloc and help businesses reopen. I'm a republican, businessman, and Ben McAdams. Is my folks from Congress. I sponsored this message to protect our tax dollars, to keep people safe businesses and get us back to work.",http://mycmag.kantarmediana.com/KMIcmagvidbin2/HOUSE_UT04_MCADAMS_FAILED_US_15.wmv,0.7732577,0.212829736211031
HOUSE_UT04_MCADAMS_HURTING,"Millions expected lives lost jobs. Lost business is closed. Now is not the time to take away. We need to come together, put our differences, aside rebuild our economy, and our trust in each other. I'm Ben McAdams. I sponsored this message because we've got to do better but people before party and principal above politics.",http://mycmag.kantarmediana.com/KMIcmagvidbin2/HOUSE_UT04_MCADAMS_HURTING.wmv,0.7732577,0.212829736211031
HOUSE_UT04_MCADAMS_REPEAL,"As covid cases rise Burgess Owens would repeal Healthcare cover. More people would cut, Social Security. Don't cut Social Security or Medicare put, Utah First.",http://mycmag.kantarmediana.com/KMIcmagvidbin2/HOUSE_UT04_MCADAMS_REPEAL.wmv,0.7732577,0.212829736211031
HOUSE_UT04_MCADAMS_THE_TRUTH_MATTERS,"The truth matters is confirmed for months. Even a website for claim, refueling Healthcare with a priority. Not telling the truth. I sponsored this message to set the record straight.",http://mycmag.kantarmediana.com/KMIcmagvidbin2/HOUSE_UT04_MCADAMS_THE_TRUTH_MATTERS.wmv,0.7732577,0.212829736211031
HOUSE_UT04_OWENS_COVID_19,"Covid-19 is scary and eliminating Private health insurance. I don't think so. My plan is a solution by competition to lower drug prices for seniors for pre-existing conditions. In boating, know how did proud to say that healthcare for all your ties and I approve this message.",http://mycmag.kantarmediana.com/KMIcmagvidbin2/HOUSE_UT04_OWENS_COVID_19.wmv,0.7732577,0.212829736211031
HOUSE_UT04_OWENS_FUNDING_THE_POLICE_15,Burgess Owens Owens will protect funding for the police and he wants Healthcare. That works were all you tan. Keith DC values out of Utah. Burgess Owens for Congress. Can I approve this message?,http://mycmag.kantarmediana.com/KMIcmagvidbin2/HOUSE_UT04_OWENS_FUNDING_THE_POLICE_15.wmv,0.7732577,0.212829736211031
HOUSE_VA01_RASHID_THE_AMERICAN_DREAM,"I'm crossing received this message, women, who survived abuse, Christians and Jews persecuted for their faith. It was time to act for Better Health Care access to broadband has waited too. Long is action, and it's time.",http://mycmag.kantarmediana.com/KMIcmagvidbin2/HOUSE_VA01_RASHID_THE_AMERICAN_DREAM.wmv,0.7732577,0.212829736211031
HOUSE_VA02_AAN_CRYSTAL_CLEAR,"This is about preventing a potentially disastrous outcome from occurring next year. Now. It's Crystal Clear. Their partisan. Impeachment is a politically-motivated charade, Elaine Lauria promise to be different but she's not instead of working to secure border 6, Healthcare congresswoman, Lauria. Let the voters decide elections vote, no on impeachment and get to work.",http://mycmag.kantarmediana.com/KMIcmagvidbin2/HOUSE_VA02_AAN_CRYSTAL_CLEAR.wmv,0.7732577,0.212829736211031
HOUSE_VA02_AAN_OVERSHADOW_LURIA,"The president, of course politicians, decide who's President not the voters.",http://mycmag.kantarmediana.com/KMIcmagvidbin2/HOUSE_VA02_AAN_OVERSHADOW_LURIA.wmv,0.7732577,0.212829736211031
HOUSE_VA02_HOUSEMAJPAC_THINK_YOU_KNOW_SCOTT,"Think you know Scott Taylor think again in Washington Scott Taylor got a cool 800,000 from special interests. They got billions in tax handouts, which could mean devastating cuts to Social Security and Medicare and big insurance companies. Got Taylor's vote to gut protections for people with pre-existing conditions. All we got was a disgraced congressman who puts the special interests. First house. Majority Pac is responsible for the content in Sanford.",http://mycmag.kantarmediana.com/KMIcmagvidbin2/HOUSE_VA02_HOUSEMAJPAC_THINK_YOU_KNOW_SCOTT.wmv,0.7732577,0.212829736211031
HOUSE_VA02_LURIA_A_DIFFERENT_VIETNAM_STORY,"This is a different Vietnam, story ended up in the water out here or navy. Guys, like me. We're doing our part, but for decades, the VA, recognize us for benefits. Bipartisan coalition to fix that. Now. We have a congresswoman who heard our story and I approve this message.",http://mycmag.kantarmediana.com/KMIcmagvidbin2/HOUSE_VA02_LURIA_A_DIFFERENT_VIETNAM_STORY.wmv,0.7732577,0.212829736211031
HOUSE_VA02_LURIA_EFFECTIVE,"He's ranked the third most effective member of the US House. One of the first woman to serve her entire 20-year Naval career on combatant ships, Elaine, Lauria, championing bipartisanship. Co-written with both parties. She's fighting to make health care and prescription drugs. Lady Commander, our congresswoman and I approve this message.",http://mycmag.kantarmediana.com/KMIcmagvidbin2/HOUSE_VA02_LURIA_EFFECTIVE.wmv,0.7732577,0.212829736211031
HOUSE_VA02_LURIA_FIGHTS_FOR_VIRGINIA,"Completing Sailors to starting a business to represent Virginia in Congress. She's working to lower prescription drug prices and making sure small businesses, get the resources. They need to recover and championing bipartisanship would 79% of her legislation. Co-written with both parties. Commanding officer representative mom, Arlene. Gloria for Congress, and I approve this message.",http://mycmag.kantarmediana.com/KMIcmagvidbin2/HOUSE_VA02_LURIA_FIGHTS_FOR_VIRGINIA.wmv,0.7732577,0.212829736211031
HOUSE_VA02_LURIA_MY_MOM_TAYLOR,"This is my mom pretty happy. Right. This is Mom. Now cancer, took her speech, but it didn't take her lies. That's something to be happy about that. Scott Taylor to take away Healthcare protections for people with pre-existing conditions. And remember this happy family.",http://mycmag.kantarmediana.com/KMIcmagvidbin2/HOUSE_VA02_LURIA_MY_MOM_TAYLOR.wmv,0.7732577,0.212829736211031
HOUSE_VA02_RNC_BROKE_HER_PROMISE,"Elaine Lori, I promised she tackled problems facing our country broke her promise instead of fixing Healthcare and lowering us with the investigation that President Trump is wasting tax dollars. Instead of working to create more jobs, more hearings, take the side and start getting things done.",http://mycmag.kantarmediana.com/KMIcmagvidbin2/HOUSE_VA02_RNC_BROKE_HER_PROMISE.wmv,0.7732577,0.212829736211031
HOUSE_VA02_WHA_CRISIS,"A crisis demands action is in crisis right now. That's why I Lanes is helping establish, a reserved for of doctors and nurses. And when the soldiers faces surprise tax hike with fellow veterans in the bipartisan for Country caucus, to get them some relief. So, let's think this 20-year Navy veteran. What are the most effective lawmakers for veterans and military families for fighting for the issues that matter to us?",http://mycmag.kantarmediana.com/KMIcmagvidbin2/HOUSE_VA02_WHA_CRISIS.wmv,0.7732577,0.212829736211031
HOUSE_VA05_314ACTIONFUND_BRINK,"Play, some, the economic Bob. Good doesn't care. He started with special interest ending coverage for pre-existing conditions for Action fund is responsible for the content of this advertisement.",http://mycmag.kantarmediana.com/KMIcmagvidbin2/HOUSE_VA05_314ACTIONFUND_BRINK.wmv,0.7732577,0.212829736211031
HOUSE_VA05_314ACTIONFUND_LAB_COAT,"Cameron Webb wearing a lab coat. Every day is not just about using facts and evidence to make Health Care decisions and insurance companies. In Congressman Cameron, Webb will be there again.",http://mycmag.kantarmediana.com/KMIcmagvidbin2/HOUSE_VA05_314ACTIONFUND_LAB_COAT.wmv,0.7732577,0.212829736211031
HOUSE_VA05_314ACTIONFUND_WHEN_COVID_HIT,"When did President Trump in both parties, expanded unemployment benefits. Paid sick, leave in PPE to front-line workers. Good. Good. Stewed with special interests to help they need and if that's not bad enough, good health care plan, terminates coverage for bad ideas. Bad for us. We won four action. Fund is responsible for the content of this advertising.",http://mycmag.kantarmediana.com/KMIcmagvidbin2/HOUSE_VA05_314ACTIONFUND_WHEN_COVID_HIT.wmv,0.7732577,0.212829736211031
HOUSE_VA05_314ACTIONFUND__A_SIMPLE_VALUE,"Cameron Webb was raised in a simple value for people who need help. When he needs. He's seeing what happens when Congress puts drug and insurance companies and other special interest over people. And that's why I won't take a dime from Big insurance companies, us",http://mycmag.kantarmediana.com/KMIcmagvidbin2/HOUSE_VA05_314ACTIONFUND__A_SIMPLE_VALUE.wmv,0.7732577,0.212829736211031
HOUSE_VA05_GOOD_CHAOS_IN_THE_STREETS,"With chaos in our street, Cameron Webb would make things worse. Look packed. The smooth government-run, Healthcare crime, unchecked radical ideas way too liberal.",http://mycmag.kantarmediana.com/KMIcmagvidbin2/HOUSE_VA05_GOOD_CHAOS_IN_THE_STREETS.wmv,0.7732577,0.212829736211031
HOUSE_VA05_GOOD_ITS_A_CLEAR_CHOICE,"It's a clear choice, Cameron Webb way to radical republican, Bob, good stands for the flag. And with President Trump pre-existing conditions, and he always supports law enforcement, good and I approve this message.",http://mycmag.kantarmediana.com/KMIcmagvidbin2/HOUSE_VA05_GOOD_ITS_A_CLEAR_CHOICE.wmv,0.7732577,0.212829736211031
HOUSE_VA05_GOOD_NRCC_GOVERNMENT_RUN_HEALTHCARE,"Radical liberals. Want, government-run Health Care, pay for with huge tax increases government program. Healthcare. Donald Trump will protect Medicare.",http://mycmag.kantarmediana.com/KMIcmagvidbin2/HOUSE_VA05_GOOD&NRCC_GOVERNMENT_RUN_HEALTHCARE.wmv,0.7732577,0.212829736211031
HOUSE_VA05_GOOD_WRESTLING,"I wrestled growing up in coach for 15 years in Congress. I'll take down the bad ideas from Pelosi and illiberal defund. The police. I'll drop that idea, Green, New Deal. Copy that. I'm all about jobs and recovered from the shutdown. Everything out loud. Think they got it.",http://mycmag.kantarmediana.com/KMIcmagvidbin2/HOUSE_VA05_GOOD_WRESTLING.wmv,0.7732577,0.212829736211031
HOUSE_VA05_RUSSO_DAUGHTER_MARINE_SURVIVOR,"Sexual assault, Survivor. Democrat my life. I've been called many things and whether I was serving in Iraq and Afghanistan fighting for justice in the military, after I was sexually assaulted or now running for congress to stand up to Donald Trump and fight for Universal Health Care. I have always run towards the fight. I'm Claire Russo and I approve.",http://mycmag.kantarmediana.com/KMIcmagvidbin2/HOUSE_VA05_RUSSO_DAUGHTER_MARINE_SURVIVOR.wmv,0.7732577,0.212829736211031
HOUSE_VA05_RUSSO_WHEN_THEY_GROW_UP,"Over the last few months. I found myself wondering what my kids will remember about this when we grow up and Claire Russo, are the times that my family struggled. It's why I'm a Democrat and it's the main reason. I'm running for congress in the Marines accessible for everyone.",http://mycmag.kantarmediana.com/KMIcmagvidbin2/HOUSE_VA05_RUSSO_WHEN_THEY_GROW_UP.wmv,0.7732577,0.212829736211031
HOUSE_VA05_VOTEVETSAF_THE_RIGHT_DEMOCRAT,"In the congress party. Hostetler is the rate, Democrat growing up in a working-class family or do you still write them a credit to create an economy? That's inclusive for everyone and Iraq and Afghanistan. Veterans Rd of the wrecked in a fight to protect our veterans and the care. They need having lost his father to an opioid. Overdose party is the right Democrat to take on the big drug companies and tackle the opioid crisis Rd, Hostetler the right Democrat for us book. That that can find us responsible for the content that this advertising.",http://mycmag.kantarmediana.com/KMIcmagvidbin2/HOUSE_VA05_VOTEVETSAF_THE_RIGHT_DEMOCRAT.wmv,0.7732577,0.212829736211031
HOUSE_VA05_WEBB_DIRTY_TRICKS,"Dirty tricks are endorsing his campaign. I'm Cameron Webb, and it's important. You hear the truth. I worked for President Obama and Trump, fought insurance and drug companies and support the free market solution to bring health. Care costs down. I approve this message because mr. Good, we deserve better.",http://mycmag.kantarmediana.com/KMIcmagvidbin2/HOUSE_VA05_WEBB_DIRTY_TRICKS.wmv,0.7732577,0.212829736211031
HOUSE_VA05_WEBB_DOCTOR_LAWYER_ADVISOR,I'm Cameron Webb as a doctor and an advisor. We have to do better. I approve this message because we all deserve access to Affordable. Health Care Congress. I'll fight to get it done.,http://mycmag.kantarmediana.com/KMIcmagvidbin2/HOUSE_VA05_WEBB_DOCTOR_LAWYER_ADVISOR.wmv,0.7732577,0.212829736211031
HOUSE_VA05_WEBB_GROWING_UP_HERE_60,"Growing up here in Virginia family came. First a valued Service as an adviser in the white house because we have to do better, like stopping insurance companies from gaming, our system protecting Medicare and lowering the cost of medications and guaranteeing, the free market gives us choices in our care. I work with Democrats Republicans and the president. When they're right and stand up to any party leader when they're wrong. I'm Cameron Webb, and that's why I approve this message.",http://mycmag.kantarmediana.com/KMIcmagvidbin2/HOUSE_VA05_WEBB_GROWING_UP_HERE_60.wmv,0.7732577,0.212829736211031
HOUSE_VA05_WEBB_NAME_ON_A_PAGE,"With my patients, I see no insurance and drug companies. Treat people like a name and a number on a bill. I'm Cameron Webb as a doctor. A member of Virginia's, Medicaid board and Healthcare Drive. In the Obama White House. I know the patients were already living for everyone. I approve this message because we can fix this to make health care. More affordable for all of us.",http://mycmag.kantarmediana.com/KMIcmagvidbin2/HOUSE_VA05_WEBB_NAME_ON_A_PAGE.wmv,0.7732577,0.212829736211031
HOUSE_VA05_WEBB_PRAYER,"Sometimes my patients asked me to pray with them to help them heal, but also talk through their fears of getting their wisdom to make things better. I haven't worked for President Obama and Trump. I've seen Washington focus on the partisan fights instead of working together to put people over party. This message because we need Leaders with the",http://mycmag.kantarmediana.com/KMIcmagvidbin2/HOUSE_VA05_WEBB_PRAYER.wmv,0.7732577,0.212829736211031
HOUSE_VA05_WEBB_REPUBLICAN,"I'm a Campbell County Republican. I'm a fiscal conservative, independent Republican, but I'm supporting doctor, Webb insurance company workers and webs not afraid to take on China. The party is the right man for the job. I'm too and I approve this message.",http://mycmag.kantarmediana.com/KMIcmagvidbin2/HOUSE_VA05_WEBB_REPUBLICAN.wmv,0.7732577,0.212829736211031
HOUSE_VA05_WEBB_REPUBLICANS_60,"Campbell County Republican something else. Bob is a Campbell supervisor position, emergency medical, cost more people, Social Security. I'm Cameron Webb. Then I approve this message.",http://mycmag.kantarmediana.com/KMIcmagvidbin2/HOUSE_VA05_WEBB_REPUBLICANS_60.wmv,0.7732577,0.212829736211031
HOUSE_VA05_WEBB_SHOULD_BE_PAINLESS,"Going here should be painless, but I know patience is terrified of getting a medical bill, that breaks the bank. I'm Cameron Webb and I'm running for congress because healthcare costs are outrageous. Sick. People are avoiding care and even with insurance, they could go bankrupt. I've spent countless hours fighting with insurance companies. That's why I won't take a dime, but their corporate Pac money. I approve this message because it's time the insurance companies hear from us.",http://mycmag.kantarmediana.com/KMIcmagvidbin2/HOUSE_VA05_WEBB_SHOULD_BE_PAINLESS.wmv,0.7732577,0.212829736211031
HOUSE_VA05_WOMENVOTE_TESTED,"Families morning, heartbroken Community stressed, we're being tested in times of Crisis. We need leaders. That's why, I don't know, rain. She's no stranger to tell. She is a new day democrat congress.",http://mycmag.kantarmediana.com/KMIcmagvidbin2/HOUSE_VA05_WOMENVOTE_TESTED.wmv,0.7732577,0.212829736211031
HOUSE_VA05_WOMENVOTE_TOUGH_FIGHTS,"We can't shy away from test B. We need to run right for them. That's Democrat. Claire. Russo, Marine all her life and in Congress, shall protect nurses, and doctors, make Healthcare a right. For every family Democrat, Claire. Russo running for congress. Women vote is responsible for the content of this ad.",http://mycmag.kantarmediana.com/KMIcmagvidbin2/HOUSE_VA05_WOMENVOTE_TOUGH_FIGHTS.wmv,0.7732577,0.212829736211031
HOUSE_VA06_BETTS_FIGHT_HARD_FOR_YOU,"My name is Macbeth's and I'm a fight hard for you. I'll me use the experience. I've gained working in business and education and legal field to fight for affordable. Healthcare affordable, accessible higher education, clean green, renewable energy, source job to protect the environment as well as pay, folks, well, and so that constituents and folks in the United States of America have a high speed internet. I'm Nicholas pets candidate for United States, House of Representatives, and I approve this message.",http://mycmag.kantarmediana.com/KMIcmagvidbin2/HOUSE_VA06_BETTS_FIGHT_HARD_FOR_YOU.wmv,0.7732577,0.212829736211031
HOUSE_VA07_AAN_CRYSTAL_CLEAR_SPANBERGER,"This is about preventing a potentially disastrous outcome from occurring next year. Now. It's Crystal Clear. Their partisan. Impeachment is a politically-motivated, Abigail spanberger promise, but she's not instead of working to secure our border, six Healthcare and pass. Congress woman spanberger, let the voters decide elections vote. No on impeachment.",http://mycmag.kantarmediana.com/KMIcmagvidbin2/HOUSE_VA07_AAN_CRYSTAL_CLEAR_SPANBERGER.wmv,0.7732577,0.212829736211031
HOUSE_VA07_DCCC_CASES,"There been 149,000, coronavirus cases in Virginia. Thanks for Frontline. Health care workers, many every covered. But Nick Freitas, his plan. But Coronavirus.",http://mycmag.kantarmediana.com/KMIcmagvidbin2/HOUSE_VA07_DCCC_CASES.wmv,0.7732577,0.212829736211031
HOUSE_VA07_DCCC_LYING_AD,"Seen. That's why Nick Freitas and the voted to let them deny coverage to people with pre-existing conditions over 700,000 Virginian could lose. Their health care is lying. He doesn't care about our Healthcare.",http://mycmag.kantarmediana.com/KMIcmagvidbin2/HOUSE_VA07_DCCC_LYING_AD.wmv,0.7732577,0.212829736211031
HOUSE_VA07_DCCC_VIRGINIANS_IN_NEED,At a time. When Virginians couldn't be more need companies deny coverage for pre-existing conditions like asthma or diabetes and the health care law protecting Virginia families during this crisis.,http://mycmag.kantarmediana.com/KMIcmagvidbin2/HOUSE_VA07_DCCC_VIRGINIANS_IN_NEED.wmv,0.7732577,0.212829736211031
HOUSE_VA07_EDF_A_LAW_THEY_CAN_AGREE_ON,"It was a long Republicans and Democrats could actually agree on insurance companies. Cover. Nick Freitas, was the only delicate on health coverage for children with autism and he did it twice. Nick Freitas will defend his special interest donors to the Extreme Action boats responsible for the content of this at",http://mycmag.kantarmediana.com/KMIcmagvidbin2/HOUSE_VA07_EDF_A_LAW_THEY_CAN_AGREE_ON.wmv,0.7732577,0.212829736211031
HOUSE_VA07_EDF_FAR_FROM_OVER,The pandemic is far from over existing conditions like asthma. Diabetes. Is he still supports letting insurance companies deny coverage for millions of Virginians with pre-existing conditions for pandemic is far from over. But Nick Freitas is still putting special interest before Virginians PDF action. Boats is responsible for the content of this year.,http://mycmag.kantarmediana.com/KMIcmagvidbin2/HOUSE_VA07_EDF_FAR_FROM_OVER.wmv,0.7732577,0.212829736211031
HOUSE_VA07_FREITAS_DURING_THE_PANDEMIC,"During this pandemic. This is the time where the people who are most vulnerable condition, the elderly need to be careful and provided for by our system because ultimately, our whole Healthcare System is about caring for people. I spent most of my adult life Going In Harm's Way, in order to protect people in Congress. I'll work with you to protect those with pre-existing conditions, and I approve this message.",http://mycmag.kantarmediana.com/KMIcmagvidbin2/HOUSE_VA07_FREITAS_DURING_THE_PANDEMIC.wmv,0.7732577,0.212829736211031
HOUSE_VA07_FREITAS_ROBIN,"I've been a nurse for nearly forty years and single mom raising two, boys. Nick is always cared about people's healthy. A very much about people with pre-existing conditions, whether it's getting them their medication has access to their health care, whatever is necessary because it has a heart for this. He had compassion for people. I know he'll do the same in Congress and I approve this message.",http://mycmag.kantarmediana.com/KMIcmagvidbin2/HOUSE_VA07_FREITAS_ROBIN.wmv,0.7732577,0.212829736211031
HOUSE_VA07_HOUSEMAJFWD_OATH,"In legislation prescription drug costs fighting to broadband, because Abigail spanberger is oath, means country over politics.",http://mycmag.kantarmediana.com/KMIcmagvidbin2/HOUSE_VA07_HOUSEMAJFWD_OATH.wmv,0.7732577,0.212829736211031
HOUSE_VA07_HOUSEMAJPAC_NO_EXCUSE,"Sometimes there's no excuse for this was the only insurance coverage for children with autism, twice against background checks, for daycare employees, feel supported by both parties because it protects our kids, and there's no excuse. Tax responsible for the content of this advertising.",http://mycmag.kantarmediana.com/KMIcmagvidbin2/HOUSE_VA07_HOUSEMAJPAC_NO_EXCUSE.wmv,0.7732577,0.212829736211031
HOUSE_VA07_HOUSEMAJPAC_SUPPOSED_TO_WORK,"Virginia governor supposed to work, Republicans and Democrats came together to insurance companies. Cover children with autism, just one dealt with no necks. Raiders. Were the only delegate to Congress majority, fax responsible for the content of this at",http://mycmag.kantarmediana.com/KMIcmagvidbin2/HOUSE_VA07_HOUSEMAJPAC_SUPPOSED_TO_WORK.wmv,0.7732577,0.212829736211031
HOUSE_VA07_HOUSEMAJPAC_TROUBLING_PATTERN,"It's a troubling pattern, Nick Freitas, 2000 from corporate, special interest and Builder with them against bipartisan bills. 100 times. Freighters was the only legislators to vote. No on health insurance coverage for children with autism twice. He even voted no on background checks for daycare employees breaks a pattern of special interest to the extreme House. Majority. Pac is responsible for the content.",http://mycmag.kantarmediana.com/KMIcmagvidbin2/HOUSE_VA07_HOUSEMAJPAC_TROUBLING_PATTERN.wmv,0.7732577,0.212829736211031
HOUSE_VA07_LCVVF_WE_KNOW,We know Nick Freitas supports a plan to let insurance companies deny coverage to people with pre-existing conditions. But there's more. Nick Freitas took thousands from corporate polluters voted to toxic chemicals. That can contaminate our drinking water against protecting our drinking water from chemicals linked to cancer for Nick Freitas and special interest. Money is more important than our lcv. Victory fund is responsible for the content of this advertising.,http://mycmag.kantarmediana.com/KMIcmagvidbin2/HOUSE_VA07_LCVVF_WE_KNOW.wmv,0.7732577,0.212829736211031
HOUSE_VA07_RNC_BROKE_HER_PROMISE,Abigail spanberger investigations of President Trump wasting tax dollars instead of working to create more jobs more hearings. Tell Abigail spanberger and start getting things done.,http://mycmag.kantarmediana.com/KMIcmagvidbin2/HOUSE_VA07_RNC_BROKE_HER_PROMISE.wmv,0.7732577,0.212829736211031
HOUSE_VA07_SPANBERGER_TOWN_HALLS,In the last two years. I've held 25 town halls in person on the phone and online prescription drug cost. Come up every time. That's why I don't take money from corporate tax. Pharmaceutical companies have too much power already there. I'm leaving the fight to lower the cost of drugs like insulin or to give Medicare the power to negotiate. I approve this message because I'm taking them to get cost down for you.,http://mycmag.kantarmediana.com/KMIcmagvidbin2/HOUSE_VA07_SPANBERGER_TOWN_HALLS.wmv,0.7732577,0.212829736211031
HOUSE_VA07_VOTEVETS_BOB_HATCHER,That Nick Freitas.,http://mycmag.kantarmediana.com/KMIcmagvidbin2/HOUSE_VA07_VOTEVETS_BOB_HATCHER.wmv,0.7732577,0.212829736211031
HOUSE_WA03_DCCC_LOOKING_OUT_FOR_YOU,"Is Jaime, Herrera beutler. Looking out for you? What you looking out for you? And she voted to let insurance companies charge more for pre-existing conditions, during the pandemic. What you looking out for you, when she voted for Trump? Trillion-dollar tax break for corporations, that will raise taxes on middle-class hang out for their bottom line. Not yours. DCCC is responsible for the content of this advertise.",http://mycmag.kantarmediana.com/KMIcmagvidbin2/HOUSE_WA03_DCCC_LOOKING_OUT_FOR_YOU.wmv,0.7732577,0.212829736211031
HOUSE_WA03_HERRERA-BEUTLER_DALE,"We have 21 employees and most of us have been here fifteen years ago. I was already working on a list of food away off for Jaime. Herrera beutler delivers for Southwest, Washington.",http://mycmag.kantarmediana.com/KMIcmagvidbin2/HOUSE_WA03_HERRERA-BEUTLER_DALE.wmv,0.7732577,0.212829736211031
HOUSE_WA03_HERRERA-BEUTLER_DALE_CRITICIZED,"I'm Jaime, Herrera, beutler this message without Jones families. Lose health insurance in politics and saving, jobs, lost jobs. We can't afford care.",http://mycmag.kantarmediana.com/KMIcmagvidbin2/HOUSE_WA03_HERRERA-BEUTLER_DALE_CRITICIZED.wmv,0.7732577,0.212829736211031
HOUSE_WA03_HERRERA-BEUTLER_RADICAL_HEALTHCARE_SCHEME,"I'm Jaime Herrera beutler approve this message. It's a radical healthcare's game that would close Washington, hospitals, killing thousands of jobs, and leave sick and injured patients with nowhere to go. Long's, radicals games would also raise taxes, think families $2,300 more and she raise taxes on small businesses to kill even more jobs, higher taxes, in a recession Hospital closures in a pandemic. We can't afford Carolyn Long,",http://mycmag.kantarmediana.com/KMIcmagvidbin2/HOUSE_WA03_HERRERA-BEUTLER_RADICAL_HEALTHCARE_SCHEME.wmv,0.7732577,0.212829736211031
