alt,transcript,link,alpha,wmp_ratio
USSEN_NC_AFSCME_DR_RICHARD_POMERANTZ,"Apartment. If I got infected working 12-hour shifts to expand, Medicaid for half million trillion numbers because it's Unforgivable.",http://mycmag.kantarmediana.com/KMIcmagvidbin2/USSEN_NC_AFSCME_DR_RICHARD_POMERANTZ.wmv,0.8790079,0.212829736211031
USSEN_NC_AFSCME_TANGLED,Tangled in a campaign money Scandal. Contributors under investigation for laundering donations from the insurance industry and blocking. Medicaid expansion is Cash. Scandal Carolina is the last thing on his mind.,http://mycmag.kantarmediana.com/KMIcmagvidbin2/USSEN_NC_AFSCME_TANGLED.wmv,0.8790079,0.212829736211031
USSEN_NC_CUNNINGHAM_WHEN_I_JOINED,"When I join the Army Reserves, raise my right hand and swore to defend the Constitution, the United States against all enemies. I never thought that one of the greatest threats to our country will be the corruption. We're witnessing in Washington today. This corruption is Medicaid call Cunningham, and I'm running for US Senate to fulfill that of at. That's why I approve this message.",http://mycmag.kantarmediana.com/KMIcmagvidbin2/USSEN_NC_CUNNINGHAM_WHEN_I_JOINED.wmv,0.8790079,0.212829736211031
USSEN_NC_DSCC_JOSIE,"After Josie was born. She spent months in intensive care, insurance. Any Senator Thom Tillis? It's about the money. Not the people. The SEC is responsible for the content of this, a sizing.",http://mycmag.kantarmediana.com/KMIcmagvidbin2/USSEN_NC_DSCC_JOSIE.wmv,0.8790079,0.212829736211031
USSEN_NC_DUTYHONOR_STANDING_UP,"20 mi in a once-in-a-lifetime crisis, some North Carolinians are standing on North Carolinians coverage against funding for the Centers, for Disease, Control against funding, for masks, gloves, and ventilators. And in the midst of a crisis Tillis, even voted against paid sick leave. So tell Tom Tillis, stop cutting health care and put our families first.",http://mycmag.kantarmediana.com/KMIcmagvidbin2/USSEN_NC_DUTYHONOR_STANDING_UP.wmv,0.8790079,0.212829736211031
USSEN_NC_MAJORITYFORWARD_BRAGGED,"The speaker expanding Medicaid Health Coverage to 500 North Carolinians. So, think about this with businesses closed people out of work and thousands infected with the virus. Tell Thom Tillis. Stop cutting out care and put our families first.",http://mycmag.kantarmediana.com/KMIcmagvidbin2/USSEN_NC_MAJORITYFORWARD_BRAGGED.wmv,0.8790079,0.212829736211031
USSEN_NC_MAJORITYFORWARD_FAMILIES_FIRST,"Everyone does it, specially now. Well, maybe not everyone is Thom Tillis and workers should have to wash their hands, really? So that's not off. Till has voted to cut funding for Medicaid, six times. He even voted against funding for masks, gloves, and ventilators. So tell Tom to stop cutting health care and put our families first.",http://mycmag.kantarmediana.com/KMIcmagvidbin2/USSEN_NC_MAJORITYFORWARD_FAMILIES_FIRST.wmv,0.8790079,0.212829736211031
USSEN_NC_MAJORITYFORWARD_SURGING,"Virus searching for hospitals, filled and thousands of North Carolinians have lost their jobs or worse. So think about this when the chance to expand Medicaid to get more people. Health Care coverage, get voted. No leaving half a million North Carolinians without care families, who could really use it right about now. So tell Tom to stop cutting health care and put our families first.",http://mycmag.kantarmediana.com/KMIcmagvidbin2/USSEN_NC_MAJORITYFORWARD_SURGING.wmv,0.8790079,0.212829736211031
USSEN_NC_SMP_DR_RICHARD_POMERANTZ,"How to move to an apartment to my family. Be okay. If I got infected that's hard. 12-hour shifts, trying to Keep Us Alive Insurance chance to expand Medicaid for half million trillions. Virus is hard enough having to do it without health coverage because of Thom Tillis. That's Unforgivable.",http://mycmag.kantarmediana.com/KMIcmagvidbin2/USSEN_NC_SMP_DR_RICHARD_POMERANTZ.wmv,0.8790079,0.212829736211031
USSEN_NC_SMP_ON_THE_BALLOT,"Food, Lion health care about ending protections, for those with pre-existing conditions will protect Healthcare.",http://mycmag.kantarmediana.com/KMIcmagvidbin2/USSEN_NC_SMP_ON_THE_BALLOT.wmv,0.8790079,0.212829736211031
USSEN_NC_SMP_TANGLED,"Campaign money Scandal, contributors under investigation for laundering donations in Medicaid expansion, half-a-million, Carolinians denied coverage Tillis raped in lobbyist cash corruption Scandal Carolina is the last thing on his mind as a responsible for the content of the sack.",http://mycmag.kantarmediana.com/KMIcmagvidbin2/USSEN_NC_SMP_TANGLED.wmv,0.8790079,0.212829736211031
USSEN_NC_VOTEVETS_ONE_OUT_OF_THREE,"1 out of 3, North Carolina and have a pre-existing condition, nearly two million people. And if the Affordable Care Act is repealed, they could fall lose coverage, Cal Cunningham. But that have to fight to guarantee coverage for pre-existing conditions, take on drug companies, jacking up prices and work to finally expand Medicaid Cal Cunningham. And he's the progressive bull fight for us in the Senate.",http://mycmag.kantarmediana.com/KMIcmagvidbin2/USSEN_NC_VOTEVETS_ONE_OUT_OF_THREE.wmv,0.8790079,0.212829736211031
USSEN_NM_LUJAN_CUT_SHORT,"My dad loves life, but it was cut short, lung cancer, from the toxic chemicals being held as an ironworker at Los Alamos. I've been really hot. Mom and dad were lucky to have insurance to many a cancer. Diagnosis means bankruptcy or losing your home. It's why I fought to defend Medicare, and Medicaid and protect people with pre-existing conditions, from losing their Healthcare. I approve this message because I'll always fight for you.",http://mycmag.kantarmediana.com/KMIcmagvidbin2/USSEN_NM_LUJAN_CUT_SHORT.wmv,0.8790079,0.212829736211031
USSEN_SC_GRAHAM_HIGH_PAID_LOBBYIST_3,"You also work as a lobbyist with the podesta group and you Lobby for a hedge fund. A health insurance company, suspended by the government for misleading patients and risking their health for South Carolina, and I approve this message.",http://mycmag.kantarmediana.com/KMIcmagvidbin2/USSEN_SC_GRAHAM_HIGH_PAID_LOBBYIST_3.wmv,0.8790079,0.212829736211031
USSEN_SC_GRAHAM_MEDICAID_FRAUD_15,"In a recent Jamie Harrison said South Carolina should expand Medicaid, but has a high paid lobbyists for a company engaged in Medicaid, fraud. Liberal Democrat Jamie Harrison Carolina from Lindsey Graham, and I approve this message.",http://mycmag.kantarmediana.com/KMIcmagvidbin2/USSEN_SC_GRAHAM_MEDICAID_FRAUD_15.wmv,0.8790079,0.212829736211031
USSEN_SC_HARRISON_GRANDFATHER,"My grandfather worked hard, his whole life until one day. His body just gave out but like too many people. He refused to go to the doctor because we couldn't afford it. I'm Jamie Harrison. No one should have to ignore their help because they can't afford care during a pandemic or ever. We must lower healthcare costs, expand Medicaid and keep rule, hospitals open. I'm Jamie Harrison, and I approve this message to me. This isn't just an issue. It's person.",http://mycmag.kantarmediana.com/KMIcmagvidbin2/USSEN_SC_HARRISON_GRANDFATHER.wmv,0.8790079,0.212829736211031
USSEN_SC_SIS_ALEXA,"Is Jamie Harrison. Jamie Harrison is a liberal Washington, d.c. Crazy is wrong for South Carolina.",http://mycmag.kantarmediana.com/KMIcmagvidbin2/USSEN_SC_SIS_ALEXA.wmv,0.8790079,0.212829736211031
USSEN_SD_AHLERS_ACROSS_PARTY_LINES,"Together, we improve funding education and expanded medicaid. Imagine what we could accomplish. If the economy and Healthcare are not party issues, their people issues together. We can build a better America dollars and I approve this message.",http://mycmag.kantarmediana.com/KMIcmagvidbin2/USSEN_SD_AHLERS_ACROSS_PARTY_LINES.wmv,0.8790079,0.212829736211031
USSEN_VA_WARNER_TRUST_2,"I approve this message through. Can you trust on Healthcare people with pre-existing conditions and a proposed? Expanding Medicaid to 400,000 Virginians Mark? Warner took on insurance companies to protect people with pre-existing conditions and is fighting to lower drug costs. The government has Mark Warner fighting for Virginia.",http://mycmag.kantarmediana.com/KMIcmagvidbin2/USSEN_VA_WARNER_TRUST_2.wmv,0.8790079,0.212829736211031
