alt,transcript,link,alpha,wmp_ratio
USSEN_MT_DAINES_JOE_GOGGINS,"Montana, ranchers and Farmers help, feed the nation and drive the Montana eaconomy, but for Generations foreign corporations and countries like, China and Mexico have ripped us off. Take it from me. No one fights harder for Montana active culture than Steve daines. Senator daines has proven. He has the courage to knock down, trade barriers, take on big corporations and fight to protect Montana jobs. There's no bull from Steve daines. He gets results for Montana. I'm Steve daines, and I approve this message.",http://mycmag.kantarmediana.com/KMIcmagvidbin2/USSEN_MT_DAINES_JOE_GOGGINS.wmv,0.6281049,0.212829736211031
USSEN_MT_DAINES_LYING_TO_YOU,"Is lying to you about China. Here's the truth. I have straight 500 high paying Montana jobs, and I'm fighting against China's unfair, Trade Practices to bring American jobs back home. Steve Bullock is standing with Biden who voted to send millions of American jobs to China and Bullock wasted Montana covid relief dollars to bail out. Chinese investors be both won't take on China, but I am. I'm Steve daines and I approve this message.",http://mycmag.kantarmediana.com/KMIcmagvidbin2/USSEN_MT_DAINES_LYING_TO_YOU.wmv,0.6281049,0.212829736211031
USSEN_MT_DSCC_MONEY_TALKS,"Money talks for Steve, it always has as a businessman James been, 6 years and China opening factories there until company, eliminate a job here. James was paid. Well, and now he's one of the richest members of the senate in DC James has taken $700,000 from drug and insurance companies and voted for times to cut protections for pre-existing conditions would money. Talk keep things. We can't trust him to be for Montana. The SEC is responsible for the content of this at.",http://mycmag.kantarmediana.com/KMIcmagvidbin2/USSEN_MT_DSCC_MONEY_TALKS.wmv,0.6281049,0.212829736211031
USSEN_MT_DSCC_TALKS_TOUGH,"When running for Senator Steve daines, talk stuff about China. When running overseas factories not so much as a corporate executive Dane, spent six years in his company eliminated jobs here. Then things went to Washington and voted for companies that ship jobs overseas Tuesday. Can't trust him to be for Montana. The SEC is responsible for the content of the show.",http://mycmag.kantarmediana.com/KMIcmagvidbin2/USSEN_MT_DSCC_TALKS_TOUGH.wmv,0.6281049,0.212829736211031
USSEN_MT_ONENATION_CRACK_DOWN,"How to crack down on China, Senator Steve daines, find accountable for its coronavirus lies, and bring manufacturing jobs in medical supply chains home. As more information comes to this never happens. Again. Tell Senator Dean keep fighting.",http://mycmag.kantarmediana.com/KMIcmagvidbin2/USSEN_MT_ONENATION_CRACK_DOWN.wmv,0.6281049,0.212829736211031
USSEN_MT_ONENATION_DANGEROUSLY_RELIANT,"The US is still dangerously reliant on China for medical equipment, and prescriptions security is working to bring manufacturing jobs and Supply. Chains back home, this long-overdue a Reliance on China's produce. Our Medical Supply equipment, like PPE, as well as life-saving drugs. Tell Senator Dean. Stay tough on China and keep fighting for American jobs.",http://mycmag.kantarmediana.com/KMIcmagvidbin2/USSEN_MT_ONENATION_DANGEROUSLY_RELIANT.wmv,0.6281049,0.212829736211031
USSEN_MT_SMP_CLIFF,"Times are tough tough in Montana. And this is not telling it straight to us, Dan's lived in China, four years, working for efforts to move factories and jobs to the tune of having 4000 American workers laid off. He's doing the bidding of China and they're calling him China's cheerleader. Death in the United States has been an outright fraud by find that is responsible for the content of this ad.",http://mycmag.kantarmediana.com/KMIcmagvidbin2/USSEN_MT_SMP_CLIFF.wmv,0.6281049,0.212829736211031
USSEN_MT_SMP_GLENDA,"He's not telling us living in China in American corporations set up factories there. An American workers and did their bidding, the Communist Chinese government called said he's not working for us. I just can't trust the Notre, Dame's snp's responsible for the content of this ad.",http://mycmag.kantarmediana.com/KMIcmagvidbin2/USSEN_MT_SMP_GLENDA.wmv,0.6281049,0.212829736211031
USSEN_MT_SMP_WE_PAY_THE_PRICE,"The Steve Dean story starts in China 1994. Steve daines, help an American corporation build factories in China, then they laid off for thousand American workers. Next. Steve daines, went to Congress and refused to crack down on. Unfair Chinese Trade Practices. Danes, kept going back to China after year. All at taxpayer. Expense Steve daines profits. We pay the price is responsible for the content.",http://mycmag.kantarmediana.com/KMIcmagvidbin2/USSEN_MT_SMP_WE_PAY_THE_PRICE.wmv,0.6281049,0.212829736211031
USSEN_NH_MESSNER_USA_PLAN,"We need to bring back the economy. So our families can preserve the American dream. And in my USAA plan. We can provide incentives to American Business to bring manufacturing jobs back to the United States from China and create manufacturing jobs in New Hampshire, government regulation, uncorking messenger. And I approve this message.",http://mycmag.kantarmediana.com/KMIcmagvidbin2/USSEN_NH_MESSNER_USA_PLAN.wmv,0.6281049,0.212829736211031
USSEN_TN_HAGERTY_COVERUP_BUSINESSMAN,"China's cover-up led to the loss of thousands of American lives and the destruction of millions of American jobs. I'm Bill Hagerty, and I want to hit China where it hurts. We need to bring our manufacturing jobs home, and get back to May to the USAA. Bill Hagerty is the businessman and proven job Creator. He'll fight to bring our manufacturing jobs and factories back from China. I approve this message because together we will get American back to work.",http://mycmag.kantarmediana.com/KMIcmagvidbin2/USSEN_TN_HAGERTY_COVERUP_BUSINESSMAN.wmv,0.6281049,0.212829736211031
USSEN_TN_SETHI_A_NICE_GUY,"Why is the establishment of a nice guy like me? Try to get Tennessee to do, trade deals with China? I'm a conservative a doctor. An outsider a Christian pro-life and I'm pro-gun. It's a pretty clear choice. Sure, be grateful for your vote. I'm a nice Fe and I approve this message.",http://mycmag.kantarmediana.com/KMIcmagvidbin2/USSEN_TN_SETHI_A_NICE_GUY.wmv,0.6281049,0.212829736211031
